'EM, ə m
'M, ə m
A'S, ˈeɪ z
A(1), ə
A(2), ˈeɪ
AARGH, ˈɑː g
AARON, ˈɛə ɹ ə n
ABBEY, ˈæ b iː
ABERDEEN, ˈæ b ə d ˌiː n
ABILITIES, ə b ˈɪ l ɪ t iː z
ABILITY, ə b ˈɪ l ɪ t iː
ABLE, ˈeɪ b ə l
ABORIGINAL, ˌæ b ə ɹ ˈɪ dʒ ɪ n ə l
ABORTION, ə b ˈɔː ʃ ə n
ABOUT, ə b ˈaʊ t
ABOVE, ə b ˈɐ v
ABROAD, ə b ɹ ˈɔː d
ABSENCE, ˈæ b s ə n s
ABSENT, ˈæ b s ə n t
ABSOLUTE, ˈæ b s ə l ˌuː t
ABSOLUTELY, ˌæ b s ə l ˈuː t l iː
ABSTRACT(1), æ b s t ɹ ˈæ k t
ABSTRACT(2), ˈæ b s t ɹ ˌæ k t
ABSTRACTS(1), ə b s t ɹ ˈæ k t s
ABSTRACTS(2), ˈæ b s t ɹ ˌæ k t s
ABUSE(1), ə b ˈjuː z
ABUSE(2), ə b ˈjuː s
ACADEMIC, ˌæ k ə d ˈɛ m ɪ k
ACADEMY, ə k ˈæ d ə m iː
ACCELERATOR, æ k s ˈɛ l ə ɹ ˌeɪ t ə
ACCENT(1), ə k s ˈɛ n t
ACCENT(2), ˈæ k s ˌɛ n t
ACCENTS, ˈæ k s ɛ n t s
ACCEPT, ə k s ˈɛ p t
ACCEPTABLE, ə k s ˈɛ p t ə b ə l
ACCEPTANCE, ə k s ˈɛ p t ə n s
ACCEPTED, ə k s ˈɛ p t ɪ d
ACCEPTING, ə k s ˈɛ p t ɪ ŋ
ACCESS, ˈæ k s ˌɛ s
ACCESSED, ˈæ k s ˌɛ s t
ACCESSIBILITY, ˌæ k s ɛ s ɪ b ˈɪ l ɪ t iː
ACCESSIBLE, ə k s ˈɛ s ɪ b ə l
ACCESSING, ˈæ k s ˌɛ s ɪ ŋ
ACCESSORIES, æ k s ˈɛ s ə ɹ iː z
ACCESSORY, æ k s ˈɛ s ə ɹ iː
ACCIDENT, ˈæ k s ɪ d ə n t
ACCIDENTS, ˈæ k s ɪ d ə n t s
ACCOMMODATE, ə k ˈɒ m ə d ˌeɪ t
ACCOMMODATION, ə k ˌɒ m ə d ˈeɪ ʃ ə n
ACCOMMODATIONS, ə k ˌɒ m ə d ˈeɪ ʃ ə n z
ACCOMPANIED, ə k ˈɐ m p ə n ɪ d
ACCOMPLISHED, ə k ˈɒ m p l ɪ ʃ t
ACCORDANCE, ə k ˈɔː d ə n s
ACCORDING, ə k ˈɔː d ɪ ŋ
ACCORDINGLY, ə k ˈɔː d ɪ ŋ l iː
ACCOUNT, ə k ˈaʊ n t
ACCOUNTABILITY, ə k aʊ n t ə b ˈɪ l ɪ t iː
ACCOUNTING, ə k ˈaʊ n t ɪ ŋ
ACCOUNTS, ə k ˈaʊ n t s
ACCREDITED, ə k ɹ ˈɛ d ɪ t ɪ d
ACCURACY, ˈæ k jʊ ɹ ə s iː
ACCURATE, ˈæ k jʊ ɹ ə t
ACCURATELY, ˈæ k jʊ ɹ ə t l iː
ACCUSED, ə k ˈjuː z d
ACE, ˈeɪ s
ACER, ˈeɪ s ə
ACHE, ˈeɪ k
ACHIEVE, ə tʃ ˈiː v
ACHIEVED, ə tʃ ˈiː v d
ACHIEVEMENT, ə tʃ ˈiː v m ə n t
ACHIEVEMENTS, ə tʃ ˈiː v m ə n t s
ACHIEVING, ə tʃ ˈiː v ɪ ŋ
ACID, ˈæ s ɪ d
ACIDS, ˈæ s ɪ d z
ACOUSTIC, ə k ˈuː s t ɪ k
ACQUIRE, ə k w ˈaɪ ə
ACQUIRED, ə k w ˈaɪ ə d
ACQUISITION, ˌæ k w ɪ z ˈɪ ʃ ə n
ACRES, ˈeɪ k ə z
ACROBAT, ˈæ k ɹ ə b ˌæ t
ACROSS, ə k ɹ ˈɒ s
ACT, ˈæ k t
ACTING, ˈæ k t ɪ ŋ
ACTION, ˈæ k ʃ ə n
ACTIONS, ˈæ k ʃ ə n z
ACTIVATED, ˈæ k t ɪ v ˌeɪ t ɪ d
ACTIVATION, ˌæ k t ɪ v ˈeɪ ʃ ə n
ACTIVE, ˈæ k t ɪ v
ACTIVELY, ˈæ k t ɪ v l iː
ACTIVITIES, æ k t ˈɪ v ɪ t iː z
ACTIVITY, æ k t ˈɪ v ɪ t iː
ACTOR, ˈæ k t ə
ACTORS, ˈæ k t ə z
ACTRESS, ˈæ k t ɹ ə s
ACTS, ˈæ k t s
ACTUAL, ˈæ k tʃ ʊə l
ACTUALLY, ˈæ k tʃ ʊə l iː
ACUTE, ə k ˈjuː t
AD, ˈæ d
ADA, ˈeɪ d ə
ADAM, ˈæ d ə m
ADAMS, ˈæ d ə m z
ADAPTER, ə d ˈæ p t ə
ADAPTERS, ə d ˈæ p t ə z
ADD, ˈæ d
ADDED, ˈæ d ɪ d
ADDICTION, ə d ˈɪ k ʃ ə n
ADDING, ˈæ d ɪ ŋ
ADDITION, ə d ˈɪ ʃ ə n
ADDITIONAL(1), ə d ˈɪ ʃ n ə l
ADDITIONAL(2), ə d ˈɪ ʃ ə n ə l
ADDITIONALLY(1), ə d ˈɪ ʃ n ə l iː
ADDITIONALLY(2), ə d ˈɪ ʃ ə n ə l iː
ADDITIONS, ə d ˈɪ ʃ ə n z
ADDRESS, ə d ɹ ˈɛ s
ADDRESSED, ə d ɹ ˈɛ s t
ADDRESSES, ə d ɹ ˈɛ s ɪ z
ADDRESSING, ə d ɹ ˈɛ s ɪ ŋ
ADDS, ˈæ d z
ADELAIDE, ˈæ d ə l ˌeɪ d
ADEQUATE, ˈæ d ɪ k w ə t
ADIDAS, ˈæ d ɪ d ə s
ADJACENT, ə dʒ ˈeɪ s ə n t
ADJUST, ə dʒ ˈɐ s t
ADJUSTABLE, ə dʒ ˈɐ s t ə b ə l
ADJUSTED, ə dʒ ˈɐ s t ɪ d
ADJUSTMENT, ə dʒ ˈɐ s t m ə n t
ADMINISTERED, ə d m ˈɪ n ɪ s t ə d
ADMINISTRATION, ə d m ˌɪ n ɪ s t ɹ ˈeɪ ʃ ə n
ADMINISTRATIVE, ə d m ˈɪ n ɪ s t ɹ ə t ɪ v
ADMINISTRATOR, ə d m ˈɪ n ɪ s t ɹ ˌeɪ t ə
ADMINISTRATORS, ə d m ˈɪ n ɪ s t ɹ ˌeɪ t ə z
ADMISSION, ə d m ˈɪ ʃ ə n
ADMISSIONS(1), æ d m ˈɪ ʃ ə n z
ADMISSIONS(2), ə d m ˈɪ ʃ ə n z
ADMIT, ə d m ˈɪ t
ADMITTED, ə d m ˈɪ t ɪ d
ADOBE, ə d ˈəʊ b iː
ADOPT, ə d ˈɒ p t
ADOPTED, ə d ˈɒ p t ɪ d
ADOPTION, ə d ˈɒ p ʃ ə n
ADRIAN, ˈeɪ d ɹ ɪə n
ADS, ˈæ d z
ADULT(1), ə d ˈɐ l t
ADULT(2), ˈæ d ɐ l t
ADULTS(1), ə d ˈɐ l t s
ADULTS(2), ˈæ d ɐ l t s
ADVANCE, ə d v ˈɑː n s
ADVANCED, ə d v ˈɑː n s t
ADVANCES, ə d v ˈɑː n s ɪ z
ADVANTAGE, ə d v ˈɑː n t ɪ dʒ
ADVANTAGES, ə d v ˈɑː n t ɪ dʒ ɪ z
ADVENTURE, ə d v ˈɛ n tʃ ə
ADVENTURES, ə d v ˈɛ n tʃ ə z
ADVERSE(1), ˈæ d v ɜː s
ADVERSE(2), æ d v ˈɜː s
ADVERTISE, ˈæ d v ə t ˌaɪ z
ADVERTISEMENT(1), ə d v ˈɜː t ɪ s m ə n t
ADVERTISEMENT(2), ə d v ˈɜː t ɪ z m ə n t
ADVERTISEMENTS(1), ə d v ˈɜː t ɪ s m ə n t s
ADVERTISEMENTS(2), ə d v ˈɜː t ɪ z m ə n t s
ADVERTISER, ˈæ d v ə t ˌaɪ z ə
ADVERTISERS, ˈæ d v ə t ˌaɪ z ə z
ADVERTISING, ˈæ d v ə t ˌaɪ z ɪ ŋ
ADVICE, ə d v ˈaɪ s
ADVISE, ə d v ˈaɪ z
ADVISED, ə d v ˈaɪ z d
ADVISOR, ə d v ˈaɪ z ə
ADVISORY, ə d v ˈaɪ z ə ɹ iː
ADVOCACY, ˈæ d v ə k ə s iː
ADVOCATE(1), ˈæ d v ə k ˌeɪ t
ADVOCATE(2), ˈæ d v ə k ɪ t
AERIAL, ˈɛə ɹ ɪə l
AFFAIR, ə f ˈɛə
AFFAIRS, ə f ˈɛə z
AFFECT, ə f ˈɛ k t
AFFECTED, ə f ˈɛ k t ɪ d
AFFECTING, ə f ˈɛ k t ɪ ŋ
AFFECTS, ə f ˈɛ k t s
AFFILIATE(1), ə f ˈɪ l ɪ ˌeɪ t
AFFILIATE(2), ə f ˈɪ l ɪə t
AFFILIATED, ə f ˈɪ l ɪ ˌeɪ t ɪ d
AFFILIATES(1), ə f ˈɪ l ɪ ˌeɪ t s
AFFILIATES(2), ə f ˈɪ l ɪə t s
AFFORD, ə f ˈɔː d
AFFORDABLE, ə f ˈɔː d ə b ə l
AFGHANISTAN(1), æ f g ˈæ n ɪ s t ˌɑː n
AFGHANISTAN(2), æ f g ˈæ n ɪ s t ˌæ n
AFRAID, ə f ɹ ˈeɪ d
AFRICA, ˈæ f ɹ ɪ k ə
AFRICAN, ˈæ f ɹ ɪ k ə n
AFTER, ˈɑː f t ə
AFTERNOON, ˌɑː f t ə n ˈuː n
AFTERNOONS, ˌɑː f t ə n ˈuː n z
AFTERWARDS, ˈɑː f t ə w ə d z
AGAIN(1), ə g ˈɛ n
AGAIN(2), ə g ˈeɪ n
AGAINST(1), ə g ˈɛ n s t
AGAINST(2), ə g ˈeɪ n s t
AGE, ˈeɪ dʒ
AGED(1), ˈeɪ dʒ d
AGED(2), ˈeɪ dʒ ɪ d
AGENCIES, ˈeɪ dʒ ə n s iː z
AGENCY, ˈeɪ dʒ ə n s iː
AGENDA, ə dʒ ˈɛ n d ə
AGENT, ˈeɪ dʒ ə n t
AGENTS, ˈeɪ dʒ ə n t s
AGES, ˈeɪ dʒ ɪ z
AGGREGATE(1), ˈæ g ɹ ɪ g ˌeɪ t
AGGREGATE(2), ˈæ g ɹ ɪ g ɪ t
AGGRESSIVE, ə g ɹ ˈɛ s ɪ v
AGING, ˈeɪ dʒ ɪ ŋ
AGO, ə g ˈəʊ
AGREE, ə g ɹ ˈiː
AGREED, ə g ɹ ˈiː d
AGREEMENT, ə g ɹ ˈiː m ə n t
AGREEMENTS, ə g ɹ ˈiː m ə n t s
AGREES, ə g ɹ ˈiː z
AGRICULTURAL, ˌæ g ɹ ɪ k ˈɐ l tʃ ə ɹ ə l
AGRICULTURE, ˈæ g ɹ ɪ k ˌɐ l tʃ ə
AH, ˈɑː
AHA, ˌɑː h ˈɑː
AHEAD, ə h ˈɛ d
AHH, ˈɑː
AI, ˈɑːɪ
AID, ˈeɪ d
AIDS, ˈeɪ d z
AIM, ˈeɪ m
AIMED, ˈeɪ m d
AIMS, ˈeɪ m z
AIR'S, ˈɛə z
AIR, ˈɛə
AIRCRAFT, ˈɛə k ɹ ˌɑː f t
AIRFARE, ˈɛə f ˌɛə
AIRING, ˈɛə ɹ ɪ ŋ
AIRLINE, ˈɛə l ˌaɪ n
AIRLINES, ˈɛə l ˌaɪ n z
AIRPORT, ˈɛə p ˌɔː t
AIRPORTS, ˈɛə p ˌɔː t s
AIRWAYS, ˈɛə w ˌeɪ z
AITCH, ˈeɪ tʃ
AITCHES, ˈeɪ tʃ ɪ z
AL, ˈæ l
ALABAMA, ˌæ l ə b ˈæ m ə
ALAN, ˈæ l ə n
ALARM, ə l ˈɑː m
ALASKA, ə l ˈæ s k ə
ALBANY, ˈɔː l b ə n iː
ALBERT, ˈæ l b ə t
ALBERTA, æ l b ˈɜː t ə
ALBUM, ˈæ l b ə m
ALBUMS, ˈæ l b ə m z
ALBUQUERQUE, ˈæ l b ə k ˌɜː k iː
ALCOHOL, ˈæ l k ə h ˌɒ l
ALEC, ˈæ l ɪ k
ALERT, ə l ˈɜː t
ALERTS, ə l ˈɜː t s
ALEX, ˈæ l ə k s
ALEXANDER, ˌæ l ɪ g z ˈɑː n d ə
ALFRED, ˈæ l f ɹ ɪ d
ALGORITHM, ˈæ l g ə ɹ ˌɪ ð ə m
ALGORITHMS, ˈæ l g ə ɹ ˌɪ ð ə m z
ALI, ˈɑː l iː
ALIAS, ˈeɪ l ɪə s
ALICE, ˈæ l ɪ s
ALIEN, ˈeɪ l ɪə n
ALIGNMENT, ə l ˈaɪ n m ə n t
ALISON, ˈæ l ɪ s ə n
ALIVE, ə l ˈaɪ v
ALL, ˈɔː l
ALLEGATIONS, ˌæ l ə g ˈeɪ ʃ ə n z
ALLEGED, ə l ˈɛ dʒ d
ALLEN, ˈæ l ə n
ALLERGIC, ə l ˈɜː dʒ ɪ k
ALLIANCE, ə l ˈaɪ ə n s
ALLIED(1), ˈæ l ˌaɪ d
ALLIED(2), ə l ˈaɪ d
ALLIES(1), ə l ˈaɪ z
ALLIES(2), ˈæ l aɪ z
ALLOCATED, ˈæ l ə k ˌeɪ t ɪ d
ALLOCATION, ˌæ l ə k ˈeɪ ʃ ə n
ALLOW, ə l ˈaʊ
ALLOWANCE, ə l ˈaʊ ə n s
ALLOWED, ə l ˈaʊ d
ALLOWING, ə l ˈaʊ ɪ ŋ
ALLOWS, ə l ˈaʊ z
ALMOST, ˈɔː l m ˌəʊ s t
ALONE, ə l ˈəʊ n
ALONG, ə l ˈɒ ŋ
ALONGSIDE, ə l ˈɒ ŋ s ˌaɪ d
ALPHA, ˈæ l f ə
ALPHABETICAL, ˌæ l f ə b ˈɛ t ɪ k ə l
ALPINE, ˈæ l p ˌaɪ n
ALREADY, ɔː l ɹ ˈɛ d iː
ALRIGHT, ˌɔː l ɹ ˈaɪ t
ALSO, ˈɔː l s əʊ
ALTER, ˈɔː l t ə
ALTERED, ˈɔː l t ə d
ALTERNATE(1), ˈɔː l t ə n ˌeɪ t
ALTERNATE(2), ˈɔː l t ə n ə t
ALTERNATIVE, ɔː l t ˈɜː n ə t ɪ v
ALTERNATIVELY, ɔː l t ˈɜː n ə t ɪ v l iː
ALTERNATIVES, ɔː l t ˈɜː n ə t ɪ v z
ALTHOUGH, ˌɔː l ð ˈəʊ
ALTOGETHER, ˌɔː l t ə g ˈɛ ð ə
ALUMINIUM, ˌæ l jʊ m ˈɪ n ɪə m
ALUMINUM, ə l ˈuː m ɪ n ə m
ALUMNI, ə l ˈɐ m n ˌaɪ
ALWAYS(1), ˈɔː l w ɪ z
ALWAYS(2), ˈɔː l w ˌeɪ z
AM, ˈæ m
AMANDA, ə m ˈæ n d ə
AMATEUR(1), ˈæ m ə t ə
AMATEUR(2), ˈæ m ə tʃ ə
AMATEUR(3), ˈæ m ə tʃ ˌjʊə
AMATEUR(4), ˈæ m ə t ˌɜː
AMAZED, ə m ˈeɪ z d
AMAZING, ə m ˈeɪ z ɪ ŋ
AMAZON, ˈæ m ə z ə n
AMBER, ˈæ m b ə
AMBITIOUS, æ m b ˈɪ ʃ ə s
AMBULANCE, ˈæ m b jʊ l ə n s
AMEN(1), ˌeɪ m ˈɛ n
AMEN(2), ˌɑː m ˈɛ n
AMEND, ə m ˈɛ n d
AMENDED, ə m ˈɛ n d ɪ d
AMENDMENT, ə m ˈɛ n d m ə n t
AMENDMENTS, ə m ˈɛ n d m ə n t s
AMENITIES, ə m ˈɛ n ɪ t iː z
AMERICA, ə m ˈɛ ɹ ɪ k ə
AMERICAN, ə m ˈɛ ɹ ɪ k ə n
AMERICANS, ə m ˈɛ ɹ ɪ k ə n z
AMERICAS, ə m ˈɛ ɹ ɪ k ə z
AMINO(1), ə m ˈiː n əʊ
AMINO(2), ə m ˈaɪ n əʊ
AMONG, ə m ˈɐ ŋ
AMONGST, ə m ˈɐ ŋ s t
AMOUNT, ə m ˈaʊ n t
AMOUNTS, ə m ˈaʊ n t s
AMP, ˈæ m p
AMPERSAND, ˈæ m p ə s ˌæ n d
AMSTERDAM, ˈæ m s t ə d ˌæ m
AMY, ˈeɪ m iː
AN(1), ə n
AN(2), ˈæ n
ANAL, ˈeɪ n ə l
ANALOG, ˈæ n ə l ˌɒ g
ANALYSES(1), ˈæ n ə l ˌaɪ z ɪː z
ANALYSES(2), ə n ˈæ l ɪ s ˌiː z
ANALYSIS, ə n ˈæ l ɪ s ɪ s
ANALYST, ˈæ n ə l ɪ s t
ANALYSTS, ˈæ n ə l ɪ s t s
ANALYTICAL, ˌæ n ə l ˈɪ t ɪ k ə l
ANALYZE, ˈæ n ə l ˌaɪ z
ANATOMY, ə n ˈæ t ə m iː
ANCHOR, ˈæ ŋ k ə
ANCIENT, ˈeɪ n ʃ ə n t
AND(1), ə n d
AND(2), ˈæ n d
ANDERSON, ˈæ n d ə s ə n
ANDREA(1), ˈæ n d ɹ ɪə
ANDREA(2), ˌæ n d ɹ ˈeɪ ə
ANDREAS, ɒ n d ɹ ˈeɪ ə s
ANDREW, ˈæ n d ɹ uː
ANDY, ˈæ n d iː
ANGE, ˈeɪ n dʒ
ANGEL, ˈeɪ n dʒ ə l
ANGELA, ˈæ n dʒ ə l ə
ANGELS, ˈeɪ n dʒ ə l z
ANGER, ˈæ ŋ g ə
ANGIE, ˈæ n dʒ iː
ANGLE, ˈæ ŋ g ə l
ANGRY, ˈæ ŋ g ɹ iː
ANIMAL, ˈæ n ɪ m ə l
ANIMALS, ˈæ n ɪ m ə l z
ANIMATED, ˈæ n ɪ m ˌeɪ t ɪ d
ANIMATION, ˌæ n ɪ m ˈeɪ ʃ ə n
ANN, ˈæ n
ANNA, ˈæ n ə
ANNABEL, ˈæ n ə b ˌɛ l
ANNE, ˈæ n
ANNETTE, ə n ˈɛ t
ANNEX(1), ˈæ n ˌɛ k s
ANNEX(2), ə n ˈɛ k s
ANNIE, ˈæ n iː
ANNIVERSARY, ˌæ n ɪ v ˈɜː s ə ɹ iː
ANNOTATION, ˌæ n ə t ˈeɪ ʃ ə n
ANNOUNCE, ə n ˈaʊ n s
ANNOUNCED, ə n ˈaʊ n s t
ANNOUNCEMENT, ə n ˈaʊ n s m ə n t
ANNOUNCEMENTS, ə n ˈaʊ n s m ə n t s
ANNOUNCES, ə n ˈaʊ n s ɪ z
ANNOY, ə n ˈɔɪ
ANNOYED, ə n ˈɔɪ d
ANNOYING, ə n ˈɔɪ ɪ ŋ
ANNOYS, ə n ˈɔɪ z
ANNUAL, ˈæ n jʊə l
ANNUALLY, ˈæ n jʊə l iː
ANONYMOUS, ə n ˈɒ n ə m ə s
ANOTHER, ə n ˈɐ ð ə
ANSWER, ˈɑː n s ə
ANSWERED, ˈɑː n s ə d
ANSWERS, ˈɑː n s ə z
ANTENNA, æ n t ˈɛ n ə
ANTHONY, ˈæ n θ ə n iː
ANTI, ˈæ n t iː
ANTIBIOTICS, ˌæ n t ɪ b aɪ ˈɒ t ɪ k s
ANTICIPATED, æ n t ˈɪ s ɪ p ˌeɪ t ɪ d
ANTIQUE, æ n t ˈiː k
ANTIQUES, æ n t ˈiː k s
ANTONIO, æ n t ˈəʊ n ɪ əʊ
ANXIETY, ˈæ ŋ z ˈaɪ ə t iː
ANXIOUS(1), ˈæ ŋ ʃ ə s
ANXIOUS(2), ˈæ ŋ k ʃ ə s
ANY, ˈɛ n iː
ANYBODY, ˈɛ n ɪ b ə d iː
ANYHOW, ˈɛ n ɪ h ˌaʊ
ANYMORE, ˌɛ n ɪ m ˈɔː
ANYONE(1), ˈɛ n ɪ w ə n
ANYONE(2), ˈɛ n ɪ w ˌɐ n
ANYTHING, ˈɛ n ɪ θ ˌɪ ŋ
ANYTIME, ˈɛ n ɪ t ˌaɪ m
ANYWAY, ˈɛ n ɪ w ˌeɪ
ANYWHERE, ˈɛ n ɪ w ˌɛə
APACHE, ə p ˈæ tʃ iː
APART, ə p ˈɑː t
APARTMENT, ə p ˈɑː t m ə n t
APARTMENTS, ə p ˈɑː t m ə n t s
APOLOGIZE, ə p ˈɒ l ə dʒ ˌaɪ z
APOSTROPHE, ə p ˈɒ s t ɹ ə f iː
APP, ˈæ p
APPAREL, ə p ˈæ ɹ ə l
APPARENT, ə p ˈɛə ɹ ə n t
APPARENTLY, ə p ˈɛə ɹ ə n t l iː
APPEAL, ə p ˈiː l
APPEALS, ə p ˈiː l z
APPEAR, ə p ˈɪə
APPEARANCE, ə p ˈɪə ɹ ə n s
APPEARED, ə p ˈɪə d
APPEARING, ə p ˈɪə ɹ ɪ ŋ
APPEARS, ə p ˈɪə z
APPENDIX, ə p ˈɛ n d ɪ k s
APPLE, ˈæ p ə l
APPLES, ˈæ p ə l z
APPLIANCE, ə p l ˈaɪ ə n s
APPLIANCES, ə p l ˈaɪ ə n s ɪ z
APPLICABLE(1), ˈæ p l ɪ k ə b ə l
APPLICABLE(2), ə p l ˈɪ k ə b ə l
APPLICANT, ˈæ p l ɪ k ə n t
APPLICANTS, ˈæ p l ɪ k ə n t s
APPLICATION, ˌæ p l ɪ k ˈeɪ ʃ ə n
APPLICATIONS, ˌæ p l ɪ k ˈeɪ ʃ ə n z
APPLIED, ə p l ˈaɪ d
APPLIES, ə p l ˈaɪ z
APPLY, ə p l ˈaɪ
APPLYING, ə p l ˈaɪ ɪ ŋ
APPOINTED, ə p ˈɔɪ n t ɪ d
APPOINTMENT, ə p ˈɔɪ n t m ə n t
APPOINTMENTS, ə p ˈɔɪ n t m ə n t s
APPRAISAL, ə p ɹ ˈeɪ z ə l
APPRECIATE, ə p ɹ ˈiː ʃ ɪ ˌeɪ t
APPRECIATED, ə p ɹ ˈiː ʃ ɪ ˌeɪ t ɪ d
APPRECIATION, ə p ɹ ˌiː ʃ ɪ ˈeɪ ʃ ə n
APPROACH, ə p ɹ ˈəʊ tʃ
APPROACHED, ə p ɹ ˈəʊ tʃ t
APPROACHES, ə p ɹ ˈəʊ tʃ ɪ z
APPROPRIATE(1), ə p ɹ ˈəʊ p ɹ ɪə t
APPROPRIATE(2), ə p ɹ ˈəʊ p ɹ ɪ ˌeɪ t
APPROVAL, ə p ɹ ˈuː v ə l
APPROVE, ə p ɹ ˈuː v
APPROVED, ə p ɹ ˈuː v d
APPROXIMATE(1), ə p ɹ ˈɒ k s ɪ m ˌeɪ t
APPROXIMATE(2), ə p ɹ ˈɒ k s ɪ m ə t
APPROXIMATELY, ə p ɹ ˈɒ k s ɪ m ə t l iː
APPS, ˈæ p s
APRIL, ˈeɪ p ɹ ə l
AR, ˈɑː
ARAB, ˈæ ɹ ə b
ARABIA, ə ɹ ˈeɪ b ɪə
ARABIC, ˈæ ɹ ə b ɪ k
ARC, ˈɑː k
ARCADE, ɑː k ˈeɪ d
ARCH, ˈɑː tʃ
ARCHITECT, ˈɑː k ɪ t ˌɛ k t
ARCHITECTS, ˈɑ ɹ k ɪ t ˌɛ k t s
ARCHITECTURAL, ˌɑː k ɪ t ˈɛ k tʃ ə ɹ ə l
ARCHITECTURE, ˈɑː k ɪ t ˌɛ k tʃ ə
ARCHIVE, ˈɑː k ˌaɪ v
ARCHIVES, ˈɑː k ˌaɪ v z
ARCTIC, ˈɑː k t ɪ k
ARE(1), ə
ARE(2), ˈɑː
AREA, ˈɛə ɹ ɪə
AREAS, ˈɛə ɹ ɪə z
ARENA, ə ɹ ˈiː n ə
ARGENTINA, ˌɑː dʒ ə n t ˈiː n ə
ARGUE, ˈɑː g juː
ARGUED, ˈɑː g juː d
ARGUES, ˈɑː g juː z
ARGUING, ˈɑː g juː ɪ ŋ
ARGUMENT, ˈɑː g jʊ m ə n t
ARGUMENTS, ˈɑː g jʊ m ə n t s
ARISE, ə ɹ ˈaɪ z
ARISING, ə ɹ ˈaɪ z ɪ ŋ
ARIZONA, ˌæ ɹ ɪ z ˈəʊ n ə
ARKANSAS, ˈɑː k ə n s ˌɔː
ARLINGTON, ˈɑː l ɪ ŋ t ə n
ARM, ˈɑː m
ARMED, ˈɑː m d
ARMENIA, ɑː m ˈiː n ɪə
ARMS, ˈɑː m z
ARMSTRONG, ˈɑː m s t ɹ ˌɒ ŋ
ARMY, ˈɑː m iː
ARNOLD, ˈɑː n ə l d
AROSE, ə ɹ ˈəʊ z
AROUND, ə ɹ ˈaʊ n d
ARRANGE, ə ɹ ˈeɪ n dʒ
ARRANGED, ə ɹ ˈeɪ n dʒ d
ARRANGEMENT, ə ɹ ˈeɪ n dʒ m ə n t
ARRANGEMENTS, ə ɹ ˈeɪ n dʒ m ə n t s
ARRAY, ə ɹ ˈeɪ
ARREST, ə ɹ ˈɛ s t
ARRESTED, ə ɹ ˈɛ s t ɪ d
ARRIVAL, ə ɹ ˈaɪ v ə l
ARRIVE, ə ɹ ˈaɪ v
ARRIVED, ə ɹ ˈaɪ v d
ARROW, ˈæ ɹ əʊ
ARS, ˈɑː z
ARSEHOLE, ˈɑː s h ˌəʊ l
ARSENAL, ˈɑː s ə n ə l
ART, ˈɑː t
ARTHRITIS, ɑː θ ɹ ˈaɪ t ɪ s
ARTHUR, ˈɑː θ ə
ARTICLE, ˈɑː t ɪ k ə l
ARTICLES, ˈɑː t ɪ k ə l z
ARTIFICIAL, ˈɑː t ɪ f ˈɪ ʃ ə l
ARTIST, ˈɑː t ɪ s t
ARTISTIC, ˈɑː t ˈɪ s t ɪ k
ARTISTS, ˈɑː t ɪ s t s
ARTS, ˈɑː t s
ARTWORK, ˈɑː t w ˌɜː k
AS, ˈæ z
ASCII, ˈæ s k iː
ASDA, ˈæ s d ə
ASH, ˈæ ʃ
ASHLEY, ˈæ ʃ l iː
ASHTRAY, ˈæ ʃ t ɹ ˌeɪ
ASIA(1), ˈeɪ ʃ ə
ASIA(2), ˈeɪ ʒ ə
ASIAN(1), ˈeɪ ʃ ə n
ASIAN(2), ˈeɪ ʒ ə n
ASIDE, ə s ˈaɪ d
ASK, ˈɑː s k
ASKED, ˈɑː s k t
ASKING, ˈɑː s k ɪ ŋ
ASKS, ˈɑː s k s
ASLEEP, ə s l ˈiː p
ASPECT, ˈæ s p ˌɛ k t
ASPECTS, ˈæ s p ˌɛ k t s
ASS, ˈɑː s
ASSAULT, ə s ˈɔː l t
ASSEMBLY, ə s ˈɛ m b l iː
ASSESS, ə s ˈɛ s
ASSESSED, ə s ˈɛ s t
ASSESSMENT, ə s ˈɛ s m ə n t
ASSESSMENTS, ə s ˈɛ s m ə n t s
ASSET, ˈæ s ˌɛ t
ASSETS, ˈæ s ˌɛ t s
ASSIGN, ə s ˈaɪ n
ASSIGNED, ə s ˈaɪ n d
ASSIGNMENT, ə s ˈaɪ n m ə n t
ASSIGNMENTS, ə s ˈaɪ n m ə n t s
ASSIST, ə s ˈɪ s t
ASSISTANCE, ə s ˈɪ s t ə n s
ASSISTANT, ə s ˈɪ s t ə n t
ASSISTED, ə s ˈɪ s t ɪ d
ASSOCIATE(1), ə s ˈəʊ ʃ ɪ ˌeɪ t
ASSOCIATE(2), ə s ˈəʊ s ɪ ˌeɪ t
ASSOCIATE(3), ə s ˈəʊ ʃ ɪə t
ASSOCIATE(4), ə s ˈəʊ s ɪə t
ASSOCIATED(1), ə s ˈəʊ s ɪ ˌeɪ t ɪ d
ASSOCIATED(2), ə s ˈəʊ ʃ ɪ ˌeɪ t ɪ d
ASSOCIATES(1), ə s ˈəʊ ʃ ɪ ˌeɪ t s
ASSOCIATES(2), ə s ˈəʊ s ɪ ˌeɪ t s
ASSOCIATES(3), ə s ˈəʊ ʃ ɪə t s
ASSOCIATES(4), ə s ˈəʊ s ɪə t s
ASSOCIATION(1), ə s ˌəʊ s ɪ ˈeɪ ʃ ə n
ASSOCIATION(2), ə s ˌəʊ ʃ ɪ ˈeɪ ʃ ə n
ASSOCIATIONS(1), ə s ˌəʊ s ɪ ˈeɪ ʃ ə n z
ASSOCIATIONS(2), ə s ˌəʊ ʃ ɪ ˈeɪ ʃ ə n z
ASSUME, ə s ˈjuː m
ASSUMED, ə s ˈjuː m d
ASSUMES, ə s ˈjuː m z
ASSUMING, ə s ˈjuː m ɪ ŋ
ASSUMPTION, ə s ˈɐ m p ʃ ə n
ASSUMPTIONS, ə s ˈɐ m p ʃ ə n z
ASSURANCE, ə ʃ ˈʊə ɹ ə n s
ASSURE(1), ə ʃ ˈʊə
ASSURE(2), ə ʃ ˈɔː
ASTERISK, ˈɑː s t ə ɹ ɪ s k
ASTHMA, ˈæ z m ə
ASTRONOMY, ə s t ɹ ˈɒ n ə m iː
AT, ˈæ t
ATE, ˈeɪ t
ATHENS, ˈæ θ ə n z
ATHLETES, ˈæ θ l ˌiː t s
ATHLETIC, æ θ l ˈɛ t ɪ k
ATHLETICS, æ θ l ˈɛ t ɪ k s
ATLANTA(1), æ t l ˈæ n t ə
ATLANTA(2), ə t l ˈæ n t ə
ATLANTIC, ə t l ˈæ n t ɪ k
ATLAS, ˈæ t l ə s
ATMOSPHERE, ˈæ t m ə s f ˌɪə
ATOM, ˈæ t ə m
ATOMIC, ə t ˈɒ m ɪ k
ATTACH, ə t ˈæ tʃ
ATTACHED, ə t ˈæ tʃ t
ATTACHMENT, ə t ˈæ tʃ m ə n t
ATTACHMENTS, ə t ˈæ tʃ m ə n t s
ATTACK, ə t ˈæ k
ATTACKS, ə t ˈæ k s
ATTEMPT, ə t ˈɛ m p t
ATTEMPTED, ə t ˈɛ m p t ɪ d
ATTEMPTING, ə t ˈɛ m p t ɪ ŋ
ATTEMPTS, ə t ˈɛ m p t s
ATTEND, ə t ˈɛ n d
ATTENDANCE, ə t ˈɛ n d ə n s
ATTENDED, ə t ˈɛ n d ɪ d
ATTENDING, ə t ˈɛ n d ɪ ŋ
ATTENTION, ə t ˈɛ n ʃ ə n
ATTITUDE, ˈæ t ɪ t ˌjuː d
ATTITUDES, ˈæ t ɪ t ˌjuː d z
ATTORNEY, ə t ˈɜː n iː
ATTORNEYS, ə t ˈɜː n iː z
ATTRACT, ə t ɹ ˈæ k t
ATTRACTION, ə t ɹ ˈæ k ʃ ə n
ATTRACTIONS, ə t ɹ ˈæ k ʃ ə n z
ATTRACTIVE, ə t ɹ ˈæ k t ɪ v
ATTRIBUTE(1), ˈæ t ɹ ɪ b ˌjuː t
ATTRIBUTE(2), ə t ɹ ˈɪ b ˌjuː t
ATTRIBUTES(1), ˈæ t ɹ ɪ b ˌjuː t s
ATTRIBUTES(2), ə t ɹ ˈɪ b ˌjuː t s
AUCKLAND, ˈɔː k l ə n d
AUCTION, ˈɔː k ʃ ə n
AUCTIONS, ˈɔː k ʃ ə n z
AUDI, ˈaʊ d iː
AUDIENCE, ˈɔː d ɪə n s
AUDIO, ˈɔː d iː ˌəʊ
AUDIT, ˈɔː d ɪ t
AUDREY, ˈɔː d ɹ iː
AUGUST, ˈɔː g ə s t
AUNT, ˈɑː n t
AUNTIE, ˈɑː n t iː
AURORA, ɔː ɹ ˈɔː ɹ ə
AUSTIN(1), ˈɒ s t ɪ n
AUSTIN(2), ˈɔː s t ɪ n
AUSTRALIA, ɒ s t ɹ ˈeɪ l ɪə
AUSTRALIAN, ɒ s t ɹ ˈeɪ l ɪə n
AUSTRIA, ˈɒ s t ɹ ɪə
AUTHENTIC, ɔː θ ˈɛ n t ɪ k
AUTHENTICATION, ɔː θ ˌɛ n t ɪ k ˈeɪ ʃ ə n
AUTHOR, ˈɔː θ ə
AUTHORITIES, ɔː θ ˈɒ ɹ ɪ t iː z
AUTHORITY, ɔː θ ˈɒ ɹ ɪ t iː
AUTHORIZATION, ˌɔː θ ə ɹ aɪ z ˈeɪ ʃ ə n
AUTHORIZED, ˈɔː θ ə ɹ ˌaɪ z d
AUTHORS, ˈɔː θ ə z
AUTO, ˈɔː t əʊ
AUTOMATED, ˈɔː t ə m ˌeɪ t ɪ d
AUTOMATIC, ˌɔː t ə m ˈæ t ɪ k
AUTOMATICALLY, ˌɔː t ə m ˈæ t ɪ k l iː
AUTOMATION, ɔː t ə m ˈeɪ ʃ ə n
AUTOMOBILE, ˌɔː t ə m ə b ˈiː l
AUTOMOTIVE, ˌɔː t ə m ˈəʊ t ɪ v
AUTONOMY, ɔː t ˈɒ n ə m iː
AUTOS, ˈɔː t əʊ z
AUTUMN, ˈɔː t ə m
AVAILABILITY, ə v ˌeɪ l ə b ˈɪ l ɪ t iː
AVAILABLE, ə v ˈeɪ l ə b ə l
AVATAR, ˈæ v ə t ɑː
AVENUE, ˈæ v ə n ˌjuː
AVERAGE(1), ˈæ v ɹ ɪ dʒ
AVERAGE(2), ˈæ v ə ɹ ɪ dʒ
AVIATION, ˌeɪ v ɪ ˈeɪ ʃ ə n
AVOID, ə v ˈɔɪ d
AVON, ˈeɪ v ə n
AWAKE, ə w ˈeɪ k
AWARD, ə w ˈɔː d
AWARDED, ə w ˈɔː d ɪ d
AWARDS, ə w ˈɔː d z
AWARE, ə w ˈɛə
AWARENESS, ə w ˈɛə n ə s
AWAY, ə w ˈeɪ
AWESOME, ˈɔː s ə m
AWFUL, ˈɔː f ə l
AWFULLY(1), ˈɔː f l iː
AWFULLY(2), ˈɔː f ə l iː
AWKWARD, ˈɔː k w ə d
AXIS, ˈæ k s ɪ s
AY(1), ˈaɪ
AY(2), ˈeɪ
AYE(1), ˈaɪ
BABE, b ˈeɪ b
BABES, b ˈeɪ b z
BABIES, b ˈeɪ b iː z
BABY, b ˈeɪ b iː
BABYSITTING, b ˈeɪ b ɪ s ˌɪ t ɪ ŋ
BACHELOR(1), b ˈæ tʃ ə l ə
BACHELOR(2), b ˈæ tʃ l ə
BACK, b ˈæ k
BACKED, b ˈæ k t
BACKGROUND, b ˈæ k g ɹ ˌaʊ n d
BACKGROUNDS, b ˈæ k g ɹ ˌaʊ n d z
BACKING, b ˈæ k ɪ ŋ
BACKS, b ˈæ k s
BACKSIDE, b ˈæ k s ˌaɪ d
BACKUP, b ˈæ k ˌɐ p
BACKWARDS, b ˈæ k w ə d z
BACON, b ˈeɪ k ə n
BACTERIA, b æ k t ˈɪə ɹ ɪə
BAD, b ˈæ d
BADGE, b ˈæ dʒ
BADLY, b ˈæ d l iː
BAG, b ˈæ g
BAGGY, b ˈæ g iː
BAGS, b ˈæ g z
BAHAMAS, b ə h ˈɑː m ə z
BAILEY, b ˈeɪ l iː
BAKED, b ˈeɪ k t
BAKER, b ˈeɪ k ə
BALANCE, b ˈæ l ə n s
BALANCED, b ˈæ l ə n s t
BALCONY, b ˈæ l k ə n iː
BALD, b ˈɔː l d
BALI, b ˈɑː l iː
BALL, b ˈɔː l
BALLOON, b ə l ˈuː n
BALLOONS, b ə l ˈuː n z
BALLS, b ˈɔː l z
BALTIMORE, b ˈɔː l t ɪ m ˌɔː
BAN, b ˈæ n
BANANA, b ə n ˈɑː n ə
BANANAS, b ə n ˈɑː n ə z
BANCORP, b ˈæ ŋ k ˌɔː p
BAND, b ˈæ n d
BANDS, b ˈæ n d z
BANDWIDTH, b ˈæ n d w ɪ d θ
BANG, b ˈæ ŋ
BANGING, b ˈæ ŋ ɪ ŋ
BANGKOK(1), b ˈæ ŋ k ɒ k
BANGKOK(2), b æ ŋ k ˈɒ k
BANGLADESH, b ˈæ ŋ l ə d ˌɛ ʃ
BANK, b ˈæ ŋ k
BANKING, b ˈæ ŋ k ɪ ŋ
BANKRUPTCY(1), b ˈæ ŋ k ɹ ɐ p t s iː
BANKRUPTCY(2), b ˈæ ŋ k ɹ ə p t s iː
BANKS, b ˈæ ŋ k s
BANNER, b ˈæ n ə
BAPTIST, b ˈæ p t ɪ s t
BAR, b ˈɑː
BARBADOS, b ɑː b ˈeɪ d əʊ s
BARBARA(1), b ˈɑː b ɹ ə
BARBARA(2), b ˈɑː b ə ɹ ə
BARBECUE, b ˈɑː b ɪ k ˌjuː
BARCELONA, b ˌɑː s ɪ l ˈəʊ n ə
BARE, b ˈɛə
BARELY, b ˈɛə l iː
BARGAIN, b ˈɑː g ɪ n
BARGAINS, b ˈɑː g ɪ n z
BARKING, b ˈɑː k ɪ ŋ
BARN, b ˈɑː n
BARNES, b ˈɑː n z
BARREL, b ˈæ ɹ ə l
BARRIER, b ˈæ ɹ ɪə
BARRIERS, b ˈæ ɹ ɪə z
BARRY, b ˈæ ɹ iː
BARS, b ˈɑː z
BASE, b ˈeɪ s
BASEBALL, b ˈeɪ s b ˌɔː l
BASED, b ˈeɪ s t
BASELINE, b ˈeɪ s l ˌaɪ n
BASES, b ˈeɪ s ɪ z
BASIC, b ˈeɪ s ɪ k
BASICALLY, b ˈeɪ s ɪ k l iː
BASICS, b ˈeɪ s ɪ k s
BASIN, b ˈeɪ s ɪ n
BASIS, b ˈeɪ s ɪ s
BASKET, b ˈɑː s k ɪ t
BASKETBALL, b ˈɑː s k ɪ t b ˌɔː l
BASKETS, b ˈɑː s k ɪ t s
BASS(1), b ˈæ s
BASS(2), b ˈeɪ s
BASTARD, b ˈɑː s t ə d
BASTARDS, b ˈɑː s t ə d z
BAT, b ˈæ t
BATCH, b ˈæ tʃ
BATH, b ˈɑː θ
BATHROOM, b ˈɑː θ ɹ ˌuː m
BATHROOMS, b ˈɑː θ ɹ ˌuː m z
BATHS, b ˈɑː θ s
BATTERIES, b ˈæ t ə ɹ iː z
BATTERY, b ˈæ t ə ɹ iː
BATTLE, b ˈæ t ə l
BATTLEFIELD, b ˈæ t ə l f ˌiː l d
BAY, b ˈeɪ
BE(1), b ɪ
BE(2), b ˈiː
BEACH, b ˈiː tʃ
BEACHES, b ˈiː tʃ ɪ z
BEADS, b ˈiː d z
BEAM, b ˈiː m
BEAN, b ˈiː n
BEANS, b ˈiː n z
BEAR, b ˈɛə
BEARD, b ˈɪə d
BEARING, b ˈɛə ɹ ɪ ŋ
BEARS, b ˈɛə z
BEAST, b ˈiː s t
BEAT, b ˈiː t
BEATEN, b ˈiː t ə n
BEATING, b ˈiː t ɪ ŋ
BEATLES, b ˈiː t ə l z
BEAUTIFUL, b ˈjuː t ə f ə l
BEAUTIFULLY, b ˈjuː t ə f l iː
BEAUTY, b ˈjuː t iː
BEAVER, b ˈiː v ə
BECAME, b ɪ k ˈeɪ m
BECAUSE(1), b ɪ k ˈɒ z
BECAUSE(2), b ɪ k ˈə z
BECKY, b ˈɛ k iː
BECOME, b ɪ k ˈɐ m
BECOMES, b ɪ k ˈɐ m z
BECOMING, b ɪ k ˈɐ m ɪ ŋ
BED, b ˈɛ d
BEDDING, b ˈɛ d ɪ ŋ
BEDFORD, b ˈɛ d f ə d
BEDROOM, b ˈɛ d ɹ ˌuː m
BEDROOMS, b ˈɛ d ɹ ˌuː m z
BEDS, b ˈɛ d z
BEE, b ˈiː
BEEF, b ˈiː f
BEEN(1), b ɪ n
BEEN(2), b ˈiː n
BEEN, b ˈɪ n
BEEP, b ˈiː p
BEER, b ˈɪə
BEES, b ˈiː z
BEETHOVEN, b ˌeɪ t ˈəʊ v ə n
BEFORE, b ɪ f ˈɔː
BEG, b ˈɛ g
BEGAN, b ɪ g ˈæ n
BEGIN, b ɪ g ˈɪ n
BEGINNING, b ɪ g ˈɪ n ɪ ŋ
BEGINS, b ɪ g ˈɪ n z
BEGUN, b ɪ g ˈɐ n
BEHALF, b ɪ h ˈɑː f
BEHAVIOR, b ɪ h ˈeɪ v j ə
BEHAVIORAL, b ɪ h ˈeɪ v j ə ɹ ə l
BEHAVIOUR, b ɪ h ˈeɪ v j ə
BEHIND, b ɪ h ˈaɪ n d
BEIJING, b ˌeɪ ʒ ˈɪ ŋ
BEING, b ˈiː ɪ ŋ
BEINGS, b ˈiː ɪ ŋ z
BELARUS(1), b ˌɛ l ə r ˈuː s
BELARUS(2), b ˈɛ l ə r ˌʊ s
BELFAST, b ˈɛ l f ˌɑː s t
BELGIUM, b ˈɛ l dʒ ə m
BELIEF, b ɪ l ˈiː f
BELIEFS, b ɪ l ˈiː f s
BELIEVE, b ɪ l ˈiː v
BELIEVED, b ɪ l ˈiː v d
BELIEVES, b ɪ l ˈiː v z
BELIZE(1), b ɛ l ˈiː z
BELIZE(2), b ə l ˈiː z
BELL, b ˈɛ l
BELLS, b ˈɛ l z
BELLY, b ˈɛ l iː
BELONG, b ɪ l ˈɒ ŋ
BELONGS, b ɪ l ˈɒ ŋ z
BELOW, b ɪ l ˈəʊ
BELT, b ˈɛ l t
BEN, b ˈɛ n
BENCH, b ˈɛ n tʃ
BEND, b ˈɛ n d
BENEATH, b ɪ n ˈiː θ
BENEFICIAL, b ˌɛ n ɪ f ˈɪ ʃ ə l
BENEFIT, b ˈɛ n ə f ɪ t
BENEFITS, b ˈɛ n ə f ɪ t s
BENJAMIN, b ˈɛ n dʒ ə m ɪ n
BENJY, b ˈɛ n dʒ iː
BENNETT(1), b ˈɛ n ə t
BENNETT(2), b ˈɛ n ɪ t
BENZ, b ˈɛ n z
BERKELEY, b ˈɜː k l iː
BERKSHIRE(1), b ˈɑː k ʃ ə
BERKSHIRE(2), b ˈɑː k ʃ ˌɪə
BERLIN, b ə l ˈɪ n
BERMUDA, b ə m ˈjuː d ə
BERNARD, b ˈɜː n ə d
BERNIE, b ˈɜː n iː
BERRY, b ˈɛ ɹ iː
BESIDE, b ɪ s ˈaɪ d
BESIDES, b ɪ s ˈaɪ d z
BEST, b ˈɛ s t
BESTIALITY, b ˌɛ s t ɪ ˈæ l ɪ t iː
BESTSELLERS, b ˈɛ s t s ˌɛ l ə z
BET, b ˈɛ t
BETA, b ˈiː t ə
BETTER, b ˈɛ t ə
BETTING, b ˈɛ t ɪ ŋ
BETTY, b ˈɛ t iː
BETWEEN, b ɪ t w ˈiː n
BEV, b ˈɛ v
BEVERAGE(1), b ˈɛ v ɹ ɪ dʒ
BEVERAGE(2), b ˈɛ v ə ɹ ɪ dʒ
BEVERLEY, b ˈɛ v ə l iː
BEVERLY, b ˈɛ v ə l iː
BEYOND, b ɪ j ˈɒ n d
BI, b ˈaɪ
BIAS, b ˈaɪ ə s
BIB, b ˈɪ b
BIBLE, b ˈaɪ b ə l
BIBLIOGRAPHY, b ˌɪ b l ɪ ˈɒ g ɹ ə f iː
BICYCLE, b ˈaɪ s ɪ k ə l
BID, b ˈɪ d
BIDDER, b ˈɪ d ə
BIDDING, b ˈɪ d ɪ ŋ
BIDS, b ˈɪ d z
BIG, b ˈɪ g
BIGGER, b ˈɪ g ə
BIGGEST, b ˈɪ g ə s t
BIKE, b ˈaɪ k
BIKES, b ˈaɪ k s
BIKINI, b ɪ k ˈiː n iː
BILL, b ˈɪ l
BILLING, b ˈɪ l ɪ ŋ
BILLION, b ˈɪ l j ə n
BILLS, b ˈɪ l z
BILLY, b ˈɪ l iː
BIN, b ˈɪ n
BINARY, b ˈaɪ n ə ɹ iː
BINDING, b ˈaɪ n d ɪ ŋ
BINGO, b ˈɪ ŋ g əʊ
BIOGRAPHIES, b aɪ ˈɒ g ɹ ə f iː z
BIOGRAPHY, b aɪ ˈɒ g ɹ ə f iː
BIOLOGICAL, b aɪ ə l ˈɒ dʒ ɪ k ə l
BIOLOGY, b aɪ ˈɒ l ə dʒ iː
BIOS, b ˈaɪ ə s
