'EM, ə m
IVY, ˈaɪ v iː
JA, j ˈɑː
JACK, dʒ ˈæ k
JACKET, dʒ ˈæ k ɪ t
JACKETS, dʒ ˈæ k ɪ t s
JACKIE, dʒ ˈæ k iː
JACKSON, dʒ ˈæ k s ə n
JACKSONVILLE, dʒ ˈæ k s ə n v ˌɪ l
JACOB, dʒ ˈeɪ k ə b
JACQUELINE(1), dʒ ˈæ k l ɪ n
JACQUELINE(2), dʒ ˈæ k ə l ɪ n
JACQUES, dʒ ˈæ k
JAIL, dʒ ˈeɪ l
JAKE, dʒ ˈeɪ k
JAM, dʒ ˈæ m
JAMAICA, dʒ ə m ˈeɪ k ə
JAMES, dʒ ˈeɪ m z
JAMIE, dʒ ˈeɪ m iː
JAN, dʒ ˈæ n
JANE, dʒ ˈeɪ n
JANET, dʒ ˈæ n ɪ t
JANUARY, dʒ ˈæ n jʊə ɹ iː
JAPAN, dʒ ə p ˈæ n
JAPANESE, dʒ ˌæ p ə n ˈiː z
JAR, dʒ ˈɑː
JASON, dʒ ˈeɪ s ə n
JAVA, dʒ ˈɑː v ə
JAVASCRIPT, dʒ ˈɑː v ə s k ɹ ˌɪ p t
JAW, dʒ ˈɔː
JAY, dʒ ˈeɪ
JAYS, dʒ ˈeɪ z
JAZZ, dʒ ˈæ z
JEALOUS, dʒ ˈɛ l ə s
JEAN, dʒ ˈiː n
JEANS, dʒ ˈiː n z
JEEP, dʒ ˈiː p
JEFF, dʒ ˈɛ f
JEFFERSON, dʒ ˈɛ f ə s ə n
JEFFREY, dʒ ˈɛ f ɹ iː
JEHOVAH, dʒ ɪ h ˈəʊ v ə
JELLY, dʒ ˈɛ l iː
JENNIFER, dʒ ˈɛ n ɪ f ə
JENNY, dʒ ˈɛ n iː
JEREMY, dʒ ˈɛ ɹ ə m iː
JERRY, dʒ ˈɛ ɹ iː
JERSEY, dʒ ˈɜː z iː
JERUSALEM, dʒ ə ɹ ˈuː s ə l ə m
JESSICA, dʒ ˈɛ s ɪ k ə
JESSIE, dʒ ˈɛ s iː
JESUS, dʒ ˈiː z ə s
JET, dʒ ˈɛ t
JEWELRY(1), dʒ ˈuː ə l ɹ iː
JEWELRY(2), dʒ ˈuː l ɹ iː
JEWISH, dʒ ˈuː ɪ ʃ
JEWS, dʒ ˈuː z
JIGSAW, dʒ ˈɪ g s ˌɔː
JILL, dʒ ˈɪ l
JIM, dʒ ˈɪ m
JIMMY, dʒ ˈɪ m iː
JO, dʒ ˈəʊ
JOAN, dʒ ˈəʊ n
JOANNA, dʒ əʊ ˈæ n ə
JOANNE, dʒ ˌəʊ ˈæ n
JOB(1), dʒ ˈɒ b
JOB(2), dʒ ˈəʊ b
JOBS, dʒ ˈɒ b z
JOE, dʒ ˈəʊ
JOEL, dʒ ˈəʊ ə l
JOEY, dʒ ˈəʊ iː
JOHN, dʒ ˈɒ n
JOHNNY, dʒ ˈɒ n iː
JOHNS, dʒ ˈɒ n z
JOHNSON, dʒ ˈɒ n s ə n
JOIN, dʒ ˈɔɪ n
JOINED, dʒ ˈɔɪ n d
JOINING, dʒ ˈɔɪ n ɪ ŋ
JOINT, dʒ ˈɔɪ n t
JOINTS, dʒ ˈɔɪ n t s
JOKE, dʒ ˈəʊ k
JOKES, dʒ ˈəʊ k s
JOKING, dʒ ˈəʊ k ɪ ŋ
JOLLY, dʒ ˈɒ l iː
JON, dʒ ˈɒ n
JONATHAN, dʒ ˈɒ n ə θ ə n
JONES, dʒ ˈəʊ n z
JORDAN, dʒ ˈɔː d ə n
JOSE, h ˌəʊ z ˈeɪ
JOSEPH(1), dʒ ˈəʊ s ə f
JOSEPH(2), dʒ ˈəʊ z ə f
JOSH, dʒ ˈɒ ʃ
JOSHUA, dʒ ˈɒ ʃ ʊə
JOSIE, dʒ ˈəʊ z iː
JOURNAL, dʒ ˈɜː n ə l
JOURNALISM, dʒ ˈɜː n ə l ˌɪ z ə m
JOURNALISTS, dʒ ˈɜː n ə l ɪ s t s
JOURNALS, dʒ ˈɜː n ə l z
JOURNEY, dʒ ˈɜː n iː
JOY, dʒ ˈɔɪ
JOYCE, dʒ ˈɔɪ s
JU, dʒ ˈuː
JUAN, h w ˈɑː n
JUDGE, dʒ ˈɐ dʒ
JUDGEMENT, dʒ ˈɐ dʒ m ə n t
JUDGES, dʒ ˈɐ dʒ ɪ z
JUDGMENT, dʒ ˈɐ dʒ m ə n t
JUDICIAL, dʒ uː d ˈɪ ʃ ə l
JUDITH, dʒ ˈuː d ɪ θ
JUDY, dʒ ˈuː d iː
JUG, dʒ ˈɐ g
JUICE, dʒ ˈuː s
JUICY, dʒ ˈuː s iː
JULIA, dʒ ˈuː l ɪə
JULIAN(1), dʒ ˈuː l j ə n
JULIAN(2), dʒ ˈuː l ɪə n
JULIE, dʒ ˈuː l iː
JULIEN, dʒ ˈuː l ɪə n
JULIET, dʒ ˈuː l ɪ ˌɛ t
JULY(1), dʒ ə l ˈaɪ
JULY(2), dʒ ˌʊ l ˈaɪ
JUMP, dʒ ˈɐ m p
JUMPED, dʒ ˈɐ m p t
JUMPER, dʒ ˈɐ m p ə
JUMPERS, dʒ ˈɐ m p ə z
JUMPING, dʒ ˈɐ m p ɪ ŋ
JUMPS, dʒ ˈɐ m p s
JUNCTION, dʒ ˈɐ ŋ k ʃ ə n
JUNE, dʒ ˈuː n
JUNGLE, dʒ ˈɐ ŋ g ə l
JUNIOR, dʒ ˈuː n j ə
JURISDICTION, dʒ ˌʊə ɹ ɪ s d ˈɪ k ʃ ə n
JURY, dʒ ˈʊə ɹ iː
JUS(1), dʒ ˈuː
JUS(2), dʒ ˈɐ s
JUST(1), dʒ ə s t
JUST(2), dʒ ˈɐ s t
JUSTICE, dʒ ˈɐ s t ɪ s
JUSTIFICATION, dʒ ˌɐ s t ɪ f ɪ k ˈeɪ ʃ ə n
JUSTIFY, dʒ ˈɐ s t ɪ f ˌaɪ
JUSTIN, dʒ ˈɐ s t ɪ n
JUVENILE, dʒ ˈuː v ə n ˌaɪ l
KANSAS, k ˈæ n z ə s
KARAOKE, k ˌæ ɹ ɪ ˈəʊ k iː
KARATE, k ə ɹ ˈɑː t iː
KAREN, k ˈæ ɹ ə n
KARL, k ˈɑː l
KATE, k ˈeɪ t
KATH, k ˈæ θ
KATHLEEN, k ˈæ θ l ˈiː n
KATHY, k ˈæ θ iː
KATIE, k ˈeɪ t iː
KATRINA, k ə t ɹ ˈiː n ə
KAY, k ˈeɪ
KAYS, k ˈeɪ z
KEEN, k ˈiː n
KEEP, k ˈiː p
KEEPING, k ˈiː p ɪ ŋ
KEEPS, k ˈiː p s
KEITH, k ˈiː θ
KELLY, k ˈɛ l iː
KEN, k ˈɛ n
KENNEDY, k ˈɛ n ɪ d iː
KENNETH, k ˈɛ n ɪ θ
KENT, k ˈɛ n t
KENTUCKY, k ɛ n t ˈɐ k iː
KENYA(1), k ˈɛ n j ə
KENYA(2), k ˈiː n j ə
KEPT, k ˈɛ p t
KERNEL, k ˈɜː n ə l
KERRY, k ˈɛ ɹ iː
KETTLE, k ˈɛ t ə l
KEVIN, k ˈɛ v ɪ n
KEY, k ˈiː
KEYBOARD, k ˈiː b ˌɔː d
KEYBOARDS, k ˈiː b ˌɔː d z
KEYS, k ˈiː z
KEYWORD, k ˈiː w ˌɜː d
KEYWORDS, k ˈiː w ˌɜː d z
KI, k ˈiː
KICK, k ˈɪ k
KICKED, k ˈɪ k t
KICKING, k ˈɪ k ɪ ŋ
KID, k ˈɪ d
KIDDIES, k ˈɪ d iː z
KIDDING, k ˈɪ d ɪ ŋ
KIDNEY, k ˈɪ d n iː
KIDS, k ˈɪ d z
KILL, k ˈɪ l
KILLED, k ˈɪ l d
KILLER, k ˈɪ l ə
KILLING, k ˈɪ l ɪ ŋ
KILLS, k ˈɪ l z
KILO, k ˈiː l ˌəʊ
KILOMETRE(1), k ˌɪ l ə m ˈiː t ə
KILOMETRE(2), k ˌɪ l ˈɒ m ˌɪ t ə
KILOMETRES(1), k ˌɪ l ə m ˈiː t ə z
KILOMETRES(2), k ˌɪ l ˈɒ m ˌɪ t ə z
KILOS, k ˈiː l ˌəʊ z
KIM, k ˈɪ m
KIND, k ˈaɪ n d
KINDS, k ˈaɪ n d z
KING, k ˈɪ ŋ
KINGDOM, k ˈɪ ŋ d ə m
KINGS, k ˈɪ ŋ z
KINGSTON, k ˈɪ ŋ s t ə n
KINNOCK, k ˈɪ n ə k
KISS, k ˈɪ s
KISSED, k ˈɪ s t
KISSING, k ˈɪ s ɪ ŋ
KIT, k ˈɪ t
KITCHEN, k ˈɪ tʃ ə n
KITS, k ˈɪ t s
KITTENS, k ˈɪ t ə n z
KNEE, n ˈiː
KNEES, n ˈiː z
KNEW, n ˈjuː
KNICKERS, n ˈɪ k ə z
KNIFE, n ˈaɪ f
KNIGHT, n ˈaɪ t
KNITTING, n ˈɪ t ɪ ŋ
KNIVES, n ˈaɪ v z
KNOB, n ˈɒ b
KNOCK, n ˈɒ k
KNOCKED, n ˈɒ k t
KNOCKING, n ˈɒ k ɪ ŋ
KNOW, n ˈəʊ
KNOWING, n ˈəʊ ɪ ŋ
KNOWLEDGE, n ˈɒ l ɪ dʒ
KNOWN, n ˈəʊ n
KNOWS, n ˈəʊ z
KODAK, k ˈəʊ d ˌæ k
KONG, k ˈɒ ŋ
KOREA, k ə ɹ ˈiː ə
KOREAN, k ə ɹ ˈiː ə n
KRISPIES, k ɹ ˈɪ s p iː z
KUWAIT, k uː w ˈeɪ t
KYLE, k ˈaɪ l
LA, l ˈɑː
LAB, l ˈæ b
LABEL, l ˈeɪ b ə l
LABELS, l ˈeɪ b ə l z
LABOR, l ˈeɪ b ə
LABORATORIES, l ə bˈɒ ɹ ə t ə ɹ iː z
LABORATORY, l ə b ˈɒ ɹ ə t ə ɹ iː
LABOUR, l ˈeɪ b ə
LABS, l ˈæ b z
LACE, l ˈeɪ s
LACK, l ˈæ k
LACKING, l ˈæ k ɪ ŋ
LAD, l ˈæ d
LADDER, l ˈæ d ə
LADDERS, l ˈæ d ə z
LADIES, l ˈeɪ d iː z
LADS, l ˈæ d z
LADY, l ˈeɪ d iː
LAGER, l ˈɑː g ə
LAID, l ˈeɪ d
LAKE, l ˈeɪ k
LAKES, l ˈeɪ k s
LAM, l ˈæ m
LAMB, l ˈæ m
LAMBDA, l ˈæ m d ə
LAMP, l ˈæ m p
LAMPS, l ˈæ m p s
LAN, l ˈæ n
LANCASHIRE, l ˈæ ŋ k ə ʃ ˌɪə
LANCASTER(1), l ˈæ ŋ k ə s t ə
LANCASTER(2), l ˈæ n k ˌæ s t ə
LAND, l ˈæ n d
LANDED, l ˈæ n d ɪ d
LANDING, l ˈæ n d ɪ ŋ
LANDLORD, l ˈæ n d l ˌɔː d
LANDS, l ˈæ n d z
LANDSCAPE(1), l ˈæ n s k ˌeɪ p
LANDSCAPE(2), l ˈæ n d s k ˌeɪ p
LANE, l ˈeɪ n
LANES, l ˈeɪ n z
LANGUAGE, l ˈæ ŋ g w ɪ dʒ
LANGUAGES, l ˈæ ŋ g w ɪ dʒ ɪ z
LAP, l ˈæ p
LAPTOP, l ˈæ p t ˌɒ p
LAPTOPS, l ˈæ p t ˌɒ p s
LARGE, l ˈɑː dʒ
LARGELY, l ˈɑː dʒ l iː
LARGER, l ˈɑː dʒ ə
LARGEST, l ˈɑː dʒ ɪ s t
LARRY, l ˈæ ɹ iː
LASER, l ˈeɪ z ə
LASS, l ˈæ s
LAST, l ˈɑː s t
LASTS, l ˈɑː s t s
LATE, l ˈeɪ t
LATELY, l ˈeɪ t l iː
LATER, l ˈeɪ t ə
LATEST, l ˈeɪ t ə s t
LATEX, l ˈeɪ t ˌɛ k s
LATIN, l ˈæ t ɪ n
LATINA, l æ t ˈiː n ə
LATINO, l æ t ˈiː n əʊ
LATITUDE, l ˈæ t ɪ t ˌjuː d
LATTER, l ˈæ t ə
LATVIA, l ˈæ t v ɪə
LAUGH, l ˈɑː f
LAUGHED, l ˈɑː f t
LAUGHING, l ˈɑː f ɪ ŋ
LAUGHTER, l ˈɑː f t ə
LAUNCH, l ˈɔː n tʃ
LAUNCHED, l ˈɔː n tʃ t
LAUNCHES, l ˈɔː n tʃ ɪ z
LAUNDRY, l ˈɒ n d ɹ iː
LAURA, l ˈɔː ɹ ə
LAUREN, l ˈɔː ɹ ə n
LAURENT, l ˈɒ ɹ ə n t
LAW, l ˈɔː
LAWN, l ˈɔː n
LAWRENCE, l ˈɒ ɹ ə n s
LAWS, l ˈɔː z
LAWYER(1), l ˈɔɪ ə
LAWYER(2), l ˈɔː j ə
LAWYERS(1), l ˈɔɪ ə z
LAWYERS(2), l ˈɔː j ə z
LAY, l ˈeɪ
LAYER, l ˈeɪ ə
LAYERS, l ˈeɪ ə z
LAYING, l ˈeɪ ɪ ŋ
LAYOUT, l ˈeɪ ˌaʊ t
LAZY, l ˈeɪ z iː
LE, l ə
LEAD(1), l ˈiː d
LEAD(2), l ˈɛ d
LEADER, l ˈiː d ə
LEADERS, l ˈiː d ə z
LEADERSHIP, l ˈiː d ə ʃ ˌɪ p
LEADING, l ˈiː d ɪ ŋ
LEADS, l ˈiː d z
LEAF, l ˈiː f
LEAFLET, l ˈiː f l ə t
LEAFLETS, l ˈiː f l ə t s
LEAGUE, l ˈiː g
LEANED, l ˈiː n d
LEANING, l ˈiː n ɪ ŋ
LEARN, l ˈɜː n
LEARNED(1), l ˈɜː n d
LEARNED(2), l ˈɜː n ɪ d
LEARNING, l ˈɜː n ɪ ŋ
LEARNT, l ˈɜː n t
LEASE, l ˈiː s
LEASING, l ˈiː s ɪ ŋ
LEAST, l ˈiː s t
LEATHER, l ˈɛ ð ə
LEAVE, l ˈiː v
LEAVES, l ˈiː v z
LEAVING, l ˈiː v ɪ ŋ
LEBANON, l ˈɛ b ə n ə n
LECTURE, l ˈɛ k tʃ ə
LECTURES, l ˈɛ k tʃ ə z
LED, l ˈɛ d
LEE, l ˈiː
LEEDS, l ˈiː d z
LEFT, l ˈɛ f t
LEG, l ˈɛ g
LEGACY, l ˈɛ g ə s iː
LEGAL, l ˈiː g ə l
LEGEND, l ˈɛ dʒ ə n d
LEGENDS, l ˈɛ dʒ ə n d z
LEGGINGS, l ˈɛ g ɪ ŋ z
LEGISLATION, l ˌɛ dʒ ɪ s l ˈeɪ ʃ ə n
LEGISLATIVE, l ˈɛ dʒ ɪ s l ə t ɪ v
LEGISLATURE, l ˈɛ dʒ ɪ s l ˌeɪ tʃ ə
LEGITIMATE, l ə dʒ ˈɪ t ɪ m ə t
LEGO, l ˈɛ g əʊ
LEGS, l ˈɛ g z
LEICESTER, l ˈɛ s t ə
LEIGH, l ˈiː
LEISURE(1), l ˈɛ ʒ ə
LEISURE(2), l ˈiː ʒ ə
LEMON, l ˈɛ m ə n
LEMONADE, l ˈɛ m ə n ˈeɪ d
LEN, l ˈɛ n
LEND, l ˈɛ n d
LENDER, l ˈɛ n d ə
LENDERS, l ˈɛ n d ə z
LENDING, l ˈɛ n d ɪ ŋ
LENGTH(1), l ˈɛ ŋ θ
LENGTH(2), l ˈɛ ŋ k θ
LENS, l ˈɛ n z
LENSES, l ˈɛ n z ɪ z
LENT, l ˈɛ n t
LEO, l ˈiː əʊ
LEONARD, l ˈɛ n ə d
LES(1), l ˈeɪ
LES(2), l ˈɛ s
LESBIAN, l ˈɛ z b ɪə n
LESBIANS, l ˈɛ z b ɪə n z
LESLEY, l ˈɛ z l iː
LESS, l ˈɛ s
LESSER, l ˈɛ s ə
LESSON, l ˈɛ s ə n
LESSONS, l ˈɛ s ə n z
LET'S, l ˈɛ t s
LET, l ˈɛ t
LETS, l ˈɛ t s
LETTER, l ˈɛ t ə
LETTERS, l ˈɛ t ə z
LETTING, l ˈɛ t ɪ ŋ
LETTUCE, l ˈɛ t ə s
LEVEL, l ˈɛ v ə l
LEVELS, l ˈɛ v ə l z
LEWIS, l ˈuː ɪ s
LI, l ˈiː
LIABILITIES, l ˌaɪ ə b ˈɪ l ɪ t iː z
LIABILITY, l ˌaɪ ə b ˈɪ l ɪ t iː
LIABLE, l ˈaɪ ə b ə l
LIAM, l ˈiː ə m
LIAR, l ˈaɪ ə
LIBERAL(1), l ˈɪ b ɹ ə l
LIBERAL(2), l ˈɪ b ə ɹ ə l
LIBERATION, l ˌɪ b ə ɹ ˈeɪ ʃ ə n
LIBERTY, l ˈɪ b ə t iː
LIBRARIES, l ˈaɪ b ɹ ə ɹ iː z
LIBRARY, l ˈaɪ b ɹ ə ɹ iː
LICENCE, l ˈaɪ s ə n s
LICENSE, l ˈaɪ s ə n s
LICENSED, l ˈaɪ s ə n s t
LICENSES, l ˈaɪ s ə n s ɪ z
LICENSING, l ˈaɪ s ə n s ɪ ŋ
LICK, l ˈɪ k
LICKING, l ˈɪ k ɪ ŋ
LID, l ˈɪ d
LIE, l ˈaɪ
LIES, l ˈaɪ z
LIFE, l ˈaɪ f
LIFESPAN, l ˈaɪ f s p ˌæ n
LIFESTYLE, l ˈaɪ f s t ˌaɪ l
LIFETIME, l ˈaɪ f t ˌaɪ m
LIFT, l ˈɪ f t
LIFTED, l ˈɪ f t ɪ d
LIGHT, l ˈaɪ t
LIGHTER, l ˈaɪ t ə
LIGHTING, l ˈaɪ t ɪ ŋ
LIGHTLY, l ˈaɪ t l iː
LIGHTNING, l ˈaɪ t n ɪ ŋ
LIGHTS, l ˈaɪ t s
LIGHTWEIGHT, l ˈaɪ t w ˈeɪ t
LIKE, l ˈaɪ k
LIKED, l ˈaɪ k t
LIKELY, l ˈaɪ k l iː
LIKES, l ˈaɪ k s
LIMIT, l ˈɪ m ɪ t
LIMITATION, l ˌɪ m ɪ t ˈeɪ ʃ ə n
LIMITATIONS, l ˌɪ m ɪ t ˈeɪ ʃ ə n z
LIMITED, l ˈɪ m ɪ t ɪ d
LIMITS, l ˈɪ m ɪ t s
LIMOUSINES(1), l ˈɪ m ə z ˌiː n z
LIMOUSINES(2), l ˌɪ m ə z ˈiː n z
LINCOLN, l ˈɪ ŋ k ə n
LINDA, l ˈɪ n d ə
LINDSEY, l ˈɪ n d z iː
LINE, l ˈaɪ n
LINEAR, l ˈɪ n ɪə
LINES, l ˈaɪ n z
LINGERIE, l ˈɒ n ʒ ə ɹ iː
LINGUISTIC, l ɪ ŋ g w ˈɪ s t ɪ k
LINK, l ˈɪ ŋ k
LINKED, l ˈɪ ŋ k t
LINKING, l ˈɪ ŋ k ɪ ŋ
LINKS, l ˈɪ ŋ k s
LINUX(1), l ˈɪ n ə k s
LINUX(2), l ˈaɪ n ə k s
LION, l ˈaɪ ə n
LIONS, l ˈaɪ ə n z
LIP, l ˈɪ p
LIPS, l ˈɪ p s
LIPSTICK, l ˈɪ p s t ˌɪ k
LIQUID, l ˈɪ k w ɪ d
LISA, l ˈiː s ə
LIST, l ˈɪ s t
LISTED, l ˈɪ s t ɪ d
LISTEN, l ˈɪ s ə n
LISTENED, l ˈɪ s ə n d
LISTENING(1), l ˈɪ s n ɪ ŋ
LISTENING(2), l ˈɪ s ə n ɪ ŋ
LISTING, l ˈɪ s t ɪ ŋ
LISTINGS, l ˈɪ s t ɪ ŋ z
LISTS, l ˈɪ s t s
LIT, l ˈɪ t
LITE, l ˈaɪ t
LITERACY, l ˈɪ t ə ɹ ə s iː
LITERALLY(1), l ˈɪ t ɹ ə l iː
LITERALLY(2), l ˈɪ t ə ɹ ə l iː
LITERARY, l ˈɪ t ə ɹ ə ɹ iː
LITERATURE, l ˈɪ t ə ɹ ə tʃ ə
LITHUANIA, l ˌɪ θ jʊ ˈeɪ n ɪə
LITIGATION, l ˌɪ t ɪ g ˈeɪ ʃ ə n
LITTLE, l ˈɪ t ə l
LIVE(1), l ˈɪ v
LIVE(2), l ˈaɪ v
LIVED, l ˈɪ v d
LIVELY, l ˈaɪ v l iː
LIVER, l ˈɪ v ə
LIVERPOOL, l ˈɪ v ə p ˌuː l
LIVES(1), l ˈɪ v z
LIVES(2), l ˈaɪ v z
LIVING, l ˈɪ v ɪ ŋ
LIZ, l ˈɪ z
LLOYD, l ˈɔɪ d
LO, l ˈəʊ
LOAD, l ˈəʊ d
LOADED, l ˈəʊ d ɪ d
LOADING, l ˈəʊ d ɪ ŋ
LOADS, l ˈəʊ d z
LOAF, l ˈəʊ f
LOAN, l ˈəʊ n
LOANS, l ˈəʊ n z
LOCAL, l ˈəʊ k ə l
LOCALE, l əʊ k ˈɑː l
LOCALLY, l ˈəʊ k ə l iː
LOCATE, l ˈəʊ k ˌeɪ t
LOCATED, l ˈəʊ k ˌeɪ t ɪ d
LOCATION, l əʊ k ˈeɪ ʃ ə n
LOCATIONS, l əʊ k ˈeɪ ʃ ə n z
LOCATOR, l ˈəʊ k ˌeɪ t ə
LOCK, l ˈɒ k
LOCKED, l ˈɒ k t
LODGE, l ˈɒ dʒ
LODGING, l ˈɒ dʒ ɪ ŋ
LOFT, l ˈɒ f t
LOG, l ˈɒ g
LOGGED, l ˈɒ g d
LOGGING, l ˈɒ g ɪ ŋ
LOGIC, l ˈɒ dʒ ɪ k
LOGICAL, l ˈɒ dʒ ɪ k ə l
LOGISTICS, l ə dʒ ˈɪ s t ɪ k s
LOGO, l ˈəʊ g əʊ
LOGOS, l ˈəʊ g ˌəʊ z
LOGS, l ˈɒ g z
LOL, l ˈɒ l
LOLLIPOP, l ˈɒ l ɪ p ˌɒ p
LONDON, l ˈɐ n d ə n
LONELY, l ˈəʊ n l iː
LONG, l ˈɒ ŋ
LONG-TERM, l ˈɒ ŋ t ɜː m
LONGER, l ˈɒ ŋ g ə
LONGEST, l ˈɒ ŋ g ɪ s t
LOO, l ˈuː
LOOK, l ˈʊ k
LOOKED, l ˈʊ k t
LOOKING, l ˈʊ k ɪ ŋ
LOOKS, l ˈʊ k s
LOOKUP, l ˈʊ k ˌɐ p
LOOP, l ˈuː p
LOOSE, l ˈuː s
LOPEZ, l ˈəʊ p ɛ z
LORD, l ˈɔː d
LORDS, l ˈɔː d z
LORNA, l ˈɔː n ə
LORRAINE, l ɒ ɹ ˈeɪ n
LORRIES, l ˈɒ ɹ iː z
LORRY, l ˈɒ ɹ iː
LOS ANGELES, l ɒ s ˈæ n dʒ ɪ l ˌiː z
LOSE, l ˈuː z
LOSING, l ˈuː z ɪ ŋ
LOSS, l ˈɒ s
LOSSES, l ˈɒ s ɪ z
LOST, l ˈɒ s t
LOT, l ˈɒ t
LOTS, l ˈɒ t s
LOTTERY, l ˈɒ t ə ɹ iː
LOTUS, l ˈəʊ t ə s
LOU, l ˈuː
LOUD, l ˈaʊ d
LOUDER, l ˈaʊ d ə
LOUIS, l ˈuː iː
LOUISE, l uː ˈiː z
LOUISIANA, l uː ˌiː z ɪ ˈæ n ə
LOUISVILLE, l ˈuː ɪ v ˌɪ l
LOUNGE, l ˈaʊ n dʒ
LOVE, l ˈɐ v
LOVED, l ˈɐ v d
LOVELY, l ˈɐ v l iː
LOVER, l ˈɐ v ə
LOVERS, l ˈɐ v ə z
LOVES, l ˈɐ v z
LOVING, l ˈɐ v ɪ ŋ
LOW, l ˈəʊ
LOWER, l ˈəʊ ə
LOWEST, l ˈəʊ ɪ s t
LOYALTY, l ˈɔɪ ə l t iː
LUCIA, l ˈuː ʃ ə
LUCK, l ˈɐ k
LUCKILY, l ˈɐ k ɪ l iː
LUCKY, l ˈɐ k iː
LUCY, l ˈuː s iː
LUGGAGE, l ˈɐ g ɪ dʒ
LUKE, l ˈuː k
LUMP, l ˈɐ m p
LUNCH, l ˈɐ n tʃ
LUNCHTIME, l ˈɐ n tʃ t ˌaɪ m
LUNG, l ˈɐ ŋ
LUXEMBOURG, l ˈɐ k s ə m b ˌɜː g
LUXURY, l ˈɐ k ʃ ə ɹ iː
LYING, l ˈaɪ ɪ ŋ
LYN, l ˈɪ n
LYNDA, l ˈɪ n d ə
LYNN, l ˈɪ n
LYRIC, l ˈɪ ɹ ɪ k
LYRICS, l ˈɪ ɹ ɪ k s
MA, m ˈɑː
MAC, m ˈæ k
MACHINE, m ə ʃ ˈiː n
MACHINERY(1), m ə ʃ ˈiː n ɹ iː
MACHINERY(2), m ə ʃ ˈiː n ə ɹ iː
MACHINES, m ə ʃ ˈiː n z
MACINTOSH, m ˈæ k ɪ n t ˌɒ ʃ
MACKEREL, m ˈæ k ə ɹ ə l
MACRO, m ˈæ k ɹ əʊ
MAD, m ˈæ d
MADAM, m ˈæ d ə m
MADE, m ˈeɪ d
MADEMOISELLE, m ˌæ d ə m ə z ˈɛ l
MADGE, m ˈæ dʒ
MADISON, m ˈæ d ɪ s ə n
MADONNA, m ə d ˈɒ n ə
MADRID, m ə d ɹ ˈɪ d
MAG, m ˈæ g
MAGAZINE, m ˈæ g ə z ˌiː n
MAGAZINES, m ˈæ g ə z ˌiː n z
MAGGIE, m ˈæ g iː
MAGIC, m ˈæ dʒ ɪ k
MAGISTRATES, m ˈæ dʒ ɪ s t ɹ ˌeɪ t s
MAGNETIC, m æ g n ˈɛ t ɪ k
MAGNIFICENT, m æ g n ˈɪ f ɪ s ə n t
MAIL, m ˈeɪ l
MAILED, m ˈeɪ l d
MAILING, m ˈeɪ l ɪ ŋ
MAIN, m ˈeɪ n
MAINE, m ˈeɪ n
MAINLAND, m ˈeɪ n l ə n d
MAINLY, m ˈeɪ n l iː
MAINS, m ˈeɪ n z
MAINSTREAM, m ˈeɪ n s t ɹ ˌiː m
MAINTAIN, m eɪ n t ˈeɪ n
MAINTAINED, m eɪ n t ˈeɪ n d
MAINTAINING, m eɪ n t ˈeɪ n ɪ ŋ
MAINTENANCE(1), m ˈeɪ n t n ə n s
MAINTENANCE(2), m ˈeɪ n t ə n ə n s
MAJOR, m ˈeɪ dʒ ə
MAJORITY, m ə dʒ ˈɒ ɹ ɪ t iː
MAKE, m ˈeɪ k
MAKE-UP, m ˈeɪ k ˌɐ p
MAKER, m ˈeɪ k ə
MAKERS, m ˈeɪ k ə z
MAKES, m ˈeɪ k s
MAKING, m ˈeɪ k ɪ ŋ
MALAYSIA, m ə l ˈeɪ ʒ ə
MALCOLM, m ˈæ l k ə m
MALE, m ˈeɪ l
MALES, m ˈeɪ l z
MALL, m ˈɔː l
MALTA, m ˈɔː l t ə
MAM, m ˈæ m
MAMA, m ə m ˈɑː
MAN, m ˈæ n
MANAGE, m ˈæ n ɪ dʒ
MANAGED, m ˈæ n ɪ dʒ d
MANAGEMENT, m ˈæ n ɪ dʒ m ə n t
MANAGER, m ˈæ n ɪ dʒ ə
MANAGERS, m ˈæ n ɪ dʒ ə z
MANAGING, m ˈæ n ɪ dʒ ɪ ŋ
MANCHESTER, m ˈæ n tʃ ɪ s t ə
MANDATORY, m ˈæ n d ə t ə ɹ iː
MANDY, m ˈæ n d iː
MANGA, m ˈæ ŋ g ə
MANHATTAN, m æ n h ˈæ t ə n
MANITOBA, m ˌæ n ɪ t ˈəʊ b ə
MANNER, m ˈæ n ə
MANOR, m ˈæ n ə
MANUAL, m ˈæ n jʊə l
MANUALS, m ˈæ n jʊə l z
MANUFACTURE, m ˌæ n jʊ f ˈæ k tʃ ə
MANUFACTURED, m ˌæ n jʊ f ˈæ k tʃ ə d
MANUFACTURER, m ˌæ n jʊ f ˈæ k tʃ ə ɹ ə
MANUFACTURERS, m ˌæ n jʊ f ˈæ k tʃ ə ɹ ə z
MANUFACTURING, m ˌæ n jʊ f ˈæ k tʃ ə ɹ ɪ ŋ
MANY, m ˈɛ n iː
MAP, m ˈæ p
MAPLE, m ˈeɪ p ə l
MAPPING, m ˈæ p ɪ ŋ
MAPS, m ˈæ p s
MARC, m ˈɑː k
MARCH, m ˈɑː tʃ
MARCHING, m ˈɑː tʃ ɪ ŋ
MARCUS, m ˈɑː k ə s
MARGARET(1), m ˈɑː g ɹ ə t
MARGARET(2), m ˈɑː g ɹ ɪ t
MARGARET(3), m ˈɑː g ə ɹ ɪ t
MARGARINE, m ˈɑː dʒ ə ɹ ˌiː n
MARGE, m ˈɑː dʒ
MARGIN, m ˈɑː dʒ ɪ n
MARGINAL, m ˈɑː dʒ ɪ n ə l
MARGOT, m ˈɑː g əʊ
MARIA, m ə ɹ ˈiː ə
MARIE, m ə ɹ ˈiː
MARILYN, m ˈæ ɹ ɪ l ɪ n
MARINA, m ə ɹ ˈiː n ə
MARINE, m ə ɹ ˈiː n
MARIO, m ˈæ ɹ ɪ əʊ
MARION, m ˈæ ɹ ɪə n
MARITIME, m ˈæ ɹ ɪ t ˌaɪ m
MARK, m ˈɑː k
MARKED, m ˈɑː k t
MARKER, m ˈɑː k ə
MARKET, m ˈɑː k ɪ t
MARKETING, m ˈɑː k ɪ t ɪ ŋ
MARKETPLACE, m ˈɑː k ɪ t p l ˌeɪ s
MARKETS, m ˈɑː k ɪ t s
MARKS, m ˈɑː k s
MARMALADE, m ˈɑː m ə l ˌeɪ d
MARRIAGE, m ˈæ ɹ ɪ dʒ
MARRIED, m ˈæ ɹ ɪ d
MARRIOTT, m ˈæ ɹ ɪ ə t
MARRY, m ˈæ ɹ iː
MARS, m ˈɑː z
MARSHALL, m ˈɑː ʃ ə l
MART, m ˈɑː t
MARTHA, m ˈɑː θ ə
MARTIAL, m ˈɑː ʃ ə l
MARTIN, m ˈɑː t ɪ n
MARTS, m ˈɑː t s
MARVELLOUS, m ˈɑː v ə l ə s
MARVELOUS, m ˈɑː v ə l ə s
MARX, m ˈɑː k s
MARY, m ˈɛə ɹ iː
MARYLAND, m ˈæ ɹ ɪ l ə n d
MASK, m ˈɑː s k
MASON, m ˈeɪ s ə n
MASS, m ˈæ s
MASSACHUSETTS, m ˌæ s ə tʃ ˈuː s ɪ t s
MASSAGE, m ə s ˈɑː ʒ
MASSIVE, m ˈæ s ɪ v
MASTER, m ˈɑː s t ə
MASTERCARD, m ˈɑː s t ə k ˌɑː d
MASTERS, m ˈɑː s t ə z
MASTURBATING, m ˈæ s t ə b ˌeɪ t ɪ ŋ
MAT, m ˈæ t
MATCH, m ˈæ tʃ
MATCHED, m ˈæ tʃ t
MATCHES, m ˈæ tʃ ɪ z
MATCHING, m ˈæ tʃ ɪ ŋ
MATE, m ˈeɪ t
MATERIAL, m ə t ˈɪə ɹ ɪə l
MATERIALS, m ə t ˈɪə ɹ ɪə l z
MATERNITY, m ə t ˈɜː n ɪ t iː
MATES, m ˈeɪ t s
MATEY, m ˈeɪ t iː
MATH, m ˈɑː θ
MATHEMATICAL, m ˌæ θ ə m ˈæ t ɪ k ə l
MATHEMATICS, m ˌæ θ ə m ˈæ t ɪ k s
MATRIX, m ˈeɪ t ɹ ɪ k s
MATS, m ˈæ t s
MATT, m ˈæ t
MATTER, m ˈæ t ə
MATTERS, m ˈæ t ə z
MATTHEW, m ˈæ θ juː
MATTRESS, m ˈæ t ɹ ə s
MATURE(1), m ə tʃ ˈjʊə
MATURE(2), m ə t ˈjʊə
MAUREEN, m ˈɔː ɹ iː n
MAX, m ˈæ k s
MAXIMUM, m ˈæ k s ɪ m ə m
MAXINE, m ˈæ k s iː n
MAXWELL, m ˈæ k s w ə l
MAY, m ˈeɪ
MAYBE, m ˈeɪ b iː
MAYOR, m ˈɛə
MAZDA, m ˈæ z d ə
MCDONALD, m ə k d ˈɒ n ə l d
ME, m ˈiː
MEAL, m ˈiː l
MEALS, m ˈiː l z
MEAN, m ˈiː n
MEANING, m ˈiː n ɪ ŋ
MEANINGS, m ˈiː n ɪ ŋ z
MEANS, m ˈiː n z
MEANT, m ˈɛ n t
MEANTIME, m ˈiː n t ˌaɪ m
MEANWHILE, m ˈiː n w ˌaɪ l
MEASURE, m ˈɛ ʒ ə
MEASURED, m ˈɛ ʒ ɪ d
MEASUREMENT, m ˈɛ ʒ ə m ə n t
MEASUREMENTS, m ˈɛ ʒ ə m ə n t s
MEASURES, m ˈɛ ʒ ə z
MEASURING, m ˈɛ ʒ ə ɹ ɪ ŋ
MEAT, m ˈiː t
MECHANICAL, m ə k ˈæ n ɪ k ə l
MECHANICS, m ə k ˈæ n ɪ k s
MECHANISM, m ˈɛ k ə n ˌɪ z ə m
MECHANISMS, m ˈɛ k ə n ˌɪ z ə m z
MED, m ˈɛ d
MEDAL, m ˈɛ d ə l
MEDIA, m ˈiː d ɪə
MEDIAN, m ˈiː d ɪə n
MEDICAID, m ˈɛ d ɪ k ˌeɪ d
MEDICAL, m ˈɛ d ɪ k ə l
MEDICARE, m ˈɛ d ɪ k ˌɛə
MEDICATION, m ˌɛ d ɪ k ˈeɪ ʃ ə n
MEDICATIONS, m ˌɛ d ɪ k ˈeɪ ʃ ə n z
MEDICINE, m ˈɛ d ɪ s ɪ n
MEDIEVAL(1), m ɛ d ˈiː v ə l
MEDIEVAL(2), m ɛ d ɪ ˈiː v ə l
MEDITERRANEAN, m ˌɛ d ɪ t ə ɹ ˈeɪ n ɪə n
MEDIUM, m ˈiː d ɪə m
MEET, m ˈiː t
MEETING, m ˈiː t ɪ ŋ
MEETINGS, m ˈiː t ɪ ŋ z
MEETS, m ˈiː t s
MEL, m ˈɛ l
MELANIE, m ˈɛ l ə n iː
MELBOURNE, m ˈɛ l b ə n
MELISSA, m ə l ˈɪ s ə
MEMBER, m ˈɛ m b ə
MEMBERS, m ˈɛ m b ə z
MEMBERSHIP, m ˈɛ m b ə ʃ ˌɪ p
MEMBRANE, m ˈɛ m b ɹ ˌeɪ n
MEMORABILIA, m ˌɛ m ə ɹ ə b ˈiː l ɪə
MEMORIAL, m ə m ˈɒ ɹ ɪə l
MEMORIES, m ˈɛ m ə ɹ iː z
MEMORY, m ˈɛ m ə ɹ iː
MEMPHIS(1), m ˈɛ m f ɪ s
MEMPHIS(2), m ˈɛ m p f ɪ s
MEN, m ˈɛ n
MEND, m ˈɛ n d
MENTAL, m ˈɛ n t ə l
MENTALLY, m ˈɛ n t ə l iː
MENTION, m ˈɛ n ʃ ə n
MENTIONED, m ˈɛ n ʃ ə n d
MENU, m ˈɛ n juː
MENUS, m ˈɛ n juː z
MEOW, m ɪ ˈaʊ
MERCEDES, m ə s ˈeɪ d iː z
MERCHANDISE, m ˈɜː tʃ ə n d ˌaɪ z
MERCHANT, m ˈɜː tʃ ə n t
MERCHANTS, m ˈɜː tʃ ə n t s
MERCURY, m ˈɜː k jʊ ɹ iː
MERE, m ˈɪə
MERELY, m ˈɪə l iː
MERRILY, m ˈɛ ɹ ɪ l iː
MERRY, m ˈɛ ɹ iː
MESH, m ˈɛ ʃ
MESS, m ˈɛ s
MESSAGE, m ˈɛ s ɪ dʒ
MESSAGES, m ˈɛ s ɪ dʒ ɪ z
MESSAGING, m ˈɛ s ɪ dʒ ɪ ŋ
MESSENGER, m ˈɛ s ɪ n dʒ ə
MESSING, m ˈɛ s ɪ ŋ
MESSRS, m ˈɛ s ə z
MESSY, m ˈɛ s iː
MET, m ˈɛ t
META, m ˈɛ t ə
METABOLISM, m ɪ t ˈæ b ə l ˌɪ z ə m
METAL, m ˈɛ t ə l
METALS, m ˈɛ t ə l z
METER, m ˈiː t ə
METERS, m ˈiː t ə z
METHOD, m ˈɛ θ ə d
METHODOLOGY, m ˌɛ θ ə d ˈɒ l ə dʒ iː
METHODS, m ˈɛ θ ə d z
METRES, m ˈiː t ə z
METRIC, m ˈɛ t ɹ ɪ k
METRO, m ˈɛ t ɹ ˌəʊ
METROPOLITAN, m ˌɛ t ɹ ə p ˈɒ l ɪ t ə n
MEXICAN, m ˈɛ k s ɪ k ə n
MEXICO, m ˈɛ k s ɪ k ˌəʊ
MHM, ə m h ə m
MI, m ˈiː
MIAMI, m aɪ ˈæ m iː
MICE, m ˈaɪ s
MICHAEL, m ˈaɪ k ə l
MICHELLE, m ɪ ʃ ˈɛ l
MICHIGAN, m ˈɪ ʃ ɪ g ə n
MICK, m ˈɪ k
MICKEY, m ˈɪ k iː
MICRO, m ˈaɪ k ɹ ˌəʊ
MICROPHONE, m ˈaɪ k ɹ ə f ˌəʊ n
MICROSOFT, m ˈaɪ k ɹ ˌəʊ s ˈɒ f t
MICROWAVE, m ˈaɪ k ɹ ə w ˌeɪ v
MIDDLE, m ˈɪ d ə l
MIDDLESBROUGH, m ˈɪ d ə l z b ɹ ə
MIDI, m ˈiː d iː
MIDLANDS, m ˈɪ d l ˌæ n d z
MIDNIGHT, m ˈɪ d n ˌaɪ t
MIDWEST, m ˌɪ d w ˈɛ s t
MIGHT, m ˈaɪ t
MIGHTY, m ˈaɪ t iː
MIGRATION, m aɪ g ɹ ˈeɪ ʃ ə n
MIKE, m ˈaɪ k
MILAN, m ɪ l ˈæ n
MILD, m ˈaɪ l d
MILE, m ˈaɪ l
MILES, m ˈaɪ l z
MILITARY, m ˈɪ l ɪ t ə ɹ iː
MILK, m ˈɪ l k
MILKMAN, m ˈɪ l k m ˌæ n
MILKY, m ˈɪ l k iː
MILL, m ˈɪ l
MILLENNIUM, m ɪ l ˈɛ n ɪə m
MILLER, m ˈɪ l ə
MILLIMETRES, m ˈɪ l ə m ˌiː t ə z
MILLION, m ˈɪ l j ə n
MILLIONS, m ˈɪ l j ə n z
MILLS, m ˈɪ l z
MILTON, m ˈɪ l t ə n
MILWAUKEE, m ɪ l w ˈɔː k iː
MINCE, m ˈɪ n s
MINCEMEAT, m ˈɪ n s m ˌiː t
MIND, m ˈaɪ n d
MINDS, m ˈaɪ n d z
MINE, m ˈaɪ n
MINERAL, m ˈɪ n ə ɹ ə l
MINERALS, m ˈɪ n ə ɹ ə l z
MINERS, m ˈaɪ n ə z
MINES, m ˈaɪ n z
MINI, m ˈɪ n iː
MINIBUS, m ˈɪ n ɪ b ˌɐ s
MINIMAL, m ˈɪ n ɪ m ə l
MINIMIZE, m ˈɪ n ɪ m ˌaɪ z
MINIMUM, m ˈɪ n ɪ m ə m
MINING, m ˈaɪ n ɪ ŋ
MINISTER, m ˈɪ n ɪ s t ə
MINISTERS, m ˈɪ n ɪ s t ə z
MINISTRY, m ˈɪ n ɪ s t ɹ iː
MINNEAPOLIS, m ˌɪ n ɪ ˈæ p ə l ɪ s
MINNESOTA, m ˌɪ n ɪ s ˈəʊ t ə
MINOR, m ˈaɪ n ə
MINORITY(1), m aɪ n ˈɒ ɹ ɪ t iː
MINORITY(2), m ɪ n ˈɒ ɹ ɪ t iː
MINT, m ˈɪ n t
MINUS, m ˈaɪ n ə s
MINUTE(1), m ˈɪ n ɪ t
MINUTE(2), m aɪ n ˈjuː t
MINUTES, m ˈɪ n ɪ t s
MIRROR, m ˈɪ ɹ ə
MIRRORS, m ˈɪ ɹ ə z
MISCELLANEOUS, m ˌɪ s ə l ˈeɪ n ɪə s
MISERABLE(1), m ˈɪ z ɹ ə b ə l
MISERABLE(2), m ˈɪ z ə ɹ ə b ə l
MISS, m ˈɪ s
MISSED, m ˈɪ s t
MISSING, m ˈɪ s ɪ ŋ
MISSION, m ˈɪ ʃ ə n
MISSIONS, m ˈɪ ʃ ə n z
MISSIS, m ˈɪ s ɪ z
MISSISSIPPI, m ˌɪ s ɪ s ˈɪ p iː
MISSOURI, m ɪ z ˈʊə ɹ iː
MISTAKE, m ɪ s t ˈeɪ k
MISTAKES, m ɪ s t ˈeɪ k s
MISTER, m ˈɪ s t ə
MISTRESS, m ˈɪ s t ɹ ə s
MITCHELL, m ˈɪ tʃ ə l
MITSUBISHI, m ˌɪ t s ˌuː b ˈiː ʃ iː
MIX, m ˈɪ k s
MIXED, m ˈɪ k s t
MIXING, m ˈɪ k s ɪ ŋ
MIXTURE, m ˈɪ k s tʃ ə
MM, m
MO, m ˈəʊ
MOAN, m ˈəʊ n
MOANING, m ˈəʊ n ɪ ŋ
MOBILE, m ˈəʊ b aɪ l
MOBILES, m ˈəʊ b aɪ l z
MOBILITY, m əʊ b ˈɪ l ɪ t iː
MOD, m ˈɒ d
MODE, m ˈəʊ d
MODEL, m ˈɒ d ə l
MODELING, m ˈɒ d ə l ɪ ŋ
MODELS, m ˈɒ d ə l z
MODEM, m ˈəʊ d ə m
MODERATE(1), m ˈɒ d ə ɹ ˌeɪ t
MODERATE(2), m ˈɒ d ə ɹ ə t
MODERATOR, m ˈɒ d ə ɹ ˌeɪ t ə
MODERN, m ˈɒ d ə n
MODES, m ˈəʊ d z
MODEST, m ˈɒ d ɪ s t
MODIFICATION, m ˌɒ d ɪ f ɪ k ˈeɪ ʃ ə n
MODIFICATIONS, m ˌɒ d ɪ f ɪ k ˈeɪ ʃ ə n z
MODIFIED, m ˈɒ d ɪ f ˌaɪ d
MODIFY, m ˈɒ d ɪ f ˌaɪ
MODULE, m ˈɒ dʒ uː l
MODULES, m ˈɒ dʒ uː l z
MOIRA, m ˈɔɪ ɹ ə
MOISTURE, m ˈɔɪ s tʃ ə
MOLECULAR, m ə l ˈɛ k jʊ l ə
MOLLY, m ˈɒ l iː
MOM, m ˈɒ m
MOMENT, m ˈəʊ m ə n t
MOMENTS, m ˈəʊ m ə n t s
MOMS, m ˈɒ m z
MONACO, m ˈɒ n ə k ˌəʊ
MONDAY(1), m ˈɐ n d iː
MONDAY(2), m ˈɐ n d ˌeɪ
MONDAYS(1), m ˈɐ n d iː z
MONDAYS(2), m ˈɐ n d ˌeɪ z
MONETARY, m ˈɐ n ɪ t ə ɹ iː
MONEY, m ˈɐ n iː
MONICA, m ˈɒ n ɪ k ə
MONITOR, m ˈɒ n ɪ t ə
MONITORING, m ˈɒ n ɪ t ə ɹ ɪ ŋ
MONITORS, m ˈɒ n ɪ t ə z
MONKEY, m ˈɐ ŋ k iː
MONO, m ˈəʊ n əʊ
MONOPOLY, m ə n ˈɒ p ə l iː
MONROE, m ə n ɹ ˈəʊ
MONSIGNOR, m ɒ n s ˈiː n j ə
MONSTER, m ˈɒ n s t ə
MONTANA, m ɒ n t ˈæ n ə
MONTGOMERY, m ə n t g ˈɐ m ə ɹ iː
MONTH, m ˈɐ n θ
MONTHLY, m ˈɐ n θ l iː
MONTHS, m ˈɐ n θ s
MONTREAL, m ˌɒ n t ɹ ɪ ˈɔː l
MOOD, m ˈuː d
MOON, m ˈuː n
MOONLIGHT, m ˈuː n l ˌaɪ t
MOORE(1), m ˈɔː
MOORE(2), m ˈʊə
MORAL, m ˈɒ ɹ ə l
MORE, m ˈɔː
MOREOVER, m ɔː ɹ ˈəʊ v ə
MORGAN, m ˈɔː g ə n
MORNING, m ˈɔː n ɪ ŋ
MORNINGS, m ˈɔː n ɪ ŋ z
MOROCCO, m ə ɹ ˈɒ k əʊ
MORRIS, m ˈɒ ɹ ɪ s
MORTALITY, m ˌɔː t ˈæ l ɪ t iː
MORTGAGE, m ˈɔː g ɪ dʒ
MORTGAGES, m ˈɔː g ɪ dʒ ɪ z
MOSCOW, m ˈɒ s k ˌəʊ
MOST, m ˈəʊ s t
MOSTLY, m ˈəʊ s t l iː
MOTEL, m əʊ t ˈɛ l
MOTELS, m əʊ t ˈɛ l z
MOTHER, m ˈɐ ð ə
MOTHER-IN-LAW, m ˈɐ ð ə ɹ ɪ n l ˌɔː
MOTHERS, m ˈɐ ð ə z
MOTION, m ˈəʊ ʃ ə n
MOTIVATION, m ˌəʊ t ɪ v ˈeɪ ʃ ə n
MOTOR, m ˈəʊ t ə
MOTORBIKE, m ˈəʊ t ə b ˌaɪ k
MOTORCYCLE, m ˈəʊ t ə s ˌaɪ k ə l
MOTOROLA, m ˌəʊ t ə ɹ ˈəʊ l ə
MOTORS, m ˈəʊ t ə z
MOUNT, m ˈaʊ n t
MOUNTAIN, m ˈaʊ n t ə n
