'EM, ə m
CONFUSED, k ə n f ˈjuː z d
CONFUSION, k ə n f ˈjuː ʒ ə n
CONGO, k ˈɒ ŋ g əʊ
CONGREGATION, k ˌɒ ŋ g ɹ ɪ g ˈeɪ ʃ ə n
CONGRESS, k ˈɒ ŋ g ɹ ɛ s
CONGRESSIONAL, k ə n g ɹ ˈɛ ʃ ə n ə l
CONJUNCTION, k ə n dʒ ˈɐ ŋ k ʃ ə n
CONNECT, k ə n ˈɛ k t
CONNECTED, k ə n ˈɛ k t ɪ d
CONNECTICUT, k ə n ˈɛ t ɪ k ə t
CONNECTING, k ə n ˈɛ k t ɪ ŋ
CONNECTION, k ə n ˈɛ k ʃ ə n
CONNECTIONS, k ə n ˈɛ k ʃ ə n z
CONNECTIVITY, k ə n ɛ k t ˈɪ v ɪ t iː
CONNECTOR, k ə n ˈɛ k t ə
CONNECTORS, k ə n ˈɛ k t ə z
CONNIE, k ˈɒ n iː
CONS, k ˈɒ n z
CONSCIOUS, k ˈɒ n ʃ ə s
CONSCIOUSNESS, k ˈɒ n ʃ ə s n ə s
CONSENSUS, k ə n s ˈɛ n s ə s
CONSENT, k ə n s ˈɛ n t
CONSEQUENCE, k ˈɒ n s ɪ k w ə n s
CONSEQUENCES, k ˈɒ n s ɪ k w ə n s ɪ z
CONSEQUENTLY, k ˈɒ n s ɪ k w ə n t l iː
CONSERVATION, k ˌɒ n s ə v ˈeɪ ʃ ə n
CONSERVATIVE, k ə n s ˈɜː v ə t ɪ v
CONSERVATIVES, k ə n s ˈɜː v ə t ɪ v z
CONSERVATORY, k ə n s ˈɜː v ə t ə ɹ iː
CONSIDER, k ə n s ˈɪ d ə
CONSIDERABLE, k ə n s ˈɪ d ə ɹ ə b ə l
CONSIDERABLY, k ə n s ˈɪ d ə ɹ ə b l iː
CONSIDERATION, k ə n s ˌɪ d ə ɹ ˈeɪ ʃ ə n
CONSIDERATIONS, k ə n s ˌɪ d ə ɹ ˈeɪ ʃ ə n z
CONSIDERED, k ə n s ˈɪ d ə d
CONSIDERING, k ə n s ˈɪ d ə ɹ ɪ ŋ
CONSISTENT, k ə n s ˈɪ s t ə n t
CONSISTENTLY, k ə n s ˈɪ s t ə n t l iː
CONSISTING, k ə n s ˈɪ s t ɪ ŋ
CONSISTS, k ə n s ˈɪ s t s
CONSOLE(1), k ˈɒ n s əʊ l
CONSOLE(2), k ə n s ˈəʊ l
CONSOLIDATED, k ə n s ˈɒ l ɪ d ˌeɪ t ɪ d
CONSOLIDATION, k ə n s ˌɒ l ɪ d ˈeɪ ʃ ə n
CONSORTIUM, k ə n s ˈɔː t ɪə m
CONSTANT, k ˈɒ n s t ə n t
CONSTANTLY, k ˈɒ n s t ə n t l iː
CONSTITUENCY, k ə n s t ˈɪ tʃ ʊə n s iː
CONSTITUTE, k ˈɒ n s t ɪ t ˌjuː t
CONSTITUTES, k ˈɒ n s t ɪ t ˌjuː t s
CONSTITUTION, k ˌɒ n s t ɪ t ˈjuː ʃ ə n
CONSTITUTIONAL, k ˌɒ n s t ɪ t ˈjuː ʃ ə n ə l
CONSTRAINTS, k ə n s t ɹ ˈeɪ n t s
CONSTRUCT(1), k ˈɒ n s t ɹ ɐ k t
CONSTRUCT(2), k ə n s t ɹ ˈɐ k t
CONSTRUCTED, k ə n s t ɹ ˈɐ k t ɪ d
CONSTRUCTION, k ə n s t ɹ ˈɐ k ʃ ə n
CONSULT, k ə n s ˈɐ l t
CONSULTANT, k ə n s ˈɐ l t ə n t
CONSULTANTS, k ə n s ˈɐ l t ə n t s
CONSULTATION, k ˌɒ n s ə l t ˈeɪ ʃ ə n
CONSULTING, k ə n s ˈɐ l t ɪ ŋ
CONSUMER, k ə n s ˈjuː m ə
CONSUMERS, k ə n s ˈjuː m ə z
CONSUMPTION(1), k ə n s ˈɐ m ʃ ə n
CONSUMPTION(2), k ə n s ˈɐ m p ʃ ə n
CONTACT(1), k ə n t ˈæ k t
CONTACT(2), k ˈɒ n t ˌæ k t
CONTACTS(1), k ə n t ˈæ k t s
CONTACTS(2), k ˈɒ n t ˌæ k t s
CONTAIN, k ə n t ˈeɪ n
CONTAINED, k ə n t ˈeɪ n d
CONTAINER, k ə n t ˈeɪ n ə
CONTAINERS, k ə n t ˈeɪ n ə z
CONTAINING, k ə n t ˈeɪ n ɪ ŋ
CONTAINS, k ə n t ˈeɪ n z
CONTEMPORARY, k ə n t ˈɛ m p ə ɹ ə ɹ iː
CONTENT(1), k ə n t ˈɛ n t
CONTENT(2), k ˈɒ n t ɛ n t
CONTENTS(1), k ə n t ˈɛ n t s
CONTENTS(2), k ˈɒ n t ɛ n t s
CONTEST(1), k ˈɒ n t ɛ s t
CONTEST(2), k ə n t ˈɛ s t
CONTESTS(1), k ˈɒ n t ɛ s t s
CONTESTS(2), k ə n t ˈɛ s t s
CONTEXT, k ˈɒ n t ɛ k s t
CONTINENT, k ˈɒ n t ɪ n ə n t
CONTINENTAL, k ˌɒ n t ɪ n ˈɛ n t ə l
CONTINUE, k ə n t ˈɪ n juː
CONTINUED, k ə n t ˈɪ n juː d
CONTINUES, k ə n t ˈɪ n juː z
CONTINUING, k ə n t ˈɪ n juː ɪ ŋ
CONTINUOUS, k ə n t ˈɪ n juː ə s
CONTRACT(1), k ə n t ɹ ˈæ k t
CONTRACT(2), k ˈɒ n t ɹ ˌæ k t
CONTRACTING, k ˈɒ n t ɹ ˈæ k t ɪ ŋ
CONTRACTOR, k ˈɒ n t ɹ ˌæ k t ə
CONTRACTORS, k ˈɒ n t ɹ ˌæ k t ə z
CONTRACTS(1), k ə n t ɹ ˈæ k t s
CONTRACTS(2), k ˈɒ n t ɹ ˌæ k t s
CONTRARY(1), k ˈɒ n t ɹ ə ɹ iː
CONTRARY(2), k ə n t ɹ ˈɛə ɹ iː
CONTRAST(1), k ə n t ɹ ˈɑː s t
CONTRAST(2), k ˈɒ n t ɹ ɑː s t
CONTRASTS(1), k ə n t ɹ ˈɑː s t s
CONTRASTS(2), k ˈɒ n t ɹ ɑː s t s
CONTRIBUTE, k ə n t ɹ ˈɪ b juː t
CONTRIBUTED, k ə n t ɹ ˈɪ b juː t ɪ d
CONTRIBUTING, k ə n t ɹ ˈɪ b juː t ɪ ŋ
CONTRIBUTION, k ˌɒ n t ɹ ɪ b ˈjuː ʃ ə n
CONTRIBUTIONS, k ˌɒ n t ɹ ɪ b ˈjuː ʃ ə n z
CONTRIBUTORS, k ə n t ɹ ˈɪ b jʊ t ə z
CONTROL, k ə n t ɹ ˈəʊ l
CONTROLLED, k ə n t ɹ ˈəʊ l d
CONTROLLER, k ə n t ɹ ˈəʊ l ə
CONTROLLING, k ə n t ɹ ˈəʊ l ɪ ŋ
CONTROLS, k ə n t ɹ ˈəʊ l z
CONTROVERSIAL, k ˌɒ n t ɹ ə v ˈɜː ʃ ə l
CONTROVERSY, k ˈɒ n t ɹ ə v ˌɜː s iː
CONVENIENCE, k ə n v ˈiː n ɪə n s
CONVENIENT, k ə n v ˈiː n j ə n t
CONVENTION, k ə n v ˈɛ n ʃ ə n
CONVENTIONAL, k ə n v ˈɛ n ʃ ə n ə l
CONVERSATION, k ˌɒ n v ə s ˈeɪ ʃ ə n
CONVERSATIONS, k ˌɒ n v ə s ˈeɪ ʃ ə n z
CONVERSION, k ə n v ˈɜː ʒ ə n
CONVERT(1), k ˈɒ n v ɜː t
CONVERT(2), k ə n v ˈɜː t
CONVERTED, k ə n v ˈɜː t ɪ d
CONVERTER, k ə n v ˈɜː t ə
CONVICTION, k ə n v ˈɪ k ʃ ə n
CONVINCED, k ə n v ˈɪ n s t
COOK, k ˈʊ k
COOKBOOK, k ˈʊ k b ˌʊ k
COOKED, k ˈʊ k t
COOKER, k ˈʊ k ə
COOKIE, k ˈʊ k iː
COOKIES, k ˈʊ k iː z
COOKING, k ˈʊ k ɪ ŋ
COOL, k ˈuː l
COOLER, k ˈuː l ə
COOLING, k ˈuː l ɪ ŋ
COOPER, k ˈuː p ə
COOPERATION, k əʊ ˌɒ p ə ɹ ˈeɪ ʃ ə n
COOPERATIVE, k əʊ ˈɒ p ə ɹ ə t ɪ v
COORDINATE(1), k əʊ ˈɔː d ɪ n ˌeɪ t
COORDINATE(2), k əʊ ˈɔː d ɪ n ə t
COORDINATION, k əʊ ˌɔː d ɪ n ˈeɪ ʃ ə n
COORDINATOR, k əʊ ˈɔː d ɪ n ˌeɪ t ə
COPE, k ˈəʊ p
COPIED, k ˈɒ p iː d
COPIES, k ˈɒ p iː z
COPPER, k ˈɒ p ə
COPY, k ˈɒ p iː
COPYING, k ˈɒ p iː ɪ ŋ
COPYRIGHT, k ˈɒ p iː ɹ ˌaɪ t
COPYRIGHTED, k ˈɒ p iː ɹ ˌaɪ t ɪ d
COPYRIGHTS, k ˈɒ p iː ɹ ˌaɪ t s
COR, k ˈɔː
CORAL, k ˈɔː ɹ ə l
CORBETT, k ˈɔː b ɪ t
CORD, k ˈɔː d
CORDLESS, k ˈɔː d l ə s
CORE, k ˈɔː
CORK, k ˈɔː k
CORN, k ˈɔː n
CORNER, k ˈɔː n ə
CORNERS, k ˈɔː n ə z
CORNWALL, k ˈɔː n w ɔː l
CORONATION, k ˌɒ ɹ ə n ˈeɪ ʃ ə n
CORP, k ˌɔː p
CORPORATE(1), k ˈɔː p ɹ ə t
CORPORATE(2), k ˈɔː p ə ɹ ə t
CORPORATION, k ˌɔː p ə ɹ ˈeɪ ʃ ə n
CORPORATIONS, k ˌɔː p ə ɹ ˈeɪ ʃ ə n z
CORPS(1), k ˈɔː
CORPS(2), k ˈɔː z
CORRECT, k ə ɹ ˈɛ k t
CORRECTION, k ə ɹ ˈɛ k ʃ ə n
CORRECTIONS, k ə ɹ ˈɛ k ʃ ə n z
CORRECTLY, k ə ɹ ˈɛ k t l iː
CORRELATION, k ˌɒ ɹ ə l ˈeɪ ʃ ə n
CORRESPONDENCE, k ˌɒ ɹ ɪ s p ˈɒ n d ə n s
CORRESPONDENT, k ˌɒ ɹ ɪ s p ˈɒ n d ə n t
CORRESPONDING, k ˌɒ ɹ ɪ s p ˈɒ n d ɪ ŋ
CORRIDOR, k ˈɒ ɹ ɪ d ɔː
CORRUPTION, k ə ɹ ˈɐ p ʃ ə n
COS, k ˈɒ s
COSMETIC, k ɒ z m ˈɛ t ɪ k
COSMETICS, k ɒ z m ˈɛ t ɪ k s
COST, k ˈɒ s t
COSTA, k ˈɒ s t ə
COSTA RICA, k ˈɒ s t ə ɹ ˈiː k ə
COSTING, k ˈɒ s t ɪ ŋ
COSTS, k ˈɒ s t s
COSTUME, k ˈɒ s t juː m
COSTUMES, k ˈɒ s t juː m z
COSY, k ˈəʊ z iː
COT, k ˈɒ t
COTTAGE, k ˈɒ t ɪ dʒ
COTTON, k ˈɒ t ə n
COU, k ˈuː
COUGH, k ˈɒ f
COUGHING, k ˈɒ f ɪ ŋ
COULD, k ˈʊ d
COUNCIL, k ˈaʊ n s ə l
COUNCILLOR(1), k ˈaʊ n s l ə
COUNCILLOR(2), k ˈaʊ n s ə l ə
COUNCILLORS(1), k ˈaʊ n s l ə z
COUNCILLORS(2), k ˈaʊ n s ə l ə z
COUNCILOR(1), k ˈaʊ n s l ə
COUNCILOR(2), k ˈaʊ n s ə l ə
COUNCILORS(1), k ˈaʊ n s l ə z
COUNCILORS(2), k ˈaʊ n s ə l ə z
COUNCILS, k ˈaʊ n s ə l z
COUNSEL, k ˈaʊ n s ə l
COUNSELING(1), k ˈaʊ n s ə l ɪ ŋ
COUNSELING(2), k ˈaʊ n s l ɪ ŋ
COUNT, k ˈaʊ n t
COUNTER, k ˈaʊ n t ə
COUNTERS, k ˈaʊ n t ə z
COUNTIES, k ˈaʊ n t iː z
COUNTING, k ˈaʊ n t ɪ ŋ
COUNTRIES, k ˈɐ n t ɹ iː z
COUNTRY, k ˈɐ n t ɹ iː
COUNTRYSIDE, k ˈɐ n t ɹ ɪ s ˌaɪ d
COUNTS, k ˈaʊ n t s
COUNTY, k ˈaʊ n t iː
COUP, k ˈuː
COUPLE, k ˈɐ p ə l
COUPLES, k ˈɐ p ə l z
COUPON, k ˈuː p ɒ n
COUPONS, k ˈuː p ɒ n z
COURAGE, k ˈɐ ɹ ɪ dʒ
COURIER, k ˈʊ ɹ ɪə
COURSE, k ˈɔː s
COURSES, k ˈɔː s ɪ z
COURT, k ˈɔː t
COURTESY, k ˈɜː t ə s iː
COURTS, k ˈɔː t s
COUSIN, k ˈɐ z ə n
COUSINS, k ˈɐ z ə n z
COVER, k ˈɐ v ə
COVERAGE(1), k ˈɐ v ɹ ɪ dʒ
COVERAGE(2), k ˈɐ v ə ɹ ɪ dʒ
COVERED, k ˈɐ v ə d
COVERING(1), k ˈɐ v ɹ ɪ ŋ
COVERING(2), k ˈɐ v ə ɹ ɪ ŋ
COVERS, k ˈɐ v ə z
COW, k ˈaʊ
COWS, k ˈaʊ z
COX, k ˈɒ k s
CRACK, k ɹ ˈæ k
CRACKED, k ɹ ˈæ k t
CRACKER, k ɹ ˈæ k ə
CRACKERS, k ɹ ˈæ k ə z
CRACKING, k ɹ ˈæ k ɪ ŋ
CRAFT, k ɹ ˈɑː f t
CRAFTS, k ɹ ˈɑː f t s
CRAFTY, k ɹ ˈɑː f t iː
CRAIG, k ɹ ˈeɪ g
CRAP, k ɹ ˈæ p
CRASH, k ɹ ˈæ ʃ
CRASHED, k ɹ ˈæ ʃ t
CRAZY, k ɹ ˈeɪ z iː
CREAM, k ɹ ˈiː m
CREATE, k ɹ iː ˈeɪ t
CREATED, k ɹ iː ˈeɪ t ɪ d
CREATES, k ɹ iː ˈeɪ t s
CREATING, k ɹ iː ˈeɪ t ɪ ŋ
CREATION, k ɹ iː ˈeɪ ʃ ə n
CREATIVE, k ɹ iː ˈeɪ t ɪ v
CREATIVITY, k ɹ ˌiː eɪ t ˈɪ v ɪ t iː
CREATOR, k ɹ iː ˈeɪ t ə
CREATURE, k ɹ ˈiː tʃ ə
CREATURES, k ɹ ˈiː tʃ ə z
CREDIT, k ɹ ˈɛ d ɪ t
CREDITS, k ɹ ˈɛ d ɪ t s
CREEK, k ɹ ˈiː k
CREME, k ɹ ˈiː m
CREW, k ɹ ˈuː
CRICKET, k ɹ ˈɪ k ɪ t
CRIED, k ɹ ˈaɪ d
CRIME, k ɹ ˈaɪ m
CRIMES, k ɹ ˈaɪ m z
CRIMINAL, k ɹ ˈɪ m ɪ n ə l
CRISIS, k ɹ ˈaɪ s ɪ s
CRITERIA, k ɹ aɪ t ˈɪə ɹ ɪə
CRITICAL, k ɹ ˈɪ t ɪ k ə l
CRITICISM, k ɹ ˈɪ t ɪ s ˌɪ z ə m
CRITICS, k ɹ ˈɪ t ɪ k s
CROATIA, k ɹ əʊ ˈeɪ ʃ ə
CROP, k ɹ ˈɒ p
CROPS, k ɹ ˈɒ p s
CROQUET, k ɹ ˈəʊ k eɪ
CROSS, k ɹ ˈɒ s
CROSSED, k ɹ ˈɒ s t
CROSSING, k ɹ ˈɒ s ɪ ŋ
CROSSWORD, k ɹ ˈɒ s w ˌɜː d
CROWD, k ɹ ˈaʊ d
CROWN, k ɹ ˈaʊ n
CRUCIAL, k ɹ ˈuː ʃ ə l
CRUEL(1), k ɹ ˈʊə l
CRUEL(2), k ɹ ˈuː ə l
CRUISE, k ɹ ˈuː z
CRUISES, k ɹ ˈuː z ɪ z
CRUMBS, k ɹ ˈɐ m z
CRUZ, k ɹ ˈuː z
CRY, k ɹ ˈaɪ
CRYING, k ɹ ˈaɪ ɪ ŋ
CRYSTAL, k ɹ ˈɪ s t ə l
CUBA, k ˈjuː b ə
CUBE, k ˈjuː b
CUBS, k ˈɐ b z
CUDDLE, k ˈɐ d ə l
CUE, k ˈjuː
CUES, k ˈjuː z
CUISINE, k w ɪ z ˈiː n
CULTURAL, k ˈɐ l tʃ ə ɹ ə l
CULTURE, k ˈɐ l tʃ ə
CULTURES, k ˈɐ l tʃ ə z
CUM, k ˈɐ m
CUNT, k ˈɐ n t
CUP, k ˈɐ p
CUPBOARD, k ˈɐ b ə d
CUPBOARDS, k ˈɐ b ə d z
CUPS, k ˈɐ p s
CURE, k ˈjʊə
CURIOUS, k ˈjʊə ɹ ɪə s
CURLY, k ˈɜː l iː
CURRENCY, k ˈɐ ɹ ə n s iː
CURRENT, k ˈɐ ɹ ə n t
CURRENTLY, k ˈɐ ɹ ə n t l iː
CURRICULUM, k ə ɹ ˈɪ k jʊ l ə m
CURRY, k ˈɐ ɹ iː
CURTAIN, k ˈɜː t ə n
CURTAINS, k ˈɜː t ə n z
CURVE, k ˈɜː v
CUSHION, k ˈʊ ʃ ə n
CUSTARD, k ˈɐ s t ə d
CUSTODY, k ˈɐ s t ə d iː
CUSTOM, k ˈɐ s t ə m
CUSTOMER, k ˈɐ s t ə m ə
CUSTOMERS, k ˈɐ s t ə m ə z
CUSTOMIZE, k ˈɐ s t ə m ˌaɪ z
CUSTOMIZED, k ˈɐ s t ə m ˌaɪ z d
CUSTOMS, k ˈɐ s t ə m z
CUT, k ˈɐ t
CUTE, k ˈjuː t
CUTS, k ˈɐ t s
CUTTING, k ˈɐ t ɪ ŋ
CYBER, s ˈaɪ b ə
CYCLE, s ˈaɪ k ə l
CYCLES, s ˈaɪ k ə l z
CYCLING, s ˈaɪ k l ɪ ŋ
CYLINDER, s ˈɪ l ɪ n d ə
CYPRUS, s ˈaɪ p ɹ ə s
CYR, s ˈɪə
CZECH, tʃ ˈɛ k
DAD, d ˈæ d
DADDY, d ˈæ d iː
DAFT, d ˈɑː f t
DAILY, d ˈeɪ l iː
DAIRY, d ˈɛə ɹ iː
DAISY, d ˈeɪ z iː
DAKOTA, d ə k ˈəʊ t ə
DALE, d ˈeɪ l
DALLAS, d ˈæ l ə s
DAM, d ˈæ m
DAMAGE, d ˈæ m ɪ dʒ
DAMAGED, d ˈæ m ɪ dʒ d
DAMAGES, d ˈæ m ɪ dʒ ɪ z
DAMN, d ˈæ m
DAMP, d ˈæ m p
DAN, d ˈæ n
DANCE, d ˈɑː n s
DANCING, d ˈɑː n s ɪ ŋ
DANGER, d ˈeɪ n dʒ ə
DANGEROUS, d ˈeɪ n dʒ ə ɹ ə s
DANGERS, d ˈeɪ n dʒ ə z
DANIEL, d ˈæ n j ə l
DANISH, d ˈeɪ n ɪ ʃ
DANNY, d ˈæ n iː
DARE, d ˈɛə
DARK, d ˈɑː k
DARKER, d ˈɑː k ə
DARKNESS, d ˈɑː k n ə s
DARLING, d ˈɑː l ɪ ŋ
DARLINGTON, d ˈɑː l ɪ ŋ t ə n
DARREN, d ˈæ ɹ ə n
DARTS, d ˈɑː t s
DARWIN, d ˈɑː w ɪ n
DARYL, d ˈæ ɹ ə l
DASH, d ˈæ ʃ
DATA(1), d ˈeɪ t ə
DATA(2), d ˈɑː t ə
DATABASE, d ˈeɪ t ə b ˌeɪ s
DATABASES, d ˈeɪ t ə b ˌeɪ s ɪ z
DATE, d ˈeɪ t
DATED, d ˈeɪ t ɪ d
DATES, d ˈeɪ t s
DATING, d ˈeɪ t ɪ ŋ
DAUGHTER, d ˈɔː t ə
DAUGHTERS, d ˈɔː t ə z
DAVE, d ˈeɪ v
DAVID, d ˈeɪ v ɪ d
DAVIDSON, d ˈeɪ v ɪ d s ə n
DAVIES, d ˈeɪ v iː z
DAVIS, d ˈeɪ v ɪ s
DAWN, d ˈɔː n
DAY, d ˈeɪ
DAYLIGHT, d ˈeɪ l ˌaɪ t
DAYS, d ˈeɪ z
DAYTON, d ˈeɪ t ə n
DE(1), d ə
DE(2), d ˈeɪ
DE(3), d ˈiː
DEAD, d ˈɛ d
DEADLINE, d ˈɛ d l ˌaɪ n
DEAF, d ˈɛ f
DEAL, d ˈiː l
DEALER, d ˈiː l ə
DEALERS, d ˈiː l ə z
DEALING, d ˈiː l ɪ ŋ
DEALS, d ˈiː l z
DEALT, d ˈɛ l t
DEAN, d ˈiː n
DEANA, d ˌiː ˈæ n ə
DEAR, d ˈɪə
DEARER, d ˈɪə ɹ ə
DEATH, d ˈɛ θ
DEATHS, d ˈɛ θ s
DEBATE, d ɪ b ˈeɪ t
DEBBIE, d ˈɛ b iː
DEBORAH(1), d ˈɛ b ɹ ə
DEBORAH(2), d ˈɛ b ə ɹ ə
DEBT, d ˈɛ t
DEBTS, d ˈɛ t s
DEBUG, d iː b ˈɐ g
DEBUT, d ˈeɪ b juː
DEC, d ˈɛ k
DECADE(1), d ˈɛ k eɪ d
DECADE(2), d ɛ k ˈeɪ d
DECADES(1), d ˈɛ k eɪ d z
DECADES(2), d ɛ k ˈeɪ d z
DECEMBER, d ɪ s ˈɛ m b ə
DECENT, d ˈiː s ə n t
DECIDE, d ˌɪ s ˈaɪ d
DECIDED, d ˌɪ s ˈaɪ d ɪ d
DECIDES, d ˌɪ s ˈaɪ d z
DECIDING, d ˌɪ s ˈaɪ d ɪ ŋ
DECIMAL, d ˈɛ s ə m ə l
DECISION, d ɪ s ˈɪ ʒ ə n
DECISIONS, d ɪ s ˈɪ ʒ ə n z
DECK, d ˈɛ k
DECLARATION, d ˌɛ k l ə ɹ ˈeɪ ʃ ə n
DECLARED, d ɪ k l ˈɛə d
DECLINE, d ɪ k l ˈaɪ n
DECOR(1), d ˈeɪ k ɔː
DECOR(2), d ˈe k ɔː
DECORATING, d ˈɛ k ə ɹ ˌeɪ t ɪ ŋ
DECORATIONS, d ˌɛ k ə ɹ ˈeɪ ʃ ə n z
DECORATIVE, d ˈɛ k ɹ ə t ɪ v
DECREASE(1), d ˈiː k ɹ ˌiː s
DECREASE(2), d ɪ k ɹ ˈiː s
DECREASED(1), d ˈiː k ɹ ˌiː s t
DECREASED(2), d ɪ k ɹ ˈiː s t
DEDICATED, d ˈɛ d ɪ k eɪ t ɪ d
DEE, d ˈiː
DEEMED, d ˈiː m d
DEEP, d ˈiː p
DEEPER, d ˈiː p  ə
DEEPLY, d ˈiː p l iː
DEER, d ˈɪə
DEES, d ˈiː z
DEFAULT(1), d ˈiː f ɔː l t
DEFAULT(2), d ɪ f ˈɔː l t
DEFEAT, d ɪ f ˈiː t
DEFECTS(1), d ˈiː f ɛ k t s
DEFECTS(2), d ɪ f ˈɛ k t s
DEFENCE, d ɪ f ˈɛ n s
DEFEND, d ɪ f ˈɛ n d
DEFENDANT, d ɪ f ˈɛ n d ə n t
DEFENDANTS, d ɪ f ˈɛ n d ə n t s
DEFENSE, d ɪ f ˈɛ n s
DEFICIT, d ˈɛ f ɪ s ɪ t
DEFINE, d ɪ f ˈaɪ n
DEFINED, d ɪ f ˈaɪ n d
DEFINES, d ɪ f ˈaɪ n z
DEFINING, d ɪ f ˈaɪ n ɪ ŋ
DEFINITE, d ˈɛ f ɪ n ɪ t
DEFINITELY, d ˈɛ f ɪ n ɪ t l iː
DEFINITION, d ˌɛ f ɪ n ˈɪ ʃ ə n
DEFINITIONS, d ˌɛ f ɪ n ˈɪ ʃ ə n z
DEGREE, d ɪ g ɹ ˈiː
DEGREES, d ɪ g ɹ ˈiː z
DELAWARE, d ˈɛ l ə w ˌɛə
DELAY, d ɪ l ˈeɪ
DELAYED, d ɪ l ˈeɪ d
DELAYS, d ɪ l ˈeɪ z
DELEGATE(1), d ˈɛ l ɪ g ə t
DELEGATE(2), d ˈɛ l ɪ g ˌeɪ t
DELEGATES(1), d ˈɛ l ɪ g ə t s
DELEGATES(2), d ˈɛ l ɪ g ˌeɪ t s
DELEGATION, d ˌɛ l ɪ g ˈeɪ ʃ ə n
DELETE, d ɪ l ˈiː t
DELETED, d ɪ l ˈiː t ɪ d
DELHI, d ˈɛ l iː
DELIBERATELY(1), d ɪ l ˈɪ b ɹ ə t l iː
DELIBERATELY(2), d ɪ l ˈɪ b ə ɹ ə t l iː
DELICATE, d ˈɛ l ɪ k ə t
DELICIOUS, d ɪ l ˈɪ ʃ ə s
DELIGHT, d ɪ l ˈaɪ t
DELIVER, d ɪ l ˈɪ v ə
DELIVERED, d ɪ l ˈɪ v ə d
DELIVERING, d ɪ l ˈɪ v ə ɹ ɪ ŋ
DELIVERS, d ɪ l ˈɪ v ə z
DELIVERY, d ɪ l ˈɪ v ə ɹ iː
DELL, d ˈɛ l
DELLA, d ˈɛ l ə
DELTA, d ˈɛ l t ə
DELUXE(1), d ɪ l ˈɐ k s
DELUXE(2), d ɪ l ˈʊ k s
DEMAND, d ɪ m ˈɑː n d
DEMANDED, d ɪ m ˈɑː n d ɪ d
DEMANDING, d ɪ m ˈɑː n d ɪ ŋ
DEMANDS, d ɪ m ˈɑː n d z
DEMO, d ˈɛ m əʊ
DEMOCRACY, d ɪ m ˈɒ k ɹ ə s iː
DEMOCRATIC, d ˌɛ m ə k ɹ ˈæ t ɪ k
DEMOCRATS, d ˈɛ m ə k ɹ ˌæ t s
DEMONSTRATE, d ˈɛ m ə n s t ɹ ˌeɪ t
DEMONSTRATED, d ˈɛ m ə n s t ɹ ˌeɪ t ɪ d
DEMONSTRATION, d ˌɛ m ə n s t ɹ ˈeɪ ʃ ə n
DEMONSTRATIONS, d ˌɛ m ə n s t ɹ ˈeɪ ʃ ə n z
DEN, d ˈɛ n
DENIED, d ɪ n ˈaɪ d
DENIS, d ˈɛ n ɪ s
DENISE, d ɪ n ˈiː s
DENMARK, d ˈɛ n m ˌɑː k
DENNIS, d ˈɛ n ɪ s
DENSITY, d ˈɛ n s ɪ t iː
DENTAL, d ˈɛ n t ə l
DENTIST, d ˈɛ n t ɪ s t
DENVER, d ˈɛ n v ə
DENY, d ɪ n ˈaɪ
DEPARTMENT, d ɪ p ˈɑː t m ə n t
DEPARTMENTS, d ɪ p ˈɑː t m ə n t s
DEPARTURE, d ɪ p ˈɑː tʃ ə
DEPEND, d ɪ p ˈɛ n d
DEPENDENT, d ɪ p ˈɛ n d ə n t
DEPENDING, d ɪ p ˈɛ n d ɪ ŋ
DEPENDS, d ɪ p ˈɛ n d z
DEPLOYMENT, d ɪ p l ˈɔɪ m ə n t
DEPOSIT, d ɪ p ˈɒ z ɪ t
DEPOSITS, d ɪ p ˈɒ z ɪ t s
DEPOT, d ˈɛ p əʊ
DEPRESSED, d ɪ p ɹ ˈɛ s t
DEPRESSION, d ɪ p ɹ ˈɛ ʃ ə n
DEPTH, d ˈɛ p θ
DEPUTY, d ˈɛ p jʊ t iː
DER, d ˈɜː
DEREK, d ˈɛ ɹ ɪ k
DERIVED, d ə ɹ ˈaɪ v d
DES(1), d ˌɪ
DES(2), d ˈɛ s
DESCRIBE, d ɪ s k ɹ ˈaɪ b
DESCRIBED, d ɪ s k ɹ ˈaɪ b d
DESCRIBES, d ɪ s k ɹ ˈaɪ b z
DESCRIBING, d ɪ s k ɹ ˈaɪ b ɪ ŋ
DESCRIPTION, d ɪ s k ɹ ˈɪ p ʃ ə n
DESCRIPTIONS, d ɪ s k ɹ ˈɪ p ʃ ə n z
DESERT(1), d ɪ z ˈɜː t
DESERT(2), d ˈɛ z ə t
DESIGN, d ɪ z ˈaɪ n
DESIGNATED, d ˈɛ z ɪ g n ˌeɪ t ɪ d
DESIGNED, d ɪ z ˈaɪ n d
DESIGNER, d ɪ z ˈaɪ n ə
DESIGNERS, d ɪ z ˈaɪ n ə z
DESIGNING, d ɪ z ˈaɪ n ɪ ŋ
DESIGNS, d ɪ z ˈaɪ n z
DESIRABLE, d ɪ z ˈaɪ ə ɹ ə b ə l
DESIRE, d ɪ z ˈaɪ ə
DESIRED, d ɪ z ˈaɪ ə d
DESK, d ˈɛ s k
DESKTOP, d ˈɛ s k t ˌɒ p
DESKTOPS, d ˈɛ s k t ˌɒ p s
DESPERATE(1), d ˈɛ s p ɹ ɪ t
DESPERATE(2), d ˈɛ s p ə ɹ ɪ t
DESPERATELY(1), d ˈɛ s p ɹ ə t l iː
DESPERATELY(2), d ˈɛ s p ə ɹ ə t l iː
DESPITE, d ɪ s p ˈaɪ t
DESTINATION, d ˌɛ s t ɪ n ˈeɪ ʃ ə n
DESTINATIONS, d ˌɛ s t ɪ n ˈeɪ ʃ ə n z
DESTROY, d ɪ s t ɹ ˈɔɪ
DESTROYED, d ɪ s t ɹ ˈɔɪ d
DESTRUCTION, d ɪ s t ɹ ˈɐ k ʃ ə n
DETAIL, d ˈiː t eɪ l
DETAILED, d ˈiː t eɪ l d
DETAILS, d ˈiː t eɪ l z
DETECT, d ɪ t ˈɛ k t
DETECTED, d ɪ t ˈɛ k t ɪ d
DETECTION, d ɪ t ˈɛ k ʃ ə n
DETECTIVE, d ɪ t ˈɛ k t ɪ v
DETECTOR, d ɪ t ˈɛ k t ə
DETENTION, d ɪ t ˈɛ n ʃ ə n
DETERMINATION, d ɪ t ˌɜː m ɪ n ˈeɪ ʃ ə n
DETERMINE, d ɪ t ˈɜː m ɪ n
DETERMINED, d ɪ t ˈɜː m ɪ n d
DETERMINES, d ɪ t ˈɜː m ɪ n z
DETERMINING, d ɪ t ˈɜː m ɪ n ɪ ŋ
DETROIT, d ɪ t ɹ ˈɔɪ t
DEUTSCH, d ˈɔɪ tʃ
DEV, d ˈɛ v
DEVELOP, d ɪ v ˈɛ l ə p
DEVELOPED, d ɪ v ˈɛ l ə p t
DEVELOPER, d ɪ v ˈɛ l ə p ə
DEVELOPERS, d ɪ v ˈɛ l ə p ə z
DEVELOPING, d ɪ v ˈɛ l ə p ɪ ŋ
DEVELOPMENT, d ɪ v ˈɛ l ə p m ə n t
DEVELOPMENTAL, d ɪ v ˌɛ l ə p m ˈɛ n t ə l
DEVELOPMENTS, d ɪ v ˈɛ l ə p m ə n t s
DEVIANT, d ˈiː v ɪə n t
DEVICE, d ɪ v ˈaɪ s
DEVICES, d ɪ v ˈaɪ s ɪ z
DEVIL, d ˈɛ v ə l
DEVON, d ˈɛ v ə n
DEVOTED, d ɪ v ˈəʊ t ɪ d
DI(1), d ˈaɪ
DI(2), d ˈiː
DIABETES, d ˌaɪ ə b ˈiː t iː z
DIAGNOSIS, d ˌaɪ ə g n ˈəʊ s ɪ s
DIAGNOSTIC, d ˌaɪ ə g n ˈɒ s t ɪ k
DIAGRAM, d ˈaɪ ə g ɹ ˌæ m
DIAL(1), d ˈaɪ l
DIAL(2), d ˈaɪ ə l
DIALOG, d ˈaɪ ə l ɒ g
DIALOGUE, d ˈaɪ ə l ˌɒ g
DIAMETER, d aɪ ˈæ m ɪ t ə
DIAMOND, d ˈaɪ ə m ə n d
DIAMONDS, d ˈaɪ ə m ə n d z
DIANA, d aɪ ˈæ n ə
DIANE, d aɪ ˈæ n
DIARY, d ˈaɪ ə ɹ iː
DICE, d ˈaɪ s
DICK, d ˈɪ k
DICKHEAD, d ˈɪ k h ˌɛ d
DICKS, d ˈɪ k s
DICTIONARY, d ˈɪ k ʃ ə n ə ɹ iː
DID(1), d ɪ d
DID(2), d ˈɪ d
DIE, d ˈaɪ
DIED, d ˈaɪ d
DIEGO, d ɪ ˈeɪ g əʊ
DIES, d ˈaɪ z
DIESEL, d ˈiː z ə l
DIET, d ˈaɪ ə t
DIETARY, d ˈaɪ ə t ə ɹ iː
DIFF, d ˈɪ f
DIFFER, d ˈɪ f ə
DIFFERENCE(1), d ˈɪ f ɹ ə n s
DIFFERENCE(2), d ˈɪ f ə ɹ ə n s
DIFFERENCES(1), d ˈɪ f ɹ ə n s ɪ z
DIFFERENCES(2), d ˈɪ f ə ɹ ə n s ɪ z
DIFFERENT(1), d ˈɪ f ɹ ə n t
DIFFERENT(2), d ˈɪ f ə ɹ ə n t
DIFFERENTIAL, d ˌɪ f ə ɹ ə n ʃ ə l
DIFFERENTLY(1), d ˈɪ f ɹ ə n t l iː
DIFFERENTLY(2), d ˈɪ f ə ɹ ə n t l iː
DIFFICULT, d ˈɪ f ɪ k ə l t
DIFFICULTIES, d ˈɪ f ɪ k ə l t iː z
DIFFICULTY, d ˈɪ f ɪ k ə l t iː
DIG, d ˈɪ g
DIGEST(1), d aɪ dʒ ˈɛ s t
DIGEST(2), d ɪ dʒ ˈɛ s t
DIGEST(3), d ˈaɪ dʒ ɛ s t
DIGGER, d ˈɪ g ə
DIGGING, d ˈɪ g ɪ ŋ
DIGIT, d ˈɪ dʒ ɪ t
DIGITAL, d ˈɪ dʒ ɪ t ə l
DILDO, d ˈɪ l d əʊ
DIMENSION(1), d aɪ m ˈɛ n ʃ ə n
DIMENSION(2), d ɪ m ˈɛ n ʃ ə n
DIMENSIONAL(1), d aɪ m ˈɛ n ʃ ə n ə l
DIMENSIONAL(2), d ɪ m ˈɛ n ʃ ə n ə l
DIMENSIONS(1), d aɪ m ˈɛ n ʃ ə n z
DIMENSIONS(2), d ɪ m ˈɛ n ʃ ə n z
DINDA, d ˈɪ n d ə
DING, d ˈɪ ŋ
DINING, d ˈaɪ n ɪ ŋ
DINNER, d ˈɪ n ə
DINNERS, d ˈɪ n ə z
DIPLOMA, d ɪ p l ˈəʊ m ə
DIPLOMATIC, d ˌɪ p l ə m ˈæ t ɪ k
DIRECT(1), d aɪ ɹ ˈɛ k t
DIRECT(2), d ɪ ɹ ˈɛ k t
DIRECTED(1), d aɪ ɹ ˈɛ k t ɪ d
DIRECTED(2), d ɪ ɹ ˈɛ k t ɪ d
DIRECTION(1), d aɪ ɹ ˈɛ k ʃ ə n
DIRECTION(2), d ɪ ɹ ˈɛ k ʃ ə n
DIRECTIONS(1), d aɪ ɹ ˈɛ k ʃ ə n z
DIRECTIONS(2), d ɪ ɹ ˈɛ k ʃ ə n z
DIRECTIVE(1), d aɪ ɹ ˈɛ k t ɪ v
DIRECTIVE(2), d ɪ ɹ ˈɛ k t ɪ v
DIRECTLY(1), d aɪ ɹ ˈɛ k t l iː
DIRECTLY(2), d ɪ ɹ ˈɛ k t l iː
DIRECTOR(1), d aɪ ɹ ˈɛ k t ə
DIRECTOR(2), d ɪ ɹ ˈɛ k t ə
DIRECTORIES(1), d aɪ ɹ ˈɛ k t ə ɹ iː z
DIRECTORIES(2), d ɪ ɹ ˈɛ k t ə ɹ iː z
DIRECTORS(1), d aɪ ɹ ˈɛ k t ə z
DIRECTORS(2), d ɪ ɹ ˈɛ k t ə z
DIRECTORY(1), d aɪ ɹ ˈɛ k t ə ɹ iː
DIRECTORY(2), d ɪ ɹ ˈɛ k t ə ɹ iː
DIRT, d ˈɜː t
DIRTY, d ˈɜː t iː
DISABILITIES, d ɪ s ə b ˈɪ l ɪ t iː z
DISABILITY, d ˌɪ s ə b ˈɪ l ɪ t iː
DISABLE, d ɪ s ˈeɪ b ə l
DISABLED, d ɪ s ˈeɪ b ə l d
DISAGREE, d ɪ s ə g ɹ ˈiː
DISAPPOINTED, d ˌɪ s ə p ˈɔɪ n t ɪ d
DISAPPOINTMENT, d ˌɪ s ə p ˈɔɪ n t m ə n t
DISASTER, d ɪ z ˈɑː s t ə
DISC, d ˈɪ s k
DISCHARGE(1), d ˈɪ s tʃ ˌɑː dʒ
DISCHARGE(2), d ɪ s tʃ ˈɑː dʒ
DISCIPLINE, d ˈɪ s ə p l ɪ n
DISCLAIMER, d ɪ s k l ˈeɪ m ə
DISCLAIMERS, d ɪ s k l ˈeɪ m ə z
DISCLOSURE, d ɪ s k l ˈəʊ ʒ ə
DISCO, d ˈɪ s k əʊ
DISCOUNT(1), d ˈɪ s k aʊ n t
DISCOUNT(2), d ɪ s k ˈaʊ n t
DISCOUNTED, d ˈɪ s k ˌaʊ n t ɪ d
DISCOUNTS(1), d ˈɪ s k ˌaʊ n t s
DISCOUNTS(2), d ɪ s k ˈaʊ n t s
DISCOURSE, d ˈɪ s k ɔː s
DISCOVER, d ɪ s k ˈɐ v ə
DISCOVERED, d ɪ s k ˈɐ v ə d
DISCOVERY(1), d ɪ s k ˈɐ v ɹ iː
DISCOVERY(2), d ɪ s k ˈɐ v ə ɹ iː
DISCRETION, d ɪ s k ɹ ˈɛ ʃ ə n
DISCRIMINATION, d ɪ s k ɹ ˌɪ m ɪ n ˈeɪ ʃ ə n
DISCS, d ˈɪ s k s
DISCUSS, d ɪ s k ˈɐ s
DISCUSSED, d ɪ s k ˈɐ s t
DISCUSSES, d ɪ s k ˈɐ s ɪ z
DISCUSSING, d ɪ s k ˈɐ s ɪ ŋ
DISCUSSION, d ɪ s k ˈɐ ʃ ə n
DISCUSSIONS, d ɪ s k ˈɐ ʃ ə n z
DISEASE, d ɪ z ˈiː z
DISEASES, d ɪ z ˈiː z ɪ z
DISGUSTING, d ɪ s g ˈɐ s t ɪ ŋ
DISH, d ˈɪ ʃ
DISHES, d ˈɪ ʃ ɪ z
DISHWASHER, d ˈɪ ʃ w ˌɒ ʃ ə
DISK, d ˈɪ s k
DISMISSAL, d ɪ s m ˈɪ s ə l
DISMISSED, d ɪ s m ˈɪ s t
DISNEY, d ˈɪ z n iː
DISORDER, d ɪ s ˈɔː d ə
DISORDERS, d ɪ s ˈɔː d ə z
DISPATCHED, d ɪ s p ˈæ tʃ t
DISPLAY, d ɪ s p l ˈeɪ
DISPLAYED, d ɪ s p l ˈeɪ d
DISPLAYING, d ɪ s p l ˈeɪ ɪ ŋ
DISPLAYS, d ɪ s p l ˈeɪ z
DISPOSAL, d ɪ s p ˈəʊ z ə l
DISPUTE, d ɪ s p ˈjuː t
DISTANCE, d ˈɪ s t ə n s
DISTANT, d ˈɪ s t ə n t
DISTINCT, d ɪ s t ˈɪ ŋ k t
DISTINCTION, d ɪ s t ˈɪ ŋ k ʃ ə n
DISTINCTIVE, d ɪ s t ˈɪ ŋ k t ɪ v
DISTINGUISH, d ɪ s t ˈɪ ŋ g w ɪ ʃ
DISTINGUISHED, d ɪ s t ˈɪ ŋ g w ɪ ʃ t
DISTRIBUTE, d ɪ s t ɹ ˈɪ b juː t
DISTRIBUTED, d ɪ s t ɹ ˈɪ b jʊ t ɪ d
DISTRIBUTION, d ˌɪ s t ɹ ɪ b ˈjuː ʃ ə n
DISTRIBUTIONS, d ˌɪ s t ɹ ɪ b ˈjuː ʃ ə n z
DISTRIBUTOR, d ɪ s t ɹ ˈɪ b jʊ t ə
DISTRIBUTORS, d ɪ s t ɹ ˈɪ b jʊ t ə z
DISTRICT, d ˈɪ s t ɹ ɪ k t
DISTRICTS, d ˈɪ s t ɹ ɪ k t s
DISTURBED, d ɪ s t ˈɜː b d
DIVE, d ˈaɪ v
DIVERSE(1), d aɪ v ˈɜː s
DIVERSE(2), d ˈaɪ v ɜː s
DIVERSITY, d aɪ v ˈɜː s ɪ t iː
DIVIDE, d ɪ v ˈaɪ d
DIVIDED, d ɪ v ˈaɪ d ɪ d
DIVINE, d ɪ v ˈaɪ n
DIVING, d ˈaɪ v ɪ ŋ
DIVISION, d ɪ v ˈɪ ʒ ə n
DIVISIONS, d ɪ v ˈɪ ʒ ə n z
DIVORCE, d ɪ v ˈɔː s
DO, d ˈuː
DOC, d ˈɒ k
DOCTOR, d ˈɒ k t ə
DOCTORS, d ˈɒ k t ə z
DOCTRINE, d ˈɒ k t ɹ ɪ n
DOCUMENT, d ˈɒ k jʊ m ɛ n t
DOCUMENTARY, d ˌɒ k jʊ m ˈɛ n t ə ɹ iː
DOCUMENTATION, d ˌɒ k jʊ m ɛ n t ˈeɪ ʃ ə n
DOCUMENTED, d ˈɒ k jʊ m ˌɛ n t ɪ d
DOCUMENTS, d ˈɒ k jʊ m ə n t s
DODGE, d ˈɒ dʒ
DOE, d ˈəʊ
DOES(1), d ə z
DOES(2), d ˈɐ z
DOES(3), d ˈəʊ z
DOG, d ˈɒ g
DOGGY, d ˈɒ g iː
DOGS, d ˈɒ g z
DOING, d ˈuː ɪ ŋ
DOLE, d ˈəʊ l
DOLL, d ˈɒ l
DOLLAR, d ˈɒ l ə
DOLLARS, d ˈɒ l ə z
DOLLS, d ˈɒ l z
DOLLY, d ˈɒ l iː
DOMAIN, d ə m ˈeɪ n
DOMAINS(1), d əʊ m ˈeɪ n z
DOMAINS(2), d ə m ˈeɪ n z
DOMESTIC, d ə m ˈɛ s t ɪ k
DOMINANT, d ˈɒ m ɪ n ə n t
DOMINATED, d ˈɒ m ɪ n ˌeɪ t ɪ d
DOMINICAN, d ə m ˈɪ n ɪ k ə n
DON, d ˈɒ n
DONALD, d ˈɒ n ə l d
DONATE, d ˈəʊ n ˌeɪ t
DONATION, d əʊ n ˈeɪ ʃ ə n
DONATIONS, d əʊ n ˈeɪ ʃ ə n z
DONE, d ˈɐ n
DONKEY, d ˈɒ ŋ k iː
DONNA, d ˈɒ n ə
DONOR, d ˈəʊ n ə
DOO, d ˈuː
DOOR, d ˈɔː
DOORS, d ˈɔː z
DOORWAY, d ˈɔː w ˌeɪ
DOREEN, d ə ɹ ˈiː n
DORIS, d ˈɒ ɹ ɪ s
DOROTHY, d ˈɒ ɹ ə θ iː
DORSET, d ˈɔː s ɪ t
DOS, d ˈɒ s
DOSE, d ˈəʊ s
DOT, d ˈɒ t
DOUBLE, d ˈɐ b ə l
DOUBT, d ˈaʊ t
DOUBTS, d ˈaʊ t s
DOUG, d ˈɐ g
DOUGLAS, d ˈɐ g l ə s
DOWN, d ˈaʊ n
DOWNLOAD, d ˈaʊ n l ˌəʊ d
DOWNLOADED, d ˈaʊ n l ˌəʊ d ɪ d
DOWNLOADING, d ˈaʊ n l ˌəʊ d ɪ ŋ
DOWNLOADS, d ˈaʊ n l ˌəʊ d z
DOWNSTAIRS, d ˈaʊ n s t ˈɛə z
DOWNTOWN, d ˈaʊ n t ˈaʊ n
DOZEN, d ˈɐ z ə n
DRAFT, d ɹ ˈɑː f t
DRAG, d ɹ ˈæ g
DRAGON, d ɹ ˈæ g ə n
DRAIN, d ɹ ˈeɪ n
DRAMA, d ɹ ˈɑː m ə
DRAMATIC, d ɹ ə m ˈæ t ɪ k
DRAMATICALLY(1), d ɹ ə m ˈæ t ɪ k l iː
DRAMATICALLY(2), d ɹ ə m ˈæ t ɪ k ə l iː
DRANK, d ɹ ˈæ ŋ k
DRAUGHT, d ɹ ˈɑː f t
DRAW, d ɹ ˈɔː
DRAWER, d ɹ ˈɔː ə
DRAWERS, d ɹ ˈɔː ə z
DRAWING, d ɹ ˈɔː ɪ ŋ
DRAWINGS, d ɹ ˈɔː ɪ ŋ z
DRAWN, d ɹ ˈɔː n
DREADFUL, d ɹ ˈɛ d f ə l
DREAM, d ɹ ˈiː m
DREAMING, d ɹ ˈiː m ɪ ŋ
DREAMS, d ɹ ˈiː m z
DRESS, d ɹ ˈɛ s
DRESSED, d ɹ ˈɛ s t
DRESSES, d ɹ ˈɛ s ɪ z
DRESSING, d ɹ ˈɛ s ɪ ŋ
DREW, d ɹ ˈuː
DRIED, d ɹ ˈaɪ d
DRIES, d ɹ ˈaɪ z
DRILL, d ɹ ˈɪ l
DRINK, d ɹ ˈɪ ŋ k
DRINKING, d ɹ ˈɪ ŋ k ɪ ŋ
DRINKS, d ɹ ˈɪ ŋ k s
DRIVE, d ɹ ˈaɪ v
DRIVEN, d ɹ ˈɪ v ə n
DRIVER, d ɹ ˈaɪ v ə
DRIVERS, d ɹ ˈaɪ v ə z
DRIVES, d ɹ ˈaɪ v z
