'EM, ə m
SANDWICH(3), s ˈæ n d w ɪ tʃ
SANDWICHES(1), s ˈæ m w ɪ tʃ ɪ z
SANDWICHES(2), s ˈæ n w ɪ tʃ ɪ z
SANDWICHES(3), s ˈæ n d w ɪ tʃ ɪ z
SANDY, s ˈæ n d iː
SANG, s ˈæ ŋ
SANTA, s ˈæ n t ə
SAP, s ˈæ p
SARA, s ˈɛə ɹ ə
SARAH, s ˈɛə ɹ ə
SASKATCHEWAN, s æ s k ˈæ tʃ ɪ w ə n
SAT, s ˈæ t
SATELLITE, s ˈæ t ə l ˌaɪ t
SATISFACTION, s ˌæ t ɪ s f ˈæ k ʃ ə n
SATISFACTORY(1), s ˌæ t ɪ s f ˈæ k t ɹ iː
SATISFACTORY(2), s ˌæ t ɪ s f ˈæ k t ə ɹ iː
SATISFIED, s ˈæ t ɪ s f ˌaɪ d
SATISFY, s ˈæ t ɪ s f ˌaɪ
SATURDAY(1), s ˈæ t ə d iː
SATURDAY(2), s ˈæ t ˌɪ d ˌeɪ
SATURDAYS(1), s ˈæ t ə d iː z
SATURDAYS(2), s ˈæ t ə d eɪ z
SAUCE, s ˈɔː s
SAUCEPAN, s ˈɔː s p ˌæ n
SAUCER, s ˈɔː s ə
SAUDI(1), s ˈaʊ d iː
SAUDI(2), s ˈɔː d iː
SAUSAGE, s ˈɒ s ɪ dʒ
SAUSAGES, s ˈɒ s ɪ dʒ ɪ z
SAVE, s ˈeɪ v
SAVED, s ˈeɪ v d
SAVER, s ˈeɪ v ə
SAVES, s ˈeɪ v z
SAVING, s ˈeɪ v ɪ ŋ
SAVINGS, s ˈeɪ v ɪ ŋ z
SAW, s ˈɔː
SAY, s ˈeɪ
SAYING, s ˈeɪ ɪ ŋ
SAYS, s ˈɛ z
SCALE, s k ˈeɪ l
SCALES, s k ˈeɪ l z
SCAN, s k ˈæ n
SCANNER, s k ˈæ n ə
SCANNERS, s k ˈæ n ə z
SCANNING, s k ˈæ n ɪ ŋ
SCARBOROUGH, s k ˈɑː b ə ɹ ə
SCARCELY, s k ˈɛə s l iː
SCARED, s k ˈɛə d
SCARF, s k ˈɑː f
SCARY, s k ˈɛə ɹ iː
SCENARIO, s ɪ n ˈɑː ɹ ɪ əʊ
SCENE, s ˈiː n
SCENES, s ˈiː n z
SCHEDULE(1), ʃ ˈɛ dʒ uː l
SCHEDULE(2), s k ˈɛ dʒ ʊə l
SCHEDULED(1), ʃ ˈɛ dʒ uː l d
SCHEDULED(2), s k ˈɛ dʒ ʊə l d
SCHEDULES(1), ʃ ˈɛ dʒ uː l z
SCHEDULES(2), s k ˈɛ dʒ ʊə l z
SCHEDULING(1), ʃ ˈɛ dʒ uː l ɪ ŋ
SCHEDULING(2), s k ˈɛ dʒ ʊə l ɪ ŋ
SCHEME, s k ˈiː m
SCHEMES, s k ˈiː m z
SCHOLARS, s k ˈɒ l ə z
SCHOLARSHIP, s k ˈɒ l ə ʃ ˌɪ p
SCHOLARSHIPS, s k ˈɒ l ə ʃ ˌɪ p s
SCHOOL, s k ˈuː l
SCHOOLS, s k ˈuː l z
SCIENCE, s ˈaɪ ə n s
SCIENCES, s ˈaɪ ə n s ɪ z
SCIENTIFIC, s ˌaɪ ə n t ˈɪ f ɪ k
SCIENTIST, s ˈaɪ ə n t ɪ s t
SCIENTISTS, s ˈaɪ ə n t ɪ s t s
SCISSORS, s ˈɪ z ə z
SCOOTER, s k ˈuː t ə
SCOPE, s k ˈəʊ p
SCORE, s k ˈɔː
SCORED, s k ˈɔː d
SCORES, s k ˈɔː z
SCORING, s k ˈɔː ɹ ɪ ŋ
SCOTLAND, s k ˈɒ t l ə n d
SCOTT, s k ˈɒ t
SCOTTISH, s k ˈɒ t ɪ ʃ
SCRAP, s k ɹ ˈæ p
SCRATCH, s k ɹ ˈæ tʃ
SCRATCHING, s k ɹ ˈæ tʃ ɪ ŋ
SCREAMING, s k ɹ ˈiː m ɪ ŋ
SCREEN, s k ɹ ˈiː n
SCREENING, s k ɹ ˈiː n ɪ ŋ
SCREENS, s k ɹ ˈiː n z
SCREW, s k ɹ ˈuː
SCREWDRIVER, s k ɹ ˈuː d ɹ ˌaɪ v ə
SCREWS, s k ɹ ˈuː z
SCRIPT, s k ɹ ˈɪ p t
SCRIPTS, s k ɹ ˈɪ p t s
SCRIPTURES, s k ɹ ˈɪ p tʃ ə z
SCROLL, s k ɹ ˈəʊ l
SCULPTURE, s k ˈɐ l p tʃ ə
SE, s ˈeɪ
SEA, s ˈiː
SEAFOOD, s ˈiː f ˌuː d
SEAL, s ˈiː l
SEALED, s ˈiː l d
SEAN, ʃ ˈɔː n
SEARCH, s ˈɜː tʃ
SEARCHED, s ˈɜː tʃ t
SEARCHES, s ˈɜː tʃ ɪ z
SEARCHING, s ˈɜː tʃ ɪ ŋ
SEASON, s ˈiː z ə n
SEASONAL, s ˈiː z ə n ə l
SEASONS, s ˈiː z ə n z
SEAT, s ˈiː t
SEATING, s ˈiː t ɪ ŋ
SEATS, s ˈiː t s
SEATTLE, s ɪ ˈæ t ə l
SEC, s ˈɛ k
SECOND, s ˈɛ k ə n d
SECONDARY, s ˈɛ k ə n d ə ɹ iː
SECONDLY, s ˈɛ k ə n d l iː
SECONDS, s ˈɛ k ə n d z
SECRET(1), s ˈiː k ɹ ə t
SECRET(2), s ˈiː k ɹ ɪ t
SECRETARY, s ˈɛ k ɹ ə t ə ɹ iː
SECRETS(1), s ˈiː k ɹ ə t s
SECRETS(2), s ˈiː k ɹ ɪ t s
SECTION, s ˈɛ k ʃ ə n
SECTIONS, s ˈɛ k ʃ ə n z
SECTOR, s ˈɛ k t ə
SECTORS, s ˈɛ k t ə z
SECURE, s ɪ k ˈjʊə
SECURED, s ɪ k ˈjʊə d
SECURITIES, s ɪ k ˈjʊə ɹ ɪ t iː z
SECURITY, s ɪ k ˈjʊə ɹ ɪ t iː
SEE, s ˈiː
SEED, s ˈiː d
SEEDS, s ˈiː d z
SEEING, s ˈiː ɪ ŋ
SEEK, s ˈiː k
SEEKER, s ˈiː k ə
SEEKING, s ˈiː k ɪ ŋ
SEEKS, s ˈiː k s
SEEM, s ˈiː m
SEEMED, s ˈiː m d
SEEMS, s ˈiː m z
SEEN, s ˈiː n
SEES, s ˈiː z
SEGMENT(1), s ˈɛ g m ə n t
SEGMENT(2), s ˌɛ g m ˈɛ n t
SEGMENTS(1), s ˈɛ g m ə n t s
SEGMENTS(2), s ˌɛ g m ˈɛ n t s
SELDOM, s ˈɛ l d ə m
SELECT, s ə l ˈɛ k t
SELECTED, s ə l ˈɛ k t ɪ d
SELECTING, s ə l ˈɛ k t ɪ ŋ
SELECTION, s ɪ l ˈɛ k ʃ ə n
SELECTIONS, s ə l ˈɛ k ʃ ə n z
SELF, s ˈɛ l f
SELL, s ˈɛ l
SELLER, s ˈɛ l ə
SELLERS, s ˈɛ l ə z
SELLING, s ˈɛ l ɪ ŋ
SELLS, s ˈɛ l z
SEMESTER, s ə m ˈɛ s t ə
SEMI, s ˈɛ m iː
SEMICONDUCTOR, s ˌɛ m ɪ k ə n d ˈɐ k t ə
SEMINAR, s ˈɛ m ɪ n ˈɑː
SEMINARS, s ˈɛ m ɪ n ˌɑː z
SENATE, s ˈɛ n ɪ t
SENATOR, s ˈɛ n ə t ə
SEND, s ˈɛ n d
SENDER, s ˈɛ n d ə
SENDING, s ˈɛ n d ɪ ŋ
SENDS, s ˈɛ n d z
SENIOR, s ˈiː n j ə
SENIORS, s ˈiː n j ə z
SENSE, s ˈɛ n s
SENSES, s ˈɛ n s ɪ z
SENSIBLE, s ˈɛ n s ɪ b ə l
SENSITIVE, s ˈɛ n s ɪ t ɪ v
SENSITIVITY, s ˌɛ n s ɪ t ˈɪ v ɪ t iː
SENSOR, s ˈɛ n s ə
SENSORS, s ˈɛ n s ə z
SENT, s ˈɛ n t
SENTENCE, s ˈɛ n t ə n s
SENTENCES, s ˈɛ n t ə n s ɪ z
SEPARATE(1), s ˈɛ p ɹ ə t
SEPARATE(2), s ˈɛ p ə ɹ ˌeɪ t
SEPARATED, s ˈɛ p ə ɹ ˌeɪ t ɪ d
SEPARATELY(1), s ˈɛ p ɹ ə t l iː
SEPARATELY(2), s ˈɛ p ə ɹ ə t l iː
SEPARATION, s ˌɛ p ə ɹ ˈeɪ ʃ ə n
SEPTEMBER, s ɛ p t ˈɛ m b ə
SEQUENCE, s ˈiː k w ə n s
SEQUENCES, s ˈiː k w ə n s ɪ z
SERGEANT, s ˈɑː dʒ ə n t
SERIAL, s ˈɪə ɹ ɪə l
SERIES, s ˈɪə ɹ iː z
SERIOUS, s ˈɪə ɹ ɪə s
SERIOUSLY, s ˈɪə ɹ ɪə s l iː
SERVANT, s ˈɜː v ə n t
SERVANTS, s ˈɜː v ə n t s
SERVE, s ˈɜː v
SERVED, s ˈɜː v d
SERVER, s ˈɜː v ə
SERVERS, s ˈɜː v ə z
SERVES, s ˈɜː v z
SERVICE, s ˈɜː v ɪ s
SERVICES, s ˈɜː v ɪ s ɪ z
SERVING, s ˈɜː v ɪ ŋ
SESSION, s ˈɛ ʃ ə n
SESSIONS, s ˈɛ ʃ ə n z
SET, s ˈɛ t
SETS, s ˈɛ t s
SETTING, s ˈɛ t ɪ ŋ
SETTINGS, s ˈɛ t ɪ ŋ z
SETTLE, s ˈɛ t ə l
SETTLED, s ˈɛ t ə l d
SETTLEMENT, s ˈɛ t ə l m ə n t
SETUP, s ˈɛ t ˌɐ p
SEVEN, s ˈɛ v ə n
SEVENS, s ˈɛ v ə n z
SEVENTEEN, s ˈɛ v ə n t ˈiː n
SEVENTH, s ˈɛ v ə n θ
SEVENTIES, s ˈɛ v ə n t iː z
SEVENTY, s ˈɛ v ə n t iː
SEVERAL(1), s ˈɛ v ɹ ə l
SEVERAL(2), s ˈɛ v ə ɹ ə l
SEVERE, s ə v ˈɪə
SEVERELY, s ə v ˈɪə l iː
SEX, s ˈɛ k s
SEXUAL, s ˈɛ k ʃ ʊə l
SEXY, s ˈɛ k s iː
SH, ʃ
SHA, ʃ ˈɑː
SHADE, ʃ ˈeɪ d
SHADOW, ʃ ˈæ d ˌəʊ
SHAKE, ʃ ˈeɪ k
SHAKESPEARE, ʃ ˈeɪ k s p ˌɪə
SHAKING, ʃ ˈeɪ k ɪ ŋ
SHALL(1), ʃ ə l
SHALL(2), ʃ ˈæ l
SHAME, ʃ ˈeɪ m
SHAMPOO, ʃ æ m p ˈuː
SHANE, ʃ ˈeɪ n
SHANGHAI, ʃ ˈæ ŋ h ˈaɪ
SHAPE, ʃ ˈeɪ p
SHAPED, ʃ ˈeɪ p t
SHAPES, ʃ ˈeɪ p s
SHARE, ʃ ˈɛə
SHARED, ʃ ˈɛə d
SHAREHOLDERS, ʃ ˈɛə h ˌəʊ l d ə z
SHARES, ʃ ˈɛə z
SHAREWARE, ʃ ˈɛə w ˌɛə
SHARING, ʃ ˈɛə ɹ ɪ ŋ
SHARON(1), ʃ ˈæ ɹ ə n
SHARON(2), ʃ ə ɹ ˈɒ n
SHARP, ʃ ˈɑː p
SHARPLY, ʃ ˈɑː p l iː
SHAUN, ʃ ˈɔː n
SHAVE, ʃ ˈeɪ v
SHAVED, ʃ ˈeɪ v d
SHAW, ʃ ˈɔː
SHE, ʃ ˈiː
SHED, ʃ ˈɛ d
SHEEP, ʃ ˈiː p
SHEER, ʃ ˈɪə
SHEET, ʃ ˈiː t
SHEETS, ʃ ˈiː t s
SHEFFIELD, ʃ ˈɛ f iː l d
SHEILA, ʃ ˈiː l ə
SHELF, ʃ ˈɛ l f
SHELL, ʃ ˈɛ l
SHELLEY, ʃ ˈɛ l iː
SHELTER, ʃ ˈɛ l t ə
SHELVES, ʃ ˈɛ l v z
SHERRY, ʃ ˈɛ ɹ iː
SHH, ʃ
SHIELD, ʃ ˈiː l d
SHIFT, ʃ ˈɪ f t
SHINE, ʃ ˈaɪ n
SHINING, ʃ ˈaɪ n ɪ ŋ
SHINY, ʃ ˈaɪ n iː
SHIP, ʃ ˈɪ p
SHIPMENT, ʃ ˈɪ p m ə n t
SHIPPED, ʃ ˈɪ p t
SHIPPING, ʃ ˈɪ p ɪ ŋ
SHIPS, ʃ ˈɪ p s
SHIRLEY, ʃ ˈɜː l iː
SHIRT, ʃ ˈɜː t
SHIRTS, ʃ ˈɜː t s
SHIT, ʃ ˈɪ t
SHOCK, ʃ ˈɒ k
SHOCKING, ʃ ˈɒ k ɪ ŋ
SHOE, ʃ ˈuː
SHOES, ʃ ˈuː z
SHOOK, ʃ ˈʊ k
SHOOT, ʃ ˈuː t
SHOOTING, ʃ ˈuː t ɪ ŋ
SHOP, ʃ ˈɒ p
SHOPPER, ʃ ˈɒ p ə
SHOPPERS, ʃ ˈɒ p ə z
SHOPPING, ʃ ˈɒ p ɪ ŋ
SHOPS, ʃ ˈɒ p s
SHORE, ʃ ˈɔː
SHORT, ʃ ˈɔː t
SHORTER, ʃ ˈɔː t ə
SHORTLY, ʃ ˈɔː t l iː
SHORTS, ʃ ˈɔː t s
SHOT, ʃ ˈɒ t
SHOTS, ʃ ˈɒ t s
SHOULD, ʃ ˈʊ d
SHOULDER, ʃ ˈəʊ l d ə
SHOULDERS, ʃ ˈəʊ l d ə z
SHOUT, ʃ ˈaʊ t
SHOUTED, ʃ ˈaʊ t ɪ d
SHOUTING, ʃ ˈaʊ t ɪ ŋ
SHOVE, ʃ ˈɐ v
SHOW, ʃ ˈəʊ
SHOWCASE, ʃ ˈəʊ k ˌeɪ s
SHOWED, ʃ ˈəʊ d
SHOWER, ʃ ˈaʊ ə
SHOWERS, ʃ ˈaʊ ə z
SHOWING, ʃ ˈəʊ ɪ ŋ
SHOWN, ʃ ˈəʊ n
SHOWS, ʃ ˈəʊ z
SHRUGGED, ʃ ɹ ˈɐ g d
SHUFFLE, ʃ ˈɐ f ə l
SHUT, ʃ ˈɐ t
SHUTTING, ʃ ˈɐ t ɪ ŋ
SHUTTLE, ʃ ˈɐ t ə l
SHY, ʃ ˈaɪ
SI, s ˈiː
SICK, s ˈɪ k
SID, s ˈɪ d
SIDE, s ˈaɪ d
SIDES, s ˈaɪ d z
SIEMENS, s ˈiː m ə n z
SIERRA, s ɪ ˈɛə ɹ ə
SIG, s ˈɪ g
SIGHED, s ˈaɪ d
SIGHT, s ˈaɪ t
SIGMA, s ˈɪ g m ə
SIGN, s ˈaɪ n
SIGNAL, s ˈɪ g n ə l
SIGNALS, s ˈɪ g n ə l z
SIGNATURE, s ˈɪ g n ə tʃ ə
SIGNED, s ˈaɪ n d
SIGNIFICANCE, s ɪ g n ˈɪ f ɪ k ə n s
SIGNIFICANT, s ɪ g n ˈɪ f ɪ k ə n t
SIGNIFICANTLY, s ɪ g n ˈɪ f ɪ k ə n t l iː
SIGNING, s ˈaɪ n ɪ ŋ
SIGNS, s ˈaɪ n z
SILENCE, s ˈaɪ l ə n s
SILENT, s ˈaɪ l ə n t
SILICON, s ˈɪ l ɪ k ə n
SILK, s ˈɪ l k
SILLY, s ˈɪ l iː
SILVER, s ˈɪ l v ə
SIM, s ˈɪ m
SIMILAR, s ˈɪ m ɪ l ə
SIMILARLY, s ˈɪ m ɪ l ə l iː
SIMON, s ˈaɪ m ə n
SIMPLE, s ˈɪ m p ə l
SIMPLY, s ˈɪ m p l iː
SIMPSON, s ˈɪ m p s ə n
SIMS, s ˈɪ m z
SIMULATION, s ˌɪ m jʊ l ˈeɪ ʃ ə n
SIMULTANEOUSLY, s ˌɪ m ə l t ˈeɪ n ɪə s l iː
SIN, s ˈɪ n
SINCE, s ˈɪ n s
SING, s ˈɪ ŋ
SINGAPORE, s ˈɪ ŋ ə p ˌɔː
SINGER, s ˈɪ ŋ ə
SINGING, s ˈɪ ŋ ɪ ŋ
SINGLE, s ˈɪ ŋ g ə l
SINGLES, s ˈɪ ŋ g ə l z
SINK, s ˈɪ ŋ k
SIR, s ˈɜː
SISTER, s ˈɪ s t ə
SISTERS, s ˈɪ s t ə z
SIT, s ˈɪ t
SITE, s ˈaɪ t
SITES, s ˈaɪ t s
SITS, s ˈɪ t s
SITTING, s ˈɪ t ɪ ŋ
SITUATED, s ˈɪ tʃ ʊə t ɪ d
SITUATION, s ˌɪ tʃ ʊ ˈeɪ ʃ ə n
SITUATIONS, s ˌɪ tʃ ʊ ˈeɪ ʃ ə n z
SIX, s ˈɪ k s
SIXES, s ˈɪ k s ɪ z
SIXTEEN(1), s ɪ k s t ˈiː n
SIXTEEN(2), s ˈɪ k s t ˌiː n
SIXTH, s ˈɪ k s θ
SIXTIES, s ˈɪ k s t iː z
SIXTY, s ˈɪ k s t iː
SIZE, s ˈaɪ z
SIZED, s ˈaɪ z d
SIZES, s ˈaɪ z ɪ z
SKI, s k ˈiː
SKIING, s k ˈiː ɪ ŋ
SKILL, s k ˈɪ l
SKILLED, s k ˈɪ l d
SKILLS, s k ˈɪ l z
SKIN, s k ˈɪ n
SKINNY, s k ˈɪ n iː
SKINS, s k ˈɪ n z
SKIP, s k ˈɪ p
SKIRT, s k ˈɜː t
SKY, s k ˈaɪ
SKYPE, s k ˈaɪ p
SLAG, s l ˈæ g
SLANG, s l ˈæ ŋ
SLAP, s l ˈæ p
SLASH, s l ˈæ ʃ
SLAVE, s l ˈeɪ v
SLEEP, s l ˈiː p
SLEEPING, s l ˈiː p ɪ ŋ
SLEEPS, s l ˈiː p s
SLEEPY, s l ˈiː p iː
SLEEVE, s l ˈiː v
SLEEVES, s l ˈiː v z
SLEPT, s l ˈɛ p t
SLICE, s l ˈaɪ s
SLICES, s l ˈaɪ s ɪ z
SLIDE, s l ˈaɪ d
SLIDES, s l ˈaɪ d z
SLIGHT, s l ˈaɪ t
SLIGHTLY, s l ˈaɪ t l iː
SLIM, s l ˈɪ m
SLIP, s l ˈɪ p
SLIPPED, s l ˈɪ p t
SLIPPERS, s l ˈɪ p ə z
SLIPPING, s l ˈɪ p ɪ ŋ
SLOT, s l ˈɒ t
SLOTS, s l ˈɒ t s
SLOVAKIA, s l ˌəʊ v ˈæ k ɪə
SLOVENIA, s l ˌəʊ v ˈiː n ɪə
SLOW, s l ˈəʊ
SLOWLY, s l ˈəʊ l iː
SLUT, s l ˈɐ t
SMACK, s m ˈæ k
SMALL, s m ˈɔː l
SMALLER, s m ˈɔː l ə
SMART, s m ˈɑː t
SMASH, s m ˈæ ʃ
SMASHED, s m ˈæ ʃ t
SMASHING, s m ˈæ ʃ ɪ ŋ
SMELL, s m ˈɛ l
SMELLS, s m ˈɛ l z
SMELLY, s m ˈɛ l iː
SMILE, s m ˈaɪ l
SMILED, s m ˈaɪ l d
SMILING, s m ˈaɪ l ɪ ŋ
SMITH, s m ˈɪ θ
SMITHS, s m ˈɪ θ s
SMOKE, s m ˈəʊ k
SMOKES, s m ˈəʊ k s
SMOKING, s m ˈəʊ k ɪ ŋ
SMOOTH, s m ˈuː ð
SNAKE, s n ˈeɪ k
SNAP, s n ˈæ p
SNAPPED, s n ˈæ p t
SNAPSHOT, s n ˈæ p ʃ ˌɒ t
SNOOKER, s n ˈuː k ə
SNOW, s n ˈəʊ
SNOWMAN, s n ˈəʊ m ˌæ n
SO, s ˈəʊ
SO-CALLED, s ˈəʊ k ˈɔː l d
SOAKING, s ˈəʊ k ɪ ŋ
SOAP, s ˈəʊ p
SOCCER, s ˈɒ k ə
SOCIAL, s ˈəʊ ʃ ə l
SOCIALISM, s ˈəʊ ʃ ə l ˌɪ z ə m
SOCIALIST, s ˈəʊ ʃ ə l ɪ s t
SOCIALLY, s ˈəʊ ʃ ə l iː
SOCIETIES, s ə s ˈaɪ ə t iː z
SOCIETY, s ə s ˈaɪ ə t iː
SOCIOLOGY, s ˌəʊ s ɪ ˈɒ l ə dʒ iː
SOCKET, s ˈɒ k ɪ t
SOCKS, s ˈɒ k s
SOD, s ˈɒ d
SODIUM, s ˈəʊ d ɪə m
SOFA, s ˈəʊ f ə
SOFT, s ˈɒ f t
SOFTLY, s ˈɒ f t l iː
SOFTWARE(1), s ˈɒ f w ˌɛə
SOFTWARE(2), s ˈɒ f t w ˌɛə
SOIL, s ˈɔɪ l
SOL, s ˈɒ l
SOLAR, s ˈəʊ l ə
SOLD, s ˈəʊ l d
SOLDIER, s ˈəʊ l dʒ ə
SOLDIERS, s ˈəʊ l dʒ ə z
SOLE, s ˈəʊ l
SOLELY, s ˈəʊ l l iː
SOLICITOR, s ə l ˈɪ s ɪ t ə
SOLICITORS, s ə l ˈɪ s ɪ t ə z
SOLID, s ˈɒ l ɪ d
SOLO, s ˈəʊ l ˌəʊ
SOLOMON, s ˈɒ l ə m ə n
SOLUTION, s ə l ˈuː ʃ ə n
SOLUTIONS, s ə l ˈuː ʃ ə n z
SOLVE, s ˈɒ l v
SOLVING, s ˈɒ l v ɪ ŋ
SOMA, s ˈəʊ m ə
SOME, s ˈɐ m
SOMEBODY(1), s ˈɐ m b ə d iː
SOMEBODY(2), s ˈɐ m b ˌɒ d iː
SOMEHOW, s ˈɐ m h ˌaʊ
SOMEONE, s ˈɐ m w ˌɐ n
SOMETHING, s ˈɐ m θ ɪ ŋ
SOMETIME, s ˈɐ m t ˌaɪ m
SOMETIMES(1), s ə m t ˈaɪ m z
SOMETIMES(2), s ˈɐ m t ˌaɪ m z
SOMEWHAT, s ˌɐ m w ˈɒ t
SOMEWHERE, s ˈɐ m w ˌɛə
SON, s ˈɐ n
SONG, s ˈɒ ŋ
SONGS, s ˈɒ ŋ z
SONIC, s ˈɒ n ɪ k
SONS, s ˈɐ n z
SONY, s ˈəʊ n iː
SOON, s ˈuː n
SOONER, s ˈuː n ə
SOONEST, s ˈuː n ə s t
SOPHISTICATED, s ə f ˈɪ s t ɪ k ˌeɪ t ɪ d
SORE, s ˈɔː
SORRY, s ˈɒ ɹ iː
SORT, s ˈɔː t
SORTED, s ˈɔː t ɪ d
SORTING, s ˈɔː t ɪ ŋ
SORTS, s ˈɔː t s
SOUGHT, s ˈɔː t
SOUL, s ˈəʊ l
SOUND, s ˈaʊ n d
SOUNDED, s ˈaʊ n d ɪ d
SOUNDS, s ˈaʊ n d z
SOUNDTRACK, s ˈaʊ n d t ɹ ˌæ k
SOUP, s ˈuː p
SOURCE, s ˈɔː s
SOURCES, s ˈɔː s ɪ z
SOUTH, s ˈaʊ θ
SOUTHAMPTON, s aʊ θ h ˈæ m p t ə n
SOUTHEAST, s ˌaʊ θ ˈiː s t
SOUTHERN, s ˈɐ ð ə n
SOUTHWEST, s ˌaʊ θ w ˈɛ s t
SOVIET, s ˈəʊ v ɪə t
SPA, s p ˈɑː
SPACE, s p ˈeɪ s
SPACES, s p ˈeɪ s ɪ z
SPADE, s p ˈeɪ d
SPAGHETTI, s p ə g ˈɛ t iː
SPAIN, s p ˈeɪ n
SPAM, s p ˈæ m
SPAN, s p ˈæ n
SPANISH, s p ˈæ n ɪ ʃ
SPANKING, s p ˈæ ŋ k ɪ ŋ
SPANS, s p ˈæ n z
SPARE, s p ˈɛə
SPARKS, s p ˈɑː k s
SPATIAL, s p ˈeɪ ʃ ə l
SPEAK, s p ˈiː k
SPEAKER, s p ˈiː k ə
SPEAKERS, s p ˈiː k ə z
SPEAKING, s p ˈiː k ɪ ŋ
SPEAKS, s p ˈiː k s
SPEARS, s p ˈɪə z
SPEC, s p ˈɛ k
SPECIAL, s p ˈɛ ʃ ə l
SPECIALIST, s p ˈɛ ʃ ə l ɪ s t
SPECIALISTS, s p ˈɛ ʃ ə l ɪ s t s
SPECIALIZED, s p ˈɛ ʃ ə l ˌaɪ z d
SPECIALLY(1), s p ˈɛ ʃ l iː
SPECIALLY(2), s p ˈɛ ʃ ə l iː
SPECIALS, s p ˈɛ ʃ ə l z
SPECIALTY, s p ˈɛ ʃ ə l t iː
SPECIES, s p ˈiː ʃ iː z
SPECIFIC(1), s p ə s ˈɪ f ɪ k
SPECIFIC(2), s p ɪ s ˈɪ f ɪ k
SPECIFICALLY, s p ə s ˈɪ f ɪ k l iː
SPECIFICATION, s p ˌɛ s ɪ f ɪ k ˈeɪ ʃ ə n
SPECIFICATIONS, s p ˌɛ s ɪ f ɪ k ˈeɪ ʃ ə n z
SPECIFICS, s p ɪ s ˈɪ f ɪ k s
SPECIFIED, s p ˈɛ s ɪ f ˌaɪ d
SPECIFY, s p ˈɛ s ɪ f ˌaɪ
SPECIMEN, s p ˈɛ s ɪ m ə n
SPECIMENS, s p ˈɛ s ɪ m ə n z
SPECS, s p ˈɛ k s
SPECTACULAR, s p ɛ k t ˈæ k jʊ l ə
SPECTRUM, s p ˈɛ k t ɹ ə m
SPECULATION, s p ˌɛ k jʊ l ˈeɪ ʃ ə n
SPEECH, s p ˈiː tʃ
SPEED, s p ˈiː d
SPEEDS, s p ˈiː d z
SPELL, s p ˈɛ l
SPELLING, s p ˈɛ l ɪ ŋ
SPELLINGS, s p ˈɛ l ɪ ŋ z
SPENCER, s p ˈɛ n s ə
SPENCERS, s p ˈɛ n s ə z
SPEND, s p ˈɛ n d
SPENDING, s p ˈɛ n d ɪ ŋ
SPENDS, s p ˈɛ n d z
SPENT, s p ˈɛ n t
SPICE, s p ˈaɪ s
SPIDER, s p ˈaɪ d ə
SPILL, s p ˈɪ l
SPIN, s p ˈɪ n
SPIRIT, s p ˈɪ ɹ ɪ t
SPIRITS, s p ˈɪ ɹ ɪ t s
SPIRITUAL, s p ˈɪ ɹ ɪ tʃ jʊə l
SPIRITUALITY, s p ˌɪ ɹ ɪ tʃ jʊə l ɪ t iː
SPLENDID, s p l ˈɛ n d ɪ d
SPLIT, s p l ˈɪ t
SPOIL, s p ˈɔɪ l
SPOKE, s p ˈəʊ k
SPOKEN, s p ˈəʊ k ə n
SPOKESMAN, s p ˈəʊ k s m ə n
SPONGE, s p ˈɐ n dʒ
SPONSOR, s p ˈɒ n s ə
SPONSORED, s p ˈɒ n s ə d
SPONSORS, s p ˈɒ n s ə z
SPONSORSHIP, s p ˈɒ n s ə ʃ ˌɪ p
SPOON, s p ˈuː n
SPORT, s p ˈɔː t
SPORTING, s p ˈɔː t ɪ ŋ
SPORTS, s p ˈɔː t s
SPOT, s p ˈɒ t
SPOTLIGHT, s p ˈɒ t l ˌaɪ t
SPOTS, s p ˈɒ t s
SPOUSE, s p ˈaʊ s
SPRAY, s p ɹ ˈeɪ
SPREAD, s p ɹ ˈɛ d
SPRING, s p ɹ ˈɪ ŋ
SPRINGFIELD, s p ɹ ˈɪ ŋ f ˌiː l d
SPRINGS, s p ɹ ˈɪ ŋ z
SPRINT, s p ɹ ˈɪ n t
SPROUTS, s p ɹ ˈaʊ t s
SPUDS, s p ˈɐ d z
SPY, s p ˈaɪ
SPYWARE, s p ˈaɪ w ˌɛə
SQUAD, s k w ˈɒ d
SQUARE, s k w ˈɛə
SQUARED, s k w ˈɛə d
SQUARES, s k w ˈɛə z
SQUASH, s k w ˈɒ ʃ
SQUEEZE, s k w ˈiː z
SQUIRTING, s k w ˈɜː t ɪ ŋ
SRI LANKA, s ɹ ˌiː l ˈæ ŋ k ə
STA, s t ˈɑː
STABILITY, s t ə b ˈɪ l ɪ t iː
STABLE, s t ˈeɪ b ə l
STACEY, s t ˈeɪ s iː
STACK, s t ˈæ k
STADIUM, s t ˈeɪ d ɪə m
STAFF, s t ˈɑː f
STAFFING, s t ˈɑː f ɪ ŋ
STAGE, s t ˈeɪ dʒ
STAGES, s t ˈeɪ dʒ ɪ z
STAINLESS, s t ˈeɪ n l ə s
STAIRS, s t ˈɛə z
STAKE, s t ˈeɪ k
STALL, s t ˈɔː l
STAMP, s t ˈæ m p
STAMPS, s t ˈæ m p s
STANCE, s t ˈɑː n s
STAND, s t ˈæ n d
STANDARD, s t ˈæ n d ə d
STANDARDS, s t ˈæ n d ə d z
STANDING, s t ˈæ n d ɪ ŋ
STANDS, s t ˈæ n d z
STANFORD, s t ˈæ n f ə d
STANLEY, s t ˈæ n l iː
STAR, s t ˈɑː
STARED, s t ˈɛə d
STARING, s t ˈɛə ɹ ɪ ŋ
STARRING, s t ˈɑː ɹ ɪ ŋ
STARS, s t ˈɑː z
START, s t ˈɑː t
STARTED, s t ˈɑː t ɪ d
STARTER, s t ˈɑː t ə
STARTERS, s t ˈɑː t ə z
STARTING, s t ˈɑː t ɪ ŋ
STARTS, s t ˈɑː t s
STARTUP, s t ˈɑː t ˌɐ p
STARVING, s t ˈɑː v ɪ ŋ
STAT, s t ˈæ t
STATE, s t ˈeɪ t
STATED, s t ˈeɪ t ɪ d
STATEMENT, s t ˈeɪ t m ə n t
STATEMENTS, s t ˈeɪ t m ə n t s
STATES, s t ˈeɪ t s
STATEWIDE, s t ˈeɪ t w ˌaɪ d
STATIC, s t ˈæ t ɪ k
STATION, s t ˈeɪ ʃ ə n
STATIONS, s t ˈeɪ ʃ ə n z
STATISTICAL, s t ə t ˈɪ s t ɪ k ə l
STATISTICS, s t ə t ˈɪ s t ɪ k s
STATS, s t ˈæ t s
STATUS, s t ˈeɪ t ə s
STATUTE, s t ˈæ tʃ uː t
STATUTES, s t ˈæ tʃ uː t s
STATUTORY, s t ˈæ tʃ ʊ t ə ɹ iː
STAY, s t ˈeɪ
STAYED, s t ˈeɪ d
STAYING, s t ˈeɪ ɪ ŋ
STAYS, s t ˈeɪ z
STEADILY, s t ˈɛ d ɪ l iː
STEADY, s t ˈɛ d iː
STEAK, s t ˈeɪ k
STEAM, s t ˈiː m
STEEL, s t ˈiː l
STEEP, s t ˈiː p
STEERING, s t ˈɪə ɹ ɪ ŋ
STEM, s t ˈɛ m
STEP, s t ˈɛ p
STEPHANIE, s t ˈɛ f ə n iː
STEPHEN, s t ˈiː v ə n
STEPPED, s t ˈɛ p t
STEPS, s t ˈɛ p s
STEREO, s t ˈɛ ɹ ɪ ˌəʊ
STERLING, s t ˈɜː l ɪ ŋ
STEVE, s t ˈiː v
STEVEN, s t ˈiː v ə n
STEVENS, s t ˈiː v ə n z
STEW, s t ˈuː
STEWART, s t ˈjʊə t
STICK, s t ˈɪ k
STICKER, s t ˈɪ k ə
STICKERS, s t ˈɪ k ə z
STICKING, s t ˈɪ k ɪ ŋ
STICKS, s t ˈɪ k s
STICKY, s t ˈɪ k iː
STILL, s t ˈɪ l
STIMULUS, s t ˈɪ m jʊ l ə s
STINKS, s t ˈɪ ŋ k s
STOCK, s t ˈɒ k
STOCKINGS, s t ˈɒ k ɪ ŋ z
STOCKS, s t ˈɒ k s
STOKE, s t ˈəʊ k
STOLEN, s t ˈəʊ l ə n
STOMACH, s t ˈɐ m ə k
STONE, s t ˈəʊ n
STONES, s t ˈəʊ n z
STOOD, s t ˈʊ d
STOOL, s t ˈuː l
STOP, s t ˈɒ p
STOPPED, s t ˈɒ p t
STOPPING, s t ˈɒ p ɪ ŋ
STOPS, s t ˈɒ p s
STORAGE, s t ˈɒ ɹ ɪ dʒ
STORE, s t ˈɔː
STORED, s t ˈɔː d
STORES, s t ˈɔː z
STORIES, s t ˈɔː ɹ iː z
STORM, s t ˈɔː m
STORY, s t ˈɔː ɹ iː
STRAIGHT, s t ɹ ˈeɪ t
STRAIGHTFORWARD, s t ɹ ˌeɪ t f ˈɔː w ə d
STRAIN, s t ɹ ˈeɪ n
STRANGE, s t ɹ ˈeɪ n dʒ
STRAP, s t ɹ ˈæ p
STRAPS, s t ɹ ˈæ p s
STRATEGIC, s t ɹ ə t ˈiː dʒ ɪ k
STRATEGIES, s t ɹ ˈæ t ɪ dʒ iː z
STRATEGY, s t ɹ ˈæ t ɪ dʒ iː
STRATFORD, s t ɹ ˈæ t f ə d
STRAW, s t ɹ ˈɔː
STRAWBERRIES, s t ɹ ˈɔː b ə ɹ iː z
STRAWBERRY, s t ɹ ˈɔː b ə ɹ iː
STREAM, s t ɹ ˈiː m
STREAMING, s t ɹ ˈiː m ɪ ŋ
STREAMS, s t ɹ ˈiː m z
STREET, s t ɹ ˈiː t
STREETS, s t ɹ ˈiː t s
STRENGTH(1), s t ɹ ˈɛ ŋ θ
STRENGTH(2), s t ɹ ˈɛ ŋ k θ
STRENGTHEN, s t ɹ ˈɛ ŋ θ ə n
STRENGTHS(1), s t ɹ ˈɛ ŋ θ s
STRENGTHS(2), s t ɹ ˈɛ ŋ k θ s
STRESS, s t ɹ ˈɛ s
STRETCH, s t ɹ ˈɛ tʃ
STRICT, s t ɹ ˈɪ k t
STRICTLY, s t ɹ ˈɪ k t l iː
STRIKE, s t ɹ ˈaɪ k
STRING, s t ɹ ˈɪ ŋ
STRINGS, s t ɹ ˈɪ ŋ z
STRIP, s t ɹ ˈɪ p
STROKE, s t ɹ ˈəʊ k
STRONG, s t ɹ ˈɒ ŋ
STRONGER, s t ɹ ˈɒ ŋ g ə
STRONGLY, s t ɹ ˈɒ ŋ l iː
STRUCK, s t ɹ ˈɐ k
STRUCTURAL, s t ɹ ˈɐ k tʃ ə ɹ ə l
STRUCTURE, s t ɹ ˈɐ k tʃ ə
STRUCTURED, s t ɹ ˈɐ k tʃ ə d
STRUCTURES, s t ɹ ˈɐ k tʃ ə z
STRUGGLE, s t ɹ ˈɐ g ə l
STRUGGLING, s t ɹ ˈɐ g l ɪ ŋ
STUART, s t ˈjʊə t
STUCK, s t ˈɐ k
STUD, s t ˈɐ d
STUDENT, s t ˈjuː d ə n t
STUDENTS, s t ˈjuː d ə n t s
STUDIED, s t ˈɐ d iː d
STUDIES, s t ˈɐ d iː z
STUDIO, s t ˈjuː d ɪ ˌəʊ
STUDIOS, s t ˈjuː d ɪ ˌəʊ z
STUDY, s t ˈɐ d iː
STUDYING, s t ˈɐ d iː ɪ ŋ
STUFF, s t ˈɐ f
STUNNING, s t ˈɐ n ɪ ŋ
STUPID, s t ˈjuː p ɪ d
STYLE, s t ˈaɪ l
STYLES, s t ˈaɪ l z
STYLISH, s t ˈaɪ l ɪ ʃ
STYLUS, s t ˈaɪ l ə s
SU, s ˈuː
SUB, s ˈɐ b
SUBCOMMITTEE, s ˈɐ b k ə m ˌɪ t iː
SUBJECT(1), s ə b dʒ ˈɛ k t
SUBJECT(2), s ˈɐ b dʒ ɪ k t
SUBJECTS(1), s ə b dʒ ˈɛ k t s
SUBJECTS(2), s ˈɐ b dʒ ɪ k t s
SUBLIME, s ə b l ˈaɪ m
SUBMISSION, s ə b m ˈɪ ʃ ə n
SUBMISSIONS, s ə b m ˈɪ ʃ ə n z
SUBMIT, s ə b m ˈɪ t
SUBMITTED, s ə b m ˈɪ t ɪ d
SUBMITTING, s ə b m ˈɪ t ɪ ŋ
SUBSCRIBE, s ə b s k ɹ ˈaɪ b
SUBSCRIBER, s ə b s k ɹ ˈaɪ b ə
SUBSCRIBERS, s ə b s k ɹ ˈaɪ b ə z
SUBSCRIPTION, s ə b s k ɹ ˈɪ p ʃ ə n
SUBSCRIPTIONS, s ə b s k ɹ ˈɪ p ʃ ə n z
SUBSECTION, s ˈɐ b s ɛ k ʃ ə n
SUBSEQUENT, s ˈɐ b s ɪ k w ə n t
SUBSEQUENTLY, s ˈɐ b s ɪ k w ə n t l iː
SUBSIDIARY, s ə b s ˈɪ d ɪə ɹ iː
SUBSTANCE, s ˈɐ b s t ə n s
SUBSTANCES, s ˈɐ b s t ə n s ɪ z
SUBSTANTIAL, s ə b s t ˈæ n ʃ ə l
SUBSTANTIALLY, s ə b s t ˈæ n ʃ ə l iː
SUBSTITUTE, s ˈɐ b s t ɪ t ˌjuː t
SUBTLE, s ˈɐ t ə l
SUCCEED, s ə k s ˈiː d
SUCCESS, s ə k s ˈɛ s
SUCCESSFUL, s ə k s ˈɛ s f ə l
SUCCESSFULLY, s ə k s ˈɛ s f ə l iː
SUCCESSION, s ə k s ˈɛ ʃ ə n
SUCCESSIVE, s ə k s ˈɛ s ɪ v
SUCCESSOR, s ə k s ˈɛ s ə
SUCH, s ˈɐ tʃ
SUCK, s ˈɐ k
SUCKING, s ˈɐ k ɪ ŋ
SUCKS, s ˈɐ k s
SUDAN, s uː d ˈɑː n
SUDDEN, s ˈɐ d ə n
SUDDENLY, s ˈɐ d ə n l iː
SUE, s ˈuː
SUFFER, s ˈɐ f ə
SUFFERED, s ˈɐ f ə d
SUFFERING(1), s ˈɐ f ɹ ɪ ŋ
SUFFERING(2), s ˈɐ f ə ɹ ɪ ŋ
SUFFICIENT, s ə f ˈɪ ʃ ə n t
SUFFICIENTLY, s ə f ˈɪ ʃ ə n t l iː
SUGAR, ʃ ˈʊ g ə
SUGGEST, s ə dʒ ˈɛ s t
SUGGESTED, s ə dʒ ˈɛ s t ɪ d
SUGGESTING, s ə dʒ ˈɛ s t ɪ ŋ
SUGGESTION, s ə dʒ ˈɛ s tʃ ə n
SUGGESTIONS, s ə dʒ ˈɛ s tʃ ə n z
SUGGESTS, s ə dʒ ˈɛ s t s
SUICIDE, s ˈuː ɪ s ˌaɪ d
SUIT, s ˈuː t
SUITABLE, s ˈuː t ə b ə l
SUITE, s w ˈiː t
SUITES, s w ˈiː t s
SUITS, s ˈuː t s
SULLIVAN, s ˈɐ l ɪ v ə n
SUM, s ˈɐ m
SUMMARY, s ˈɐ m ə ɹ iː
SUMMER, s ˈɐ m ə
SUMMIT, s ˈɐ m ɪ t
SUMS, s ˈɐ m z
SUN, s ˈɐ n
SUNDAY(1), s ˈɐ n d ˌiː
SUNDAY(2), s ˈɐ n d ˌeɪ
SUNDAYS(1), s ˈɐ n d ˌiː z
SUNDAYS(2), s ˈɐ n d ˌeɪ z
SUNDERLAND, s ˈɐ n d ə l ə n d
SUNGLASSES, s ˈɐ n g l ˌɑː s ɪ z
SUNNY, s ˈɐ n iː
SUNSET, s ˈɐ n s ˌɛ t
SUNSHINE, s ˈɐ n ʃ ˌaɪ n
SUPER, s ˈuː p ə
SUPERB, s ʊ p ˈɜː b
SUPERIOR, s uː p ˈɪə ɹ ɪə
SUPERMARKET, s ˈuː p ə m ˌɑː k ɪ t
SUPERVISION, s ˌuː p ə v ˈɪ ʒ ə n
SUPERVISOR, s ˈuː p ə v ˌaɪ z ə
SUPPER, s ˈɐ p ə
SUPPLEMENT(1), s ˈɐ p l ɪ m ə n t
SUPPLEMENT(2), s ɐ p l ɪ m ˈɛ n t
SUPPLEMENTS(1), s ˈɐ p l ɪ m ə n t s
SUPPLEMENTS(2), s ɐ p l ɪ m ˈɛ n t s
SUPPLIED, s ə p l ˈaɪ d
SUPPLIER, s ə p l ˈaɪ ə
SUPPLIERS, s ə p l ˈaɪ ə z
SUPPLIES, s ə p l ˈaɪ z
SUPPLY, s ə p l ˈaɪ
SUPPORT, s ə p ˈɔː t
SUPPORTED, s ə p ˈɔː t ɪ d
SUPPORTERS, s ə p ˈɔː t ə z
SUPPORTING, s ə p ˈɔː t ɪ ŋ
SUPPORTS, s ə p ˈɔː t s
SUPPOSE, s ə p ˈəʊ z
SUPPOSED, s ə p ˈəʊ z d
SUPPOSEDLY, s ə p ˈəʊ z ə d l iː
SUPREME, s ə p ɹ ˈiː m
SURE, ʃ ˈɔː
SURELY, ʃ ˈɔː l iː
SURF, s ˈɜː f
SURFACE, s ˈɜː f ə s
SURFACES, s ˈɜː f ə s ɪ z
SURFING, s ˈɜː f ɪ ŋ
SURGEON, s ˈɜː dʒ ə n
SURGERY, s ˈɜː dʒ ə ɹ iː
SURGICAL, s ˈɜː dʒ ɪ k ə l
SURNAME, s ˈɜː n ˌeɪ m
SURPLUS, s ˈɜː p l ə s
SURPRISE, s ə p ɹ ˈaɪ z
SURPRISED, s ə p ɹ ˈaɪ z d
SURPRISING, s ə p ɹ ˈaɪ z ɪ ŋ
SURPRISINGLY, s ə p ɹ ˈaɪ z ɪ ŋ l iː
SURREY, s ˈɐ ɹ iː
SURROUNDED, s ə ɹ ˈaʊ n d ɪ d
SURROUNDING, s ə ɹ ˈaʊ n d ɪ ŋ
SURVEILLANCE, s ə v ˈeɪ l ə n s
SURVEY(1), s ə v ˈeɪ
SURVEY(2), s ˈɜː v ˌeɪ
SURVEYS(1), s ə v ˈeɪ z
SURVEYS(2), s ˈɜː v ˌeɪ z
SURVIVAL, s ə v ˈaɪ v ə l
SURVIVE, s ə v ˈaɪ v
SUSAN, s ˈuː z ə n
SUSPECT(1), s ə s p ˈɛ k t
SUSPECT(2), s ˈɐ s p ˌɛ k t
SUSPENDED, s ə s p ˈɛ n d ɪ d
SUSPENSION, s ə s p ˈɛ n ʃ ə n
SUSPICION, s ə s p ˈɪ ʃ ə n
SUSPICIOUS, s ə s p ˈɪ ʃ ə s
SUSSEX, s ˈɐ s ɪ k s
SUSTAINABLE, s ə s t ˈeɪ n ə b ə l
SUSTAINED, s ə s t ˈeɪ n d
SUZUKI, s ə z ˈuː k iː
SWAP, s w ˈɒ p
SWAPPED, s w ˈɒ p t
SWEAR, s w ˈɛə
SWEARING, s w ˈɛə ɹ ɪ ŋ
SWEDEN, s w ˈiː d ə n
SWEDISH, s w ˈiː d ɪ ʃ
SWEET, s w ˈiː t
SWEETHEART, s w ˈiː t h ˈɑː t
SWEETIE, s w ˈiː t iː
SWEETS, s w ˈiː t s
SWIM, s w ˈɪ m
SWIMMING, s w ˈɪ m ɪ ŋ
SWINDON, s w ˈɪ n d ə n
SWING, s w ˈɪ ŋ
SWINGERS, s w ˈɪ ŋ ə z
SWISS, s w ˈɪ s
SWITCH, s w ˈɪ tʃ
SWITCHED, s w ˈɪ tʃ t
SWITCHES, s w ˈɪ tʃ ɪ z
SWITCHING, s w ˈɪ tʃ ɪ ŋ
SWITZERLAND, s w ˈɪ t s ə l ə n d
SWOLLEN, s w ˈəʊ l ə n
SWORD, s ˈɔː d
SWORE, s w ˈɔː
SYDNEY, s ˈɪ d n iː
SYMANTEC, s ɪ m ˈæ n t ˌɛ k
SYMBOL, s ˈɪ m b ə l
SYMBOLS, s ˈɪ m b ə l z
SYMPATHETIC, s ˌɪ m p ə θ ˈɛ t ɪ k
SYMPATHY, s ˈɪ m p ə θ iː
SYMPHONY, s ˈɪ m f ə n iː
SYMPOSIUM, s ɪ m p ˈəʊ z ɪə m
SYMPTOMS, s ˈɪ m p t ə m z
SYNDICATE(1), s ˈɪ n d ɪ k ə t
SYNDICATE(2), s ˈɪ n d ɪ k ˌeɪ t
SYNDICATION, s ˌɪ n d ɪ k ˈeɪ ʃ ə n
SYNDROME, s ˈɪ n d ɹ ˌəʊ m
SYNOD, s ˈɪ n ə d
SYNOPSIS, s ɪ n ˈɒ p s ɪ s
SYNTAX, s ˈɪ n t ˌæ k s
SYNTHESIS, s ˈɪ n θ ɪ s ɪ s
SYNTHETIC, s ɪ n θ ˈɛ t ɪ k
SYRIA, s ˈɪə ɹ ɪə
SYRUP, s ˈɪ ɹ ə p
SYSTEM, s ˈɪ s t ə m
SYSTEMATIC, s ˌɪ s t ə m ˈæ t ɪ k
SYSTEMS, s ˈɪ s t ə m z
TA, t ˈɑː
TAB, t ˈæ b
TABLE, t ˈeɪ b ə l
TABLES, t ˈeɪ b ə l z
TABLET, t ˈæ b l ə t
TABLETS, t ˈæ b l ə t s
TABS, t ˈæ b z
